title,body,author,upvotes,comments,url,date,subreddit
For hire! Work from home!,"Looking for telemarketers for MCA (merchant cash-in advance) campaigns nationwide in US,that too work from home! People who have some what idea about this sector know the pay is pretty much above 13k or more from starting (based on your skills) and it goes upto 25k if u can show results, also this is a commission based work so if u can bring in leads u will obviously get rewarded for it.. DM me if u want more infos on this. Ill gladly help u out!",systematicallydead,0,7,https://www.reddit.com/r/Dhaka/comments/1p26x75/for_hire_work_from_home/,2025-11-20 22:02:03,Dhaka
Bangladeshi students in Australia,"I’ve recently gotten my student visa for RMIT in Australia and have also seen a rise in the number of students applying for Australia. So I was wondering how life is in Australia in terms of social life, the study load and just life in general. Hearing from anyone currently living there especially Melbourne would be great! ",Prudent_Resort_1038,5,24,https://www.reddit.com/r/Dhaka/comments/1p251jm/bangladeshi_students_in_australia/,2025-11-20 20:48:05,Dhaka
Learning video editing from scratch.,"Assalamu Alaikum, I'm 22. Wanna dive dip into video editing from beginning. 
Seeking for some advices...
Am I too late?
*NB: I quit study",Ghost_FS9,15,9,https://www.reddit.com/r/Dhaka/comments/1p24d5s/learning_video_editing_from_scratch/,2025-11-20 20:20:11,Dhaka
Research Paper Survey Questionnaire,"Hello everyone. Please kindly fill up this survey form for a English university research paper. This only applies to people who have taken English courses in university. Thank you in advance.

[https://forms.gle/FYzq3Q4rzghhiZtg8](https://forms.gle/FYzq3Q4rzghhiZtg8)",FarhanIslam,3,0,https://www.reddit.com/r/Dhaka/comments/1p24bvd/research_paper_survey_questionnaire/,2025-11-20 20:18:40,Dhaka
iFarmer. Is it good or scam?,As goes the headline,zke14,3,5,https://www.reddit.com/r/Dhaka/comments/1p24897/ifarmer_is_it_good_or_scam/,2025-11-20 20:14:26,Dhaka
Some thought on textile engineering,টেক্সটাইম ইঞ্জিনিয়ারিং কি আসলেই অনেক খারাপ মানে এটা থেকে কোন তেমন ভালো ফিউচার নেয় নাকি মানে কেমন? এটার‌ মাধ্যমে বাইরে লেখাপড়া করার সুযোগ বা কষ্ট করলে ম্যাক্সিমাম বেতন এগুলো সম্পর্কে কারো  কি‌ কোন ধারণা আছে বা কোন বড় ভাই বা কেউ যদি টেক্সটাইল ইঞ্জিনিয়ার অলরেডি লেখাপড়া করেন বা করতাছেন বা লেখাপড়া শেষ এখন জবে আছেন যদি নিজের এক্সপেরিয়েন্সটা শেয়ার করতেন অনেক বেশি উপকার হত,nirobaction,1,0,https://www.reddit.com/r/Dhaka/comments/1p247qf/some_thought_on_textile_engineering/,2025-11-20 20:13:50,Dhaka
Thinking of Visiting Ispahani Eye Hospital — How’s the Queue &amp; Service?,"Has anyone here been to Ispahani Eye Hospital in Farmgate? I’ve heard it’s really good for eyes, so I’m planning to visit. But I also heard the queues are usually very long. They have two types of services one around 50 BDT and another a bit more expensive, around 200 BDT.
If you’ve been there, please share your experience.",Suspicious_Cheek3878,4,6,https://www.reddit.com/r/Dhaka/comments/1p2463n/thinking_of_visiting_ispahani_eye_hospital_hows/,2025-11-20 20:11:52,Dhaka
Bangladeshi students in Canada.is it actually worth it? Need honest advice.,"Hey everyone,
I’m a Bangladeshi student and I’m thinking about studying in Canada now, but I really want to hear from other Bangladeshis who actually live there or studied there.

Is it really worth it?
How’s student life, job opportunities, PR chances, cost of living, and the overall experience?

I see so many mixed opinions online. Some people say Canada is great for students and PR, others say it’s getting harder and the expenses are too much. I just want the real picture no sugarcoating.

If you’re a Bangladeshi living/studying in Canada, can you share what it’s actually like?
",pikaa_pika,5,30,https://www.reddit.com/r/Dhaka/comments/1p245f8/bangladeshi_students_in_canadais_it_actually/,2025-11-20 20:11:04,Dhaka
Music,Can someone suggest me some good opera music? ,Ok_Entrepreneur_2812,3,5,https://www.reddit.com/r/Dhaka/comments/1p23un7/music/,2025-11-20 19:59:04,Dhaka
Where in Dhaka can i get these type of jackect/shacket? Exacyly emon design i lagbe solid color er moddhe kono likha likhi / company er logo cholbe na,,Sparrow_tora_999,1,5,https://www.reddit.com/gallery/1p23kyr,2025-11-20 19:47:14,Dhaka
Best Places for a quiet solo stay in this winter?,"Basically the caption, want to stay for maximum of 2 nights.",InevitableHot1851,1,6,https://www.reddit.com/r/Dhaka/comments/1p22xnk/best_places_for_a_quiet_solo_stay_in_this_winter/,2025-11-20 19:18:14,Dhaka
Does feminism exist in Jamaat?,"I know some people will be against it but I'm still saying it anyway. My few neighbour aunts are involved in Jamaat-e-islami and hearing some of their opinions made me question about everything. Islam gave all kinds of halal rights to women but they'll be doing them covering themselves, we all know that. But what do you mean by Allah SWT said that marry only those women who can give birth. Does that mean women who are infertile will be neglected? They can't even give proper reference to this. Also women are allowed to jobs in Islam even Bibi Khadiza also did business at that time. But they'll be saying that women's job is only to serve their husbands and children and to stay at home. Don't they know the history of Islam? I bet they do but they don’t want to admit the rights of women. Also one of the aunt saw me going to school wearing uniform and then she complained to my mother saying why I don’t wear Burkha above the uniform. Duh? I'm literally going to school and I have a scarf wrapped around my head. They said how I'm seducing those street men wearing only uniform and not burkha... And whenever a 6 months old get SA'd, they complain about her clothes,like bro she's a kid,she just came to the world. Are all of them like this or It's just my surrounding? 

What do you think about it?",fatal-rose-3047,45,86,https://www.reddit.com/r/Dhaka/comments/1p22866/does_feminism_exist_in_jamaat/,2025-11-20 18:45:13,Dhaka
How do you grow from solo freelancer to an actual business in Bangladesh?,"I’ve been freelancing for a while and make around 1k USD a month now. It’s fine, but I always wanted to grow and scale up things . I’m looking for suggestions. Like how do I turn freelancing into a proper business?

I already tried the “agency” thing. Tried hiring people so I could take more clients and outsource the work. Failed multiple times. Clients only like my work, not the people I hire. And most freelancers who call themselves “professional” here literally deliver trash work. Finding someone who’s actually good AND fits into my budget feels impossible.

Soanyone with real experience, how did you scale up?

How do you go from solo freelancer to something bigger?",Rare_Environment5752,10,37,https://www.reddit.com/r/Dhaka/comments/1p221v7/how_do_you_grow_from_solo_freelancer_to_an_actual/,2025-11-20 18:36:44,Dhaka
Cheese suggestion for pizza,Please suggest me some good shredded mozarella cheese brand to try for pizza. I only have used aarong shredded cheese. Wanna try other brands too.,Professional-Tiger57,3,2,https://www.reddit.com/r/Dhaka/comments/1p21yqu/cheese_suggestion_for_pizza/,2025-11-20 18:32:28,Dhaka
Suggest me Gelato Places,"Preferably in Uttara, Banani, Gulshan!!!",Known_Ad_7748,2,3,https://www.reddit.com/r/Dhaka/comments/1p1zuts/suggest_me_gelato_places/,2025-11-20 16:33:34,Dhaka
Recommendations for good hair cut &amp; hair color places in Bogra?,"Hi! Can anyone recommend where to get a nice haircut and hair color in Bogra?
I’m not familiar with the area, so any suggestions (and price info if possible) would really help. Thanks!",Zed18_,3,2,https://www.reddit.com/r/Dhaka/comments/1p1z8kt/recommendations_for_good_hair_cut_hair_color/,2025-11-20 15:54:44,Dhaka
Vitamin D,I think I'm suffering from vitamin D deficiency...what supplements do y'all take?,No_Tailor2427,6,33,https://www.reddit.com/r/Dhaka/comments/1p1xhbk/vitamin_d/,2025-11-20 13:58:43,Dhaka
Is 256 GB enough or should I get 512 GB,I plan to buy an iPhone 13 Mini. I want to know which storage is more preferable in 2025. Many shops in Dhaka only have 256 GB. I want 512 GB but I am not sure if it is even possible to get a real one in Bangladesh now.,No-Volume2455,8,56,https://www.reddit.com/r/Dhaka/comments/1p1xe1n/is_256_gb_enough_or_should_i_get_512_gb/,2025-11-20 13:52:23,Dhaka
Ostad's c#. Net core course review,I am considering ostad's. Net Core full stack web dev course but i can't find any actual reviews regarding this.Has Anyone done that before? Or do you have any recommendations?It would be Very helpful to know.,lonely-Catto,1,2,https://www.reddit.com/r/Dhaka/comments/1p1x400/ostads_c_net_core_course_review/,2025-11-20 13:33:48,Dhaka
Does anyone know any Chinese Importer?,"I want to a buy a keyboard that's on sale on AliExpress.
It's in mainland china and they don't ship to our country.
How do I order it from here?
This is my first time ordering something outside border
",SalaryImpressive7469,1,5,https://www.reddit.com/r/Dhaka/comments/1p1wx3h/does_anyone_know_any_chinese_importer/,2025-11-20 13:21:12,Dhaka
creatine suggestions,"so its my 1st time buying a creatine,what is your best place to buy creatine that provides authentic creatine at solid price,also the name of the creatine?I go to rayhan fitness lalbagh,they sell creatine also but thought of asking experienced people here.",ziszaman,0,13,https://www.reddit.com/r/Dhaka/comments/1p1wr0z/creatine_suggestions/,2025-11-20 13:10:41,Dhaka
Do you consider carrying phone as a student illegal?,"Today a very annoying thing happened with me. So I am student of college and I carry my phone with me as I live very far and get bored on the way to college everyday and carrying a phone also allows me to contact my parents at any certain time. So for my daily commute I take public transport as it is more cheap than the college bus. So today as usual i was on my way back and had my earbuds on my ear and was listening to some song and this random person starts asking me Is my phone allowed in college and I said no it's not allowed I just carry it and obviously I don't go and wave it around my teacher's face, almost 70% of the students carry their own phone. Then he started telling me that if majority people started doing wrong things which are illegal won't be legal. And I said why do you think it's illegal, he says phone has a bad influence over people and people get easily attracted to bad things but I said that's not true. I believe it's in someone's nature, if they wanna do something wrong no amount of strictness can stop them and if someone wants to do something right no amount of bad influence can affect them. But that person kept going on and on about how it's a bad thing and I was getting pissed at this point, I said your thinking is wrong and clearly your from a small town that's why you're thinking is also small but he kept saying it's not wrong and in their times on the institution gate they used to check bags then let them enter but I said your time was different. We are not breaking any major disciplinary act, we have phone we keep it in our bag don't use it in the middle of class not disturbing anyone anyhow with my phone only use it on my way how am I doing something wrong. He's saying no I lived in Dhaka for last four years, I am in Dhaka city college, I kept telling him that you are not right and I am not obligated to answer you but he's saying I am giving a right advice to you because apparently using a earbuds wearing a uniform leaves some kind of bad mark to the name of students according to him. He wasted my time and made my ear bleed with his nonsense.

Honestly I don't think phone is breaking any kind of discipline and nowadays teacher are aware that everyone has phones but they don't say anything cause somewhere they also understand some people need it as they need to contact their parents alot and by carrying it we are not doing anything wrong. Yea if someone uses it in the middle of class or exam it's wrong but if it's only kept in bag and only used outside educational institution I don't think it's bad any how and EM schools allow phones and alot of colleges started allowing phone to. Teacher coming to classes and for no reason checking bag and taking a phone should not be encouraged. And the random guy I met has very regressive thoughts and I think people like him are the reason our country is regressing and not progressing, but yea do let me know what you guys think",SE9A,7,13,https://www.reddit.com/r/Dhaka/comments/1p1wm26/do_you_consider_carrying_phone_as_a_student/,2025-11-20 13:02:09,Dhaka
I (Male 18) am looking for bengali friends so I can keep learning the language,"Im Argentinian and Ive been trying to learn Bangla for about 4 months now, Ive already learned the basics of the script (Such as the Consonants and Vowels) and Ive been trying to find people to talk to, so I can pick up those little things of the language that one cant really learn, and to practice my pronunciations, to put the language at use, etcetera my Instagram is Enzzzo5, Ill talk a bit about myself next so you can know what I enjoy 

Im 18 years old, my birthday is February 6, I am very very into music, and nearly all the time im listening to it or to informative videos, I myself play guitar and the piano (To a very basic level) and I enjoy to create and find new music from every language, as of now, I havent found much bengali music, but im very very open, I love Lagnajita Chakraborty, shes an awesome singer, I love many music genres, Rock, Metal, Jazz, classical music, soul music, pop, Synth wave, Experimental music and etcetera, whatever is music, I can enjoy it.

I love animals and Wild-life, I have a soft spot for non-loved animals, such as spiders, tarantulas, scorpions and centipedes, And I have hours upon hours of information to talk about animals, music and more

I like to play video games and talk about them, although my computer broke very recently

I like drawing, studying, and anime a lot, my favorite anime is Tokyo Ghoul, which I can also talk about for hours, I have lots of passion for the shows and animes that I love, of course, I love it when people talk to me about shows and things that they like, so I can be a good listener if you appreciate that

Lastly - because I know the culture and country can be quite conservative (Which I respect) I should mention that I am not, I only mention this so somebody wont come to me with the idea of me being conservative and then feeling betrayed or something when I respectfully disagree.

Have a great day! Hope I can meet some good friends",AverageUselessdude,9,8,https://www.reddit.com/r/Dhaka/comments/1p1wj2t/i_male_18_am_looking_for_bengali_friends_so_i_can/,2025-11-20 12:57:11,Dhaka
Confused on how to earn money as a young female,18f should i start tutoring while i am still giving olevels my parents are pretty well off but i want earn my own to help out . Will i get students without good olevel grades? ( Looking to teach little kids),JealousCompote4509,4,44,https://www.reddit.com/r/Dhaka/comments/1p1w7nz/confused_on_how_to_earn_money_as_a_young_female/,2025-11-20 12:37:40,Dhaka
Tech Guy Seeks Roommate/Benefactor - Skills for Rent!,"**Struggling to afford rent in Dhaka** despite my full-time job. I'm a CSE grad offering my **Website Development, Graphic Design, and Digital Marketing skills** in exchange for a room.

My office is in Agargaon, so a place near a Metro station is ideal.

I can build your business's online presence from scratch or help with daily tasks. Tired of high freelance costs? Let's help each other out.

DM me if interested in a mutually beneficial deal! I'm being a introvert friendly person. ",hossainbillal,2,0,https://www.reddit.com/r/Dhaka/comments/1p1w1xd/tech_guy_seeks_roommatebenefactor_skills_for_rent/,2025-11-20 12:27:52,Dhaka
"Toggi fun world, Bashundhara Shopping mall","Me and my friends want to go to the Toggi Fun World. We're 4 people (all adults) and we don't know how much it'll cost per person. Also, which things should we try or avoid? If anyone has been there, please share your opinion.

Thanks",Holiday_Fee6722,7,1,https://www.reddit.com/r/Dhaka/comments/1p1vzlt/toggi_fun_world_bashundhara_shopping_mall/,2025-11-20 12:23:47,Dhaka
Bachelors in South Korea,"Hello everyone, I have just completed my HSC and I want to pursue my BSc in South Korea. I am currently in the research phase. My question is:

Can my elder sister be my sponsor for studying in South Korea?

My sister’s bank transactions are very strong, and she also has a trade license because she owns an e-commerce business.

TIA.
",LilNoirito,8,14,https://www.reddit.com/r/Dhaka/comments/1p1vlzw/bachelors_in_south_korea/,2025-11-20 12:01:31,Dhaka
Is there any way to study cse in Bangladesh without passing h.math,"So I bombed my higher mathematics exam in hsc and got an F, as a result I cannot apply to any university. Does anyone know any University that will accept a student like me?

Edit: guys I'm not bad at math it's just that I was unable to study my hsc life seriously for personal reasons. I only had like 1 month to study so I had to sacrifice the optional subject",Nate_Higger-san,3,21,https://www.reddit.com/r/Dhaka/comments/1p1urow/is_there_any_way_to_study_cse_in_bangladesh/,2025-11-20 11:13:59,Dhaka
Wanna sell my Intel Arc A750 8GB,"I've an intel arc A750 8GB white edition with 26 months warranty left, the condition is very fresh, box and all other accessories available

If anyone wanna buy please dm me asap!",Illustrious_Coat_462,2,9,https://www.reddit.com/r/Dhaka/comments/1p1qglo/wanna_sell_my_intel_arc_a750_8gb/,2025-11-20 07:42:22,Dhaka
Psychologist," suggest a good, budget-friendly online psychologist or counselor for a student",Square-Box-1043,4,2,https://www.reddit.com/r/Dhaka/comments/1p1pwtm/psychologist/,2025-11-20 07:16:53,Dhaka
Hotel Review,"Me and my wife are planning to book hotel atlantis, fantasy kingdom for a day. Can someone please give any recent review of the hotel? ",Technical-Midnight73,2,1,https://www.reddit.com/r/Dhaka/comments/1p1ofi9/hotel_review/,2025-11-20 06:10:43,Dhaka
I was in three different rehab mental health facilities including Pabna mental hospital. AMA.,"So when I was 17, I was diagnosed with schizophrenia, which forced my family to admit me in a mental health rehab facility in Dhaka. And at the beginning of this year, I was in Pabna mental health hospital for 2 months. AMA. PS: The schizophrenia diagnosis was wrong. Later they figured out it was bipolar disorder.",Old_Mechanic9,50,49,https://www.reddit.com/r/Dhaka/comments/1p1nuy7/i_was_in_three_different_rehab_mental_health/,2025-11-20 05:46:13,Dhaka
Proud Son of Rajakar,,RazzmatazzStrict,3,0,https://youtu.be/RRODkIEAGMw?si=KTlKEnIbaZJJm-U8,2025-11-20 03:48:21,Dhaka
Which will be the All-rounder?,"if there were a telephoto lens, i'ld go for the Redmi Turbo 4 Pro. I liked the Nothing 3A camera and overall setup but the price is higher.  On the other hand CMF 2Pro is good enough in camera and pricing but it has no stereo speaker and NFc.  
Suggest me a phone with pro/cons.
I liked everything looking, hardware of Turbo 4 pro and the price is best right now. The only thing here missing is a telephoto lens",Environmental_Cry214,1,19,https://www.reddit.com/gallery/1p1jetk,2025-11-20 02:49:47,Dhaka
Cool date/hangout spots in Dhaka,"I'm not native in Dhaka, but I come here very often these days. So, please suggest some cool date/hangout spots here, everything feels like a copy of something else atp! And often feels like there's not much to do here!
Looking for some quiet cafes with good music, fun activities to do, places to explore, unique restaurants etc.",ei_white,3,3,https://www.reddit.com/r/Dhaka/comments/1p1jc16/cool_datehangout_spots_in_dhaka/,2025-11-20 02:46:45,Dhaka
got into a harassment for no reason,"Today i got into online harassment where, a post i just supported a man in comment section and after the comment, he was like, ""why your profile look like a যৌনকর্মী?"" I was so stunned, there was fr nothing bad in my profile, just one of a kpop idol pic, wtf. He couldn’t even control his shits of his brain. Literally after seeing the reply my whole day went bad, like who tf nowhere, a mf pop out with a disrespectful words towards women. Facebook is full of shits bro. I am also feeling bad rn.
",Beneficial_Mouse_279,41,72,https://www.reddit.com/r/Dhaka/comments/1p1iqxu/got_into_a_harassment_for_no_reason/,2025-11-20 02:24:23,Dhaka
"Arrival of New Shahriar, Govt should award him Independence Award.",,RazzmatazzStrict,1,0,https://www.facebook.com/reel/2004135310151121,2025-11-20 01:51:38,Dhaka
Goth fashion for men in Bangladesh?,"So I've been living in black my whole life, but I'm realizing there's a difference between just wearing dark clothes and actually putting together a goth aesthetic.

For the guys here - how do you approach goth fashion in Dhaka? What are the essentials? I'm talking styling, accessories, where to even find this stuff without breaking the bank or relying entirely on imports.

Some things I'm curious about:

* Layering in Indian weather (because let's be real, black in the Dhaka summer hits different)
* Accessories that actually work - rings, chains, chokers?
* Boots vs. regular footwear - what's practical here?
* Thrifting vs. online vs. tailoring custom pieces?

I feel like most goth fashion guides are super western-centric. Would love to hear how you all make it work in Bangladeshi context. Drop your tips, your go-to spots, your DIY hacks.",notjustrafa,8,3,https://www.reddit.com/r/Dhaka/comments/1p1h87c/goth_fashion_for_men_in_bangladesh/,2025-11-20 01:27:55,Dhaka
where to buy ps5 and how much?,"i want a buy a ps5 for my brother. i dont know where they sell ps5. 
in dhaka where i can find ps5? and how much it gonna cost me? for the original. 
i dont want to get scammed or buy a 2nd hand. 
where can i buy original ps5?
",StrangeFile8991,8,19,https://www.reddit.com/r/Dhaka/comments/1p1h4jv/where_to_buy_ps5_and_how_much/,2025-11-20 01:24:02,Dhaka
Fingerprint issue at NID office. Any help from people who faced this before?,"I’m having an issue with my NID fingerprint. My hands sweat a lot and my fingerprint ridges are faint, so the NID system can’t scan them properly. But when I made my passport, the fingerprints were captured completely fine.

I’m supposed to fly to Australia in February, and I’m a bit stressed — could this cause any problems at the airport or immigration? And what should I do now to avoid any hassle later?

If anyone has dealt with something similar or knows the exact office I should contact in Bangladesh, I’d really appreciate the help.",Sanim-99,2,1,https://www.reddit.com/r/Dhaka/comments/1p1h39k/fingerprint_issue_at_nid_office_any_help_from/,2025-11-20 01:22:41,Dhaka
anyone know anything about music production?,i wanna get into music production so if there is anyone who knows please give me advice on how to start and is there anyone who wanna learn together ,frustratedcigs,5,10,https://www.reddit.com/r/Dhaka/comments/1p1gzb2/anyone_know_anything_about_music_production/,2025-11-20 01:18:42,Dhaka
Looking for a spot,"Any restaurants or “lounges” that won’t break the bank and offer *PRIVATE* booths? Or maybe somewhere outdoors that has 0 foot traffic early morning or late in the evening? Want to take the missus out. If you have seen my other post, yes the pattern is all too obvious. 😅",BreakfastAutomatic52,3,9,https://www.reddit.com/r/Dhaka/comments/1p1g61s/looking_for_a_spot/,2025-11-20 00:49:09,Dhaka
Need advice,I don't have money to go to a private university. Is the CSE department of city college or commerce college be a good option?,Budget_Ad_1684,4,7,https://www.reddit.com/r/Dhaka/comments/1p1eurn/need_advice/,2025-11-20 00:03:01,Dhaka
thriller books,"kichu thriller books suggest kora houk ( Kishor classic type hoile valo hoy jemon treasure island type) .
(online PDF available hobe)",cat-woman2005,6,19,https://www.reddit.com/r/Dhaka/comments/1p1ejjy/thriller_books/,2025-11-19 23:51:43,Dhaka
How can I help my little brother improve his English pronunciation and spelling,"So, I have a little brother who is very bad at English ike, really bad. When I give him a word to pronounce, he can’t figure it out. He knows the word, but he can’t put the letters together or pronounce it properly. For example, if I tell him to spell **“invincible”**, he knows the word, but he can’t put it together or say it correctly.

How can I help him fix this problem",ResponsibleFudge8955,9,15,https://www.reddit.com/r/Dhaka/comments/1p1ef3l/how_can_i_help_my_little_brother_improve_his/,2025-11-19 23:47:07,Dhaka
masters in US,"hi everyone 
i am F21, currently in second year majoring in accounting at a renowned public uni. Is there anyone who went to US after undergrad for their masters with scholarship? what was the process and what did they require?
I want to be ahead with my prep so it's easier for me later,thanks in advance!",renluvr,5,4,https://www.reddit.com/r/Dhaka/comments/1p1edhs/masters_in_us/,2025-11-19 23:45:25,Dhaka
