title,body,author,upvotes,comments,url,date,subreddit
BD🇧🇩 vs India🇮🇳 Match Ticket for Sale!,"I have 4 extra tickets for the 18 November match between Bangladesh and India. Tickets are in East Upper and Lower Gallery. You can transfer the tickets in your own email by Quicket Ticket Transfer system.

DM me if you're interested to buy.",Opposite_Extension13,1,1,https://www.reddit.com/r/Dhaka/comments/1oyf2h3/bd_vs_india_match_ticket_for_sale/,2025-11-16 13:01:03,Dhaka
Perfumes,Where to buy affordable and good perfumes in dhaka through online or any shops you recommend?,omerhabib44,4,16,https://www.reddit.com/r/Dhaka/comments/1oyew7p/perfumes/,2025-11-16 12:50:35,Dhaka
CBT for intrusive thoughts,"Hello good people.  
Have anyone here tried CBT congnitive behaviour therapy for intrusive thoughts from any psychologists in Bangladesh? Did it work for you?   
i am really having this issue for sometimes and i cant concentrate in my studies. I have consulted one psychologist but the issue did not go away for me. The thoughts go away for sometime but they always come back later.   
If anyone of you have tried CBT and worked for you could you please give some suggestions what worked for you?  
 ",aurora_100,7,10,https://www.reddit.com/r/Dhaka/comments/1oyevpf/cbt_for_intrusive_thoughts/,2025-11-16 12:49:45,Dhaka
When will HSC happen?,HSC pichanor ki kono chances ache? The probable time is May-June. But ami shuntesi pichateo pare,Mean_Common_5269,3,8,https://www.reddit.com/r/Dhaka/comments/1oyel54/when_will_hsc_happen/,2025-11-16 12:31:54,Dhaka
Life of a loser,"I never share my personal life, but today I’m forced to. Today the board exam rechecking result came out, and nothing changed. I’ve always been a good student since childhood — I got an A+ in SSC, but in HSC I got a 3-something. When the result came today, my mom started talking to me angrily, saying, “Why didn’t your result change?” She said she can’t face relatives because I didn’t get an A+, and that I should feel ashamed for not getting it. On result day, all the relatives kept calling again and again — it was so annoying. I don’t even understand why they care so much about my result. My mom even said that if I don’t get admission anywhere, I won’t even have the right to show my face to anyone. You tell me is an A+ really that valuable in Bangladesh? Do you need an A+ just to look “worthy” in front of others? Today I’m really heartbroken. Yes, my result isn’t great and I already feel bad about it, but on top of that, my own family is making me feel even smaller.",Mysterious-Fly-9194,30,51,https://www.reddit.com/r/Dhaka/comments/1oydp50/life_of_a_loser/,2025-11-16 11:40:28,Dhaka
Self enjoyment,What do you do for your self enjoyment nowadays? And how do you make use it in your free time?,ElegantSteak7738,5,79,https://www.reddit.com/r/Dhaka/comments/1oydc0w/self_enjoyment/,2025-11-16 11:19:40,Dhaka
Suggestion for higher education,"I got Textile Engineering in AUST.I dont  have any proper idea about this sector.Does textile sector only limited in garments here?What are the future opportunities after graduation?How about the working culture in garments?Is there any scope for higher studies in abroad?Is it worth it really or i should switch to Brac or Nsu  Cse?
If anyone from Austex Or related to any textile sector, please help me out.Thank you in advance. ",abid0506,0,3,https://www.reddit.com/r/Dhaka/comments/1oydb2y/suggestion_for_higher_education/,2025-11-16 11:18:11,Dhaka
Where can I find cakes that taste amazing and have creative designs?,Wanted to order homemade cake for a birthday party but it's too late. Now I have to buy readymade cake. Kindly suggest where can I buy good cakes with nice designs?,callmeIFTY,6,10,https://www.reddit.com/r/Dhaka/comments/1oycjw4/where_can_i_find_cakes_that_taste_amazing_and/,2025-11-16 10:37:09,Dhaka
অনেক বাংলাদেশি অভিবাসীর সবচেয়ে বড় বাধা প্রায়ই তাদের নিজের কমিউনিটিই হয়। একটি সাম্প্রতিক ঘটনা দেখিয়েছে—কীভাবে একজন লোক ব্যক্তিগত বিরোধের কারণে নতুনদের সাহায্য করার জন্য তৈরি একটি সাপোর্ট গ্রুপকে নিজের ইচ্ছামতো গেটকিপিং করছিল। বিষয়টি জানার পরও সিনিয়র সদস্যরা গুরুত্ব দিয়ে দেখেননি,"Translated my previous post. 

সবার প্রতি সালাম, আমি জেমস—অবশ্যই আমার আসল নাম নয়, পরিচয় গোপন রাখার জন্য।

ঘটনাটি শেয়ার করার আগে কিছু প্রেক্ষাপট দিচ্ছি। আমি কয়েক বছর আগে অস্ট্রেলিয়ায় আসি। প্রথমে অন্য একটি বড় শহরে পড়াশোনা করি, তারপর ভালো সুযোগের জন্য কুইন্সল্যান্ডে চলে আসি। আল্লাহর রহমতে বিভিন্ন জব করেছি এবং ২০২২ সাল থেকে স্বাস্থ্যখাতে পড়াশোনা ও কাজ করছি—এখনও করছি।

বাংলাদেশ থেকে যারা আসেন তারা জানেন, স্বাস্থ্যখাতে বাংলাদেশি দেখা কতটাই বিরল। আমার ক্লাসে বা কর্মস্থলে কখনও কোনও বাংলাদেশি পাইনি। গত ৩.৫ বছরে কুইন্সল্যান্ডে আমি মূলত ফিলিপিনো, ইন্ডিয়ান, নেপালি ও অন্যান্য জাতিগোষ্ঠীর সঙ্গে কাজ করেছি। তাদের কমিউনিটি যতটা ঐক্যবদ্ধ দেখে, সেটা আমাকে অনুপ্রাণিত করেছিল বাংলাদেশি কমিউনিটির সঙ্গে যুক্ত হতে। আমার অবশ্যই লোকাল বন্ধু আছে, কিন্তু একে তো সংস্কৃতির একটা টান থাকে, আর আমি কখনও আমার সংস্কৃতি থেকে দূরে থাকতে চাইনি। আমি সত্যিই চেয়েছিলাম এমন কিছু মানুষ পেতে যাদের সঙ্গে ভাষা, সংস্কৃতি, ব্যাকগ্রাউন্ড মিলে।

একটি গ্রুপ ছিল, যেটি কুইন্সল্যান্ডের একটি বাংলাদেশি স্টুডেন্ট অ্যাসোসিয়েশনের সাথে যুক্ত। কেউ আমাকে সেখানে অ্যাড করেছিলেন। জুলাই ২০২৪ এর প্রোটেস্টের পর গ্রুপটি বেশ সক্রিয় হয়ে উঠেছিল—মানুষ পরস্পরকে সাহায্য করছিল, কানেক্ট হচ্ছিল। কিন্তু আমি যোগ দেওয়ার কয়েক মিনিট পরেই হঠাৎ আমাকে গ্রুপ এবং চ্যাট—দুটো থেকেই ব্যান করে দেওয়া হল।

গ্রুপটির অ্যাডমিন—ধরি তার নাম এন—সে আমার এক কাজিনের বন্ধু। কয়েক বছর আগে আমাদের মধ্যে ব্যক্তিগত একটি ঝামেলা হয়েছিল, যা কমিউনিটির সঙ্গে কোনও সম্পর্ক ছিল না। সে সেই পুরনো বিষয়টি ভুলতে পারেনি এবং অ্যাডমিন ক্ষমতা ব্যবহার করে ব্যক্তিগত বিরোধের কারণে আমাকে ব্যান করে দিল।

শুরুতে তেমন পাত্তা দিইনি। কিন্তু কিছুদিন আগে যখন আমি রেন্টাল ভ্যাকান্সির পোস্ট দিচ্ছিলাম, তখন ঘটনা বদলে যায়। ভাগ্যক্রমে আমি এমন জায়গায় থাকি যেখানে মালিক আমাকে ঘর সাবলেট করতে বিশ্বাস করেন। এভাবে কিছু বাংলাদেশি রুম খুঁজতে এসে আমার সঙ্গে যোগাযোগ করল, এবং শেষে তিনজন বাংলাদেশি আমার বাসায় উঠল।

প্রতিদিন তাদের সাথে আমার নিজের ভাষায় কথা বলতে বলতে বুঝতে পারলাম—এতদিন আমি এই কানেকশনটা কতটা মিস করছিলাম। ৩–৪ বছর শুধু ইংরেজিতে কথা বলে এবং স্বাস্থ্যখাতে বাংলাদেশি না পেয়ে, মাতৃভাষায় স্বাভাবিক কথোপকথনই যেন মন শান্ত করে দিয়েছিল।

তাদের একজনের সাথে আমি তাহসানের কনসার্টেও গিয়েছিলাম। সেখানে এক সিনিয়র ভাইয়ের সঙ্গে—ধরি তার নাম এস—দেখা হল। উনি খুব ভালোভাবে অভিবাদন জানালেন, আমি পুরো ঘটনা বললাম। উনি বললেন দেখবেন। কিছুই হয়নি, এবং সত্যি বলতে তাকে দোষ দিই না। তার পরিবার-দায়িত্ব আছে; বেশিরভাগ মানুষ এমন ক্ষুদ্র ঝামেলায় জড়াতে চান না। তাই এটাও ছেড়ে দিলাম।

কিছুদিন পর কেউ একজন এন-এর বিরুদ্ধে অভিযোগ পোস্ট করল—একজনকে হুমকি দেওয়া এবং রাজনৈতিক সংযোগের ইঙ্গিত নিয়ে। তখন আরেকজন সম্মানিত কমিউনিটি লিডার—ধরি তার নাম এ—পাবলিকলি লিখলেন যে বুলিং, হয়রানি বা বৈষম্য কাউকেই ছাড় দেওয়া হবে না।

আমি তাকে ব্যক্তিগতভাবে জিজ্ঞেস করলাম,
“যদি যিনি এগুলো করছেন তিনি কমিউনিটি লিডার হন, তাহলে?”
তিনি বললেন, ভুল তো ভুলই।

তখন আমি তাকে পুরো ঘটনা খুলে বললাম—কীভাবে আমি শুধু নিজের কমিউনিটির সাথে সংযোগ করতে চেয়েছিলাম, সাহায্য করতে ও নিজেও কানেক্টেড থাকতে চেয়েছিলাম।
ভাই এ এন-এর সাথে যোগাযোগ করেন। কাজিনকেও বললাম বিষয়টি। আমি একটাই কথা স্পষ্ট করলাম—পুরনো ব্যক্তিগত ঝগড়াকে অজুহাত বানিয়ে কাউকে কমিউনিটি থেকে বাদ দেওয়া অন্যায়। অ্যাডমিন হওয়া মানে কারও উপর ব্যক্তিগত ক্ষমতা খাটানোর লাইসেন্স নয়।

কাজিন এবং ভাই এ দু’জনই এন-এর সাথে কথা বলার চেষ্টা করেন, কিন্তু সে বিষয়টি এড়িয়ে যায়। শেষে সে শুধু জানায়—সে আমাকে গ্রুপে নেবে না। কোনও যুক্তি নেই, কোনও ব্যাখ্যা নেই—শুধু জেদ।

অনেকে সহজেই বুঝতে পারবেন আমি কার কথা বলছি, কারণ এর আগেও তাকে বাংলাদেশের একটি রাজনৈতিক দলের সাথে জড়িত বলে অভিযোগ উঠেছিল। মজার বিষয়, সে নিজেই বলেছিল সে দলের নয়, কারণ সে নাকি তাদের বিরুদ্ধে “প্রোটেস্ট করেছিল”—কিন্তু তার আচরণ ঠিক সেই গত দশকের দেশের রাজনৈতিক চরিত্রগুলোর মতো।

সে এমনকি আমার কাজিনকে বলেছে কিছু নির্দিষ্ট আত্মীয়কে নাকি অভিযোগ করবে এবং “অ্যাকশন নেবে”—মানে পরিস্থিতি বাড়াতে চাইছিল, অথচ আমার উদ্দেশ্য ছিল শুধু ন্যায্যতা। আমি কাজিনকে বললাম—মানুষ জানুক বা না জানুক, আমার আপত্তি নেই; আমি শুধু চাই অন্যরা জানুক কীভাবে কিছু লোক ভদ্রতার মুখোশ পরে ব্যক্তিগত শত্রুতার বদলা নেয়।

দীর্ঘদিন ধরেই তার আচরণ নিয়ে বিভিন্ন মানুষের কাছ থেকে গুজব ও অভিযোগ শুনেছি—যেগুলো আমি বলব না, কারণ তার মতো পেছনে লাগা বা অপবাদ দেওয়া আমার উদ্দেশ্য নয়।

যা আমাকে সবচেয়ে বিস্মিত করেছে—সে আমাকে ব্যান করলেও, স্বাস্থ্যখাত সম্পর্কিত কোনও তথ্য জানতে কেউ তাকে জিজ্ঞেস করলে সে আমার নম্বর তাদের কাছে দিয়ে দিত।
কারণ “এন ভাইয়া আপনার নম্বর দিছে”—এই কথাই শোনা যেত।
মানে, তার নিজের প্রয়োজনে আমি ভালো, কিন্তু কমিউনিটিতে আমার থাকা সে মেনে নিতে পারে না।

আমি প্রচুর জাতিগোষ্ঠীর মানুষের সাথে কাজ করেছি—অস্ট্রেলিয়ান, পাঞ্জাবি, ফিলিপিনো, নেপালি, সাউথ ইন্ডিয়ান—কিন্তু এমন নোংরা গেটকিপিং আর কোথাও দেখিনি। যাদের কাছে গিয়েছিলাম তারা চেষ্টা করেছেন—সেটা আমি সম্মান করি—কিন্তু বেশি কিছু করার ছিল না।

তাই হ্যাঁ—এমন সাপে ভরা মানুষের ব্যাপারে সতর্ক থাকুন। তারা বাইরে থেকে হাসিমুখে সাহায্যকারী সাজে, ছোট্ট কোনও উপকার করলে দশজনকে বলে বেড়ায়, অথচ আড়ালে ক্ষমতার অপব্যবহার করে। যে সত্যিকারের সাহায্য করে, সে চুপচাপ করে; সে ক্ষমতা দেখিয়ে মানুষকে অপমান করে না।

আমার ব্যক্তিগত ভাবে তেমন কষ্ট নেই। আমার কাজ ও পড়াশোনা ভালোই চলছে, আল্লাহর রহমতে সব ঠিক আছে। দুঃখ শুধু এই—বিদেশের মাটিতে নিজের কমিউনিটির সাথে কানেক্ট হতে চেয়ে, সংস্কৃতির টান বজায় রাখতে চেয়ে, কেউ একজনের ছোট মনের কারণে এমনভাবে দূরে সরিয়ে দেওয়া হয়।

সত্যিকারের সদাচরণ নীরব।
সত্যিকারের নেতৃত্ব ব্যক্তিগত আবেগ নয়, কমিউনিটির স্বার্থ দেখে।

এমন ভণ্ড, ছদ্মবেশী মানুষ থেকে সাবধান থাকুন। নিজের পরিচিতজনদেরও সচেতন করুন।

আর যদি আপনারা জানেন কীভাবে এমন মানুষদের ব্যাপারে আরও বেশি মানুষকে সচেতন করা যায়, তাহলে আমাকে জানান।”",jbttss,3,6,https://www.reddit.com/r/Dhaka/comments/1oycgiz/অনক_বলদশ_অভবসর_সবচয_বড_বধ_পরযই_তদর_নজর_কমউনটই_হয/,2025-11-16 10:32:02,Dhaka
Lonely,Feeling lonely last few days. If you’re open to share can we share our thoughts? ,Top-Slide-4095,5,27,https://www.reddit.com/r/Dhaka/comments/1oycfx6/lonely/,2025-11-16 10:31:02,Dhaka
PPT expert needed.,Is there any PPT maker expert? Is there anyone that can create some slides I need it for our sales pitch.,raj_monir15,5,8,https://www.reddit.com/r/Dhaka/comments/1oyb77o/ppt_expert_needed/,2025-11-16 09:26:29,Dhaka
Is there any local bus route using T.T.Para Underpass?,Was just wondering what are some local and inter district buses that uses this underpass now.,Treasure_Crusho,1,1,https://www.reddit.com/r/Dhaka/comments/1oya1vj/is_there_any_local_bus_route_using_ttpara/,2025-11-16 08:28:46,Dhaka
Anybody have a good ayer mach or corsula recipe?,"So I am looking for ayer mach or corsula mach recipe I don't know what fish it is. It should be a delicious recipe enough to eat with rice.
Of u know any u have tried pls give me the link 

Thank you in advance",Maximum-Evening3904,2,1,https://www.reddit.com/r/Dhaka/comments/1oy8vzc/anybody_have_a_good_ayer_mach_or_corsula_recipe/,2025-11-16 07:31:30,Dhaka
Winter clothes,Where should i go to buy some nice winter clothes in Dhaka?? Like thrifted stuffs but good collection. ,itzfaria,5,9,https://www.reddit.com/r/Dhaka/comments/1oy3hi9/winter_clothes/,2025-11-16 03:30:21,Dhaka
Struggling as an Artist,"Spend a decent amount of my time doing freelance work online. Enjoyed my time working as a concept artist.

Since the dawn of AI, my career has been suffering a lot on freelance platforms.Tried working offline jobs as a graphic designer but I never enjoyed it. 
Can't find jobs as an artist either. I was super introverted during the beginning of my career where I didn't focus on my 'Social Branching Skills'. Now that I'm trying to do that, seems like I'm already too late.

Breaking the ice now, I was, I am a bit scared to post on social media or reach out to people as well.

Wanted to get some advice from y'all if you had any.

Thanks. ",peedeepeesucks,6,10,https://www.reddit.com/r/Dhaka/comments/1oy2ogy/struggling_as_an_artist/,2025-11-16 02:56:11,Dhaka
Seeking Investment to Scale My Small E-commerce Brand (Bangladesh) — Need Guidance &amp; Partners,"Hi everyone,

I’m building a small e-commerce brand called Chikbik, focused on budget-friendly toys. I started this business with very little capital and have been running it alone — sourcing, importing, marketing, fulfillment, everything.

To show transparency, I’m attaching my lifetime earnings screenshot from my shop. This is what I’ve built with zero investors and limited resources.

What I’ve Achieved So Far

Built an online presence on Facebook &amp; Marketplace

Started selling imported toys

Built a base of repeat customers

Managed all operations independently

Monthly sales increasing slowly but steadily


Why I Need Investment

Right now the main constraints are:

Limited working capital

Unable to bring bigger stock

Want to create a more branded experience

Need funds for packaging, marketing &amp; improved product line


My Goal

To turn Chikbik into a recognizable small toy brand in Bangladesh, with:

Better branding

More product variety

Dedicated marketing

Stable inventory flow


What I’m Looking For

A small to mid-level investor

Someone who understands e-commerce in emerging markets

A partner open to discussing equity sharing

Mentorship is also welcome


What I Can Provide

Full transparency (I’ve shown my earnings screenshot)

Clear growth plan

Constant reporting and performance updates

A motivated founder who works full-time on the business


If anyone is interested in discussing or guiding me, I’d appreciate any advice or conversation.

Thanks!",ledlips6214,2,1,https://www.reddit.com/r/Dhaka/comments/1oy2lzd/seeking_investment_to_scale_my_small_ecommerce/,2025-11-16 02:53:14,Dhaka
Any Bangladeshi living in oman here? Needed help,"My housemaid is going to send her son in oman within some months . But I guess they are being scammed. As they r not much educated and advanced enough, it’s very easy to fool them. So I wanted help of any Bangladeshi omani there to be confirmed. They r really poor and saved money by hardship. I don’t want their money to go in vein. So any bangladeshi living there please comment here or dm me.",zebrina1,17,8,https://www.reddit.com/r/Dhaka/comments/1oy1lpd/any_bangladeshi_living_in_oman_here_needed_help/,2025-11-16 02:10:43,Dhaka
Where to invest 15k bdt as a student,"Hi. 22[M] here. So I have this curiousity for investment but have zero knowledge about that. Saved around 15k somehow. Now i don't want to waste this money. Want to invest somewhere. Any suggestions?  

And how can I start learning about investments if I intend to be an investor in future? Any books/ youtube channel suggestions? 
Thanks ",dest_v18,2,6,https://www.reddit.com/r/Dhaka/comments/1oy18ai/where_to_invest_15k_bdt_as_a_student/,2025-11-16 01:55:49,Dhaka
Do guys find girls with nose piercings attractive?,Do guys find girls with nostril ring or stud attractive? Not the septum piercing though. ,sabia__,56,133,https://www.reddit.com/r/Dhaka/comments/1oy0x9b/do_guys_find_girls_with_nose_piercings_attractive/,2025-11-16 01:43:15,Dhaka
Early morning GOOD breakfast spot at JamunaxBashundhara gate.,Since its going to be a daily commute position so please recommend me the best places where one can eat a good breakfast. And please mention the budget. Thanks in advance,NeighborhoodCute6742,2,5,https://www.reddit.com/r/Dhaka/comments/1oy0ae7/early_morning_good_breakfast_spot_at/,2025-11-16 01:18:08,Dhaka
Does anyone else think that people of this generation is intellectually poor?,"Whenver I see old movies like Feluda or other detective characters, other Satyajit Ray movies, or Mrinal Sen movies. Or let's say western films, even 90s films had really unique plots, and characters of books and films, or even random people were much smarter in fashion and behavior. They had a depth in personality. If you'd see students of our universities around that time, even they looked really smart. Do you ever think why? Maybe I'm an old soul and love old things. But In my opinion, people of this generation are shallow, both intellectually and in their personality.",Outrageous-Being7136,42,51,https://www.reddit.com/r/Dhaka/comments/1oy00es/does_anyone_else_think_that_people_of_this/,2025-11-16 01:06:59,Dhaka
Quiet places near Dhaka,"Hi. Is there any quiet place near dhaka where i can go by motorcycle / car, place a mat/bedsheet, enjoy some food and sunset? ",NefariousnessOk7185,2,15,https://www.reddit.com/r/Dhaka/comments/1oxzj8s/quiet_places_near_dhaka/,2025-11-16 00:48:15,Dhaka
