title,body,author,upvotes,comments,url,date,subreddit
Government of the pressure group by the pressure group for the pressure group,"
Shafiq Bhai probably forgot to say another success of his Govt:
government of the pressure group  by the pressure group for the pressure group


The Interim Government is an NGO-Gram in all but name—a gram-level outfit!! In many views, it is the weakest administration in Bangladesh’s history: so weak that even the United States would not pursue reciprocal tariff arrangements with it!!

Its leaders often appear timid, unable to control the streets during a period that saw over 1,700 protests in 500 days!! They seem novice and ineffective, struggling even to pass laws, let alone enforce them!! The Interim Government has repeatedly buckled under pressure from relatively small or little-known groups!!

Over the past 15 months, the IG has been bombarded with accusations of inertia and incompetence. Many dismiss it as a “do-nothing, makhon-khawa group” that stumbled into power by luck and achieved nothing and now was looking for an ignominous safe exit!!!

And yet, when I look back, I say with confidence that this has been one of the most consequential governments of Bangladesh in many decades. It has achieved almost everything it set out to do.

#Peace and stability restored. Post revolution revenge attacks brought to a halt.

#The US tariff deal was secured without hiring a single lobbying firm.

#A record number of laws were enacted in just 15 months, including sweeping new labour reforms.

#The July Declaration established a historic new platform, and the July Charter created a political settlement that may reshape national politics for generations.

#The Supreme Court asserted control over the lower judiciary, making it far more difficult for future governments to weaponize bail decisions or pursue politically motivated cases.

#One of the world’s leading port operators signed the Laldia Terminal agreement, laying the foundation for a manufacturing transformation. It is the single largest European investment.

#A new foreign policy framework has positioned Bangladesh at the centre of the Indo-Pacific.

#The economy has been stabilised and returned to a growth trajectory.

#Banking-sector plunder was curbed, the taka stabilised, and inflation contained—food inflation falling from 14 percent to seven.

#According to court proceedings, accountability began to emerge for past abuses, and a long-awaited sense of justice has begun to take shape. Sheikh Hasina has been shown her place!!

#Forced disappearances ceased, the BAL extremist political culture that once dominated our national life has been neutralised, and a cultural revival has followed—bolstered by widely viewed documentaries detailing earlier abuses. It is a Farooki- effect!!

#The RAB now operates under the law rather than informal doctrines, and intelligence agencies have retreated from harassing dissidents. 

#Freedom of press and freedom of speech have been restored. Not a single staged “crossfire” incident has been reported in the last 16 months.

I could go on. As an avid reader of our history, I believe no government in Bangladesh has achieved as much in such a short period as the IG has over these fifteen and a half months.

Full stop.

#DhakaDiary",RazzmatazzStrict,4,2,https://www.reddit.com/r/Dhaka/comments/1p08rzs/government_of_the_pressure_group_by_the_pressure/,2025-11-18 16:45:54,Dhaka
All you can eat Buffet,"Give me the best and value for money, all you can eat Buffet in dhaka",whatevermeme,19,26,https://www.reddit.com/r/Dhaka/comments/1p08r78/all_you_can_eat_buffet/,2025-11-18 16:44:34,Dhaka
Bank loan,"Does anyone properly let me know some questions about Bangladesh loan works? (Bank loan)
Just to gain some knowledge. Thanks in advance.",Previous-Chocolate99,3,8,https://www.reddit.com/r/Dhaka/comments/1p08ozz/bank_loan/,2025-11-18 16:40:47,Dhaka
Dinner Set &amp; Womens Jewellery,"I’m looking to buy a good quality diner set in dhaka, wheee should I look for good selection and pricing.

Another thing is women’s Indian jewellery, I’ve ordered from a Facebook page page but the price seems high and I have to pay first and then receive in post, where in Dhaka can I go and buy in bulk which has a store?

Appreciate all your help 🙏🏽 ",Careful_Storm_3665,3,6,https://www.reddit.com/r/Dhaka/comments/1p08mag/dinner_set_womens_jewellery/,2025-11-18 16:36:12,Dhaka
Software engineering,Trying to get in touch with anyone studying SWE at uni right now or who’s already graduated in it,PotatoMoney6765,3,10,https://www.reddit.com/r/Dhaka/comments/1p07957/software_engineering/,2025-11-18 15:08:37,Dhaka
do ways of making money online really exist? i need serious help. (please no khalid farhan type of advice),"I don't even know to start, I made a post a month ago about my despair of being a Bangladeshi citizen and being from an area where opportunities are limited for those who can't buy it. 



Now what about the ones who are really stuck in a situation they don't want to be? 

  
on the previous post that i spoke of, a lot of good guys tried helping me, and some of them said i should get a computer, and that it will open a lot of ways for me. i worked overtime in my shitty job and got a barely manageable laptop., but i don't know where to start, what skills will really be valued if i devote myself really. i started learning graphic designing and a cousin of mine said graphic designers are fighting each other in Bangladesh to get simple jobs and that there are thousands of new designers every day only in Bangladesh. so.... these are the kinds of advice i'm getting right now, and some people are advising me like Khalid Farhan if you know what i mean. 

  
But no one till now said ""i make money, and here's how you can too, just follow me"" i know that sounds demanding but if you have time, please talk to me, anyone. i'll tell you about me and you will know why i'm so desperate to find a way to make money instead of relying on my shitty job. 



thank you, your help will be appreciated",unplugged_________,10,19,https://www.reddit.com/r/Dhaka/comments/1p06v7o/do_ways_of_making_money_online_really_exist_i/,2025-11-18 14:43:46,Dhaka
Give me your top ragebait,It's kinda fun.,Ok_Temperature1414,28,76,https://www.reddit.com/r/Dhaka/comments/1p06ejd/give_me_your_top_ragebait/,2025-11-18 14:13:12,Dhaka
Need hotel recommendations in Banani - unmarried couple,"Budget: 4-5k BDT

Looking for hotels in Banani that are couple-friendly and don't create problems for unmarried couples at check-in. Need a clean, private place with no hassles or awkward questions.

If you've actually stayed at places in this area as an unmarried couple, please share your recommendations. Which hotels are chill about this?

Only looking for practical suggestions from people with real experience. Not interested in moral lectures - please skip this post if that's what you came to say.

Thanks!",ArthurMorgan_47,24,65,https://www.reddit.com/r/Dhaka/comments/1p066sv/need_hotel_recommendations_in_banani_unmarried/,2025-11-18 13:59:43,Dhaka
I'm curious,"Is anyone interested in buying handmade bead bracelets?
Or rasin decorations?",Deep_While_3960,2,2,https://www.reddit.com/r/Dhaka/comments/1p060m9/im_curious/,2025-11-18 13:48:18,Dhaka
জার্নালিং,"২০২২ সাল থেকে বছরের শেষ দিনে, আমি নিজেই নিজের উদ্দেশ্যে চিঠি লিখি। মূলত পুরা বছরে আমার প্রাপ্তি কি, অপ্রাপ্তি কি, উল্লেখযোগ্য ঘটনা কি। বছর যখন শেষ হয় সেই চিঠি আবার পড়ি, এবং পুনরায় সামনের বছরের প্ল্যান লিখি। বছর শেষ হতে চলল। এবছরের শুরুতে যে চিঠি লিখেছিলাম নিজেকে, দেখলাম কিছুই পুরন করতে পারিনি। যেমন, সিগারেট ছাড়বার প্ল্যান ছিলো, সিগারেট তো ছাড়িই নি, উলটা বেশি খেয়েছি। একমাত্র জার্নালিং করাটাই চালাতে পেরেছি। জার্নালিং করা অনেকটা ঠিক আমার কাছে রিয়ালিটি এসকেপ করা। নিয়মিত না হলেও পেরেছি। হাতে লেখা জার্নালিং টা হয় নি, তবে ফোনে টাইপ করে অনেক দূর করে ফেলেছি। আপনারা কেউ জার্নালিং করেন?  করলে এই বিষয় টা কেমন লাগে? ",Aegon_TargaryanII,13,10,https://www.reddit.com/r/Dhaka/comments/1p05yyg/জরনল/,2025-11-18 13:45:20,Dhaka
“৯০-এর দশকের ঢাকা—অতীতের শহরের এক মুহূর্ত 📸”,,Embarrassed-Law6338,33,2,https://www.reddit.com/gallery/1p05p8x,2025-11-18 13:27:31,Dhaka
Best flower shops,"I'm looking to buy flowers. Especially the likes of Lily, lotus and kodom also the basic flowers .Where in dhaka can I visit and select my flowers on my own and get them. Is there any shop like that.Also online suggestions would help a lot but in person shops would be better.",dengxiety,7,5,https://www.reddit.com/r/Dhaka/comments/1p05o7x/best_flower_shops/,2025-11-18 13:25:41,Dhaka
Do Bangladeshi University Students Get .edu e-mail addresses?,"Hello I've seen foreign university students having these e-mail addresses that have their name and uni name. These are provided by their university authority ig. My question is, do we get to have our own after getting admitted to a public university? Like, DU, BUET, etc. Having a school e-mail address is so convenient it seems. Do Bangladeshi Students have this facility? 

Thank you.",biggestloserinearth,9,32,https://www.reddit.com/r/Dhaka/comments/1p05g0m/do_bangladeshi_university_students_get_edu_email/,2025-11-18 13:10:46,Dhaka
C-B unit Bangla,"Hello, I’m a student of HSC 25. I’ve been struggling with Admission Bangla subject. My average mark is around 5-6. I got 4.5 in last progress test. I’m feeling like giving up. Even my friends are making fun of me now. I’ve been able to cut a good figure in other subjects like English and Accounting. I’m putting 2.3-3 hrs a day for Bangla. Please help me out dear seniors
Thank you! ",t1tu_ez4ence,2,1,https://www.reddit.com/r/Dhaka/comments/1p04w9n/cb_unit_bangla/,2025-11-18 12:37:42,Dhaka
CU vs RU,"RU &amp; CU are both considered among mid-tier universities in Bangladesh. But when someone gets a chance to choose one of them, I can see most people choosing RU (If I am wrong, correct me). Why isn't CU considered better than RU? Is it because RU was established before CU, so people are biased towards it? Or is it true that CU is a level below RU? Today is the 60th anniversary of CU. CU is situated in the second most important city in Bangladesh. Many countries of the world have the best universities either in the capital or in the port city. CU has not been able to live up to its potential.

Feel free to share your thoughts.",Abdullah715279,3,17,https://www.reddit.com/r/Dhaka/comments/1p04hsq/cu_vs_ru/,2025-11-18 12:13:43,Dhaka
Books,Is there any Bangladeshi bookworm community on Reddit to discuss ab bengali books? ,grey_maverick,1,1,https://www.reddit.com/r/Dhaka/comments/1p042ym/books/,2025-11-18 11:50:05,Dhaka
Looking for a Part Time/ Full time job.,"Hey Dear Readers, 
I'm 21 years old boy living in Keraniganj, Dhaka . I'm HSC graduate in Business Studies with a GPA of 4.92.

Computer knowledge:- Microsoft Office, PowerPoint, MS excel.

Recent job :- 

Sales Representative at a Wholesale Fruit Market in Sekson,Dhaka.

Team Leader at my College Coaching Center located in my village.

Also I managed my Cattle Farm.



Currently I'm looking for a job . Can anyone suggest or provide me a job ? Please I'm currently unemployed and badly need a job.",iamnoman18,3,1,https://www.reddit.com/r/Dhaka/comments/1p0369o/looking_for_a_part_time_full_time_job/,2025-11-18 11:00:12,Dhaka
Excel Training Centers in Dhanmondi/New Market with Microsoft Certification,"I'm planning to start learning Excel from the basics and want to earn Microsoft official certifications. I'm looking for training centers specifically in the Dhanmondi or New Market area.

Could anyone share their experiences with Excel training programs in these locations? I'm particularly interested in:

* How do they structure their courses? Is it hands-on practice or mostly lectures?
* What learning materials do they provide? (workbooks, practice files, online resources, etc.)
* Do they offer continuous support throughout the training period? Can I reach out to instructors between classes if I get stuck?
* How long does it typically take to complete the certification track?
* What's the approximate cost range?

I want to make sure I'm investing in a center that provides solid, practical training with proper instructor support. Any recommendations or personal experiences would be greatly appreciated!",hard2resist,3,1,https://www.reddit.com/r/Dhaka/comments/1p033g4/excel_training_centers_in_dhanmondinew_market/,2025-11-18 10:55:59,Dhaka
Study MBA!,"Hey Guys, 
I completed my BBA in 2021. How hard it is to study again after 4/5years of gap? I am currently doing business. However, I think i should do MBA! 
Suggest me University that offers easygoing MBA! ",Extension_Gene_5600,3,5,https://www.reddit.com/r/Dhaka/comments/1p02yqc/study_mba/,2025-11-18 10:48:55,Dhaka
Trusted source to donate online?,I am planning to donate a small sum to a trusted source. Don’t have the option to do so in person. Do you know any trusted source that accepts donations online? Not leaning towards paying un organizations or places like save the children ,SpecialistLow1164,3,7,https://www.reddit.com/r/Dhaka/comments/1p02oe5/trusted_source_to_donate_online/,2025-11-18 10:33:51,Dhaka
Had anyone buy smartphone from aliexpress if did let me know your opinion,Recently I come cross oneplus phone in aliexpress and the phone at discount price I just wanted to know how you pay custom tax on your smartphone,Forward_Initial_5138,3,7,https://www.reddit.com/r/Dhaka/comments/1p026ym/had_anyone_buy_smartphone_from_aliexpress_if_did/,2025-11-18 10:08:19,Dhaka
Need advice on what to do..for life..career..etc😭,"Need advice

So i basically worked at this Photoshop/photomela which I joined at first thinking I'll get to learn Microsoft office and other stuff which i did the first couple weeks from the other workers but.. after that i stopped learning stuff, i was there from 9am till isha prayer almost everyday, besides friday or if some mezban/urush/ biye etc type stuff was happening for almost 3 months, it became a job basically, i got paid like 50tk a day for my bus fare. The workers were nice tho ngl about that, even the owner was friendly but when it came to the money side and how long Iam ""working"" there they get pretty strict, obviously I don't like it anymore, i mean fair i learned quite a bit talking with different kind of customers and learning how to use adobe Photoshop and word etc. but.. is it really worth all that? Opening the shop at 9am and cleaning it up myself like... I don't know if im the one who's getting alot and still complaining or other way around, i only feel bad because the staff there were genuinely good people I liked hanging out with.... But that wasn't my goal at the start.. I joined in to learn.. which i stopped doing after awhile. Also another thing is.. Im one of those bekar unemployed, not studying anymore guys, that was the reason i joined this place like 3 months ago... I don't know what to do with my life, clearly this isn't it since im just wasting time here, but I don't know what else I can do...

Edit: thought I should share a bit about myself. Iam 19 years old, I used to live in Oman and came back to Bangladesh at 2022 because i had visa problems, I missed my highschool exams i was basically part of the 2022 batch of SSC examinees.. which i missed and i didn't study since, been 3 years, dad went to UAE 2 Years ago and I thought he'd take me soon.. its been quite awhile im still here.. it's kinda funny but anyways.. I don't know how much longer im gonna be here but I don't want to waste it, someone bestow some wisdom on me, im really broke so IELTS is not on the table right now, im saying this because i got suggested this one multiple times. Im really broke right now, not just me, my whole family, hence why Im still here in bd instead of going to UAE because I can't buy the damn visa and some other stuff. Anyplace i can learn some work.. whatever kind of work that would benefit me later on where I might be able to make some money aswell... Again please don't say IELTS or school.. give me some proper advice older brothers and sisters of this subreddit 🙏",One-Breakfast-3410,3,8,https://www.reddit.com/r/Dhaka/comments/1p01xpd/need_advice_on_what_to_dofor_lifecareeretc/,2025-11-18 09:55:43,Dhaka
Need Suggestions for Budget-Friendly Book Sites,Hey everyone! 👋 Can anyone suggest some good online sites where I can find a wide collection of books at a reasonable price and good quality?,Jumpy-Selection-7728,7,3,https://www.reddit.com/r/Dhaka/comments/1p01b6b/need_suggestions_for_budgetfriendly_book_sites/,2025-11-18 09:25:27,Dhaka
Good camera repair shop in Dhaka + cost?,"Hey everyone,

I need to service my Canon DSLR (display mark + lens cleaning/fungus). It hasn’t been used in years. Looking for a reliable camera repair shop in Dhaka with reasonable pricing.

Questions:

* Any personal experience with these places?
* Any other trusted shops for DSLR/lens repair in Dhaka?
* Expected cost for display issues + lens cleaning?

Thanks!",Additional-Skirt-937,3,0,https://www.reddit.com/r/Dhaka/comments/1ozyg4t/good_camera_repair_shop_in_dhaka_cost/,2025-11-18 07:13:38,Dhaka
Is arranged marriage still a thing in Bangladesh for male in their early 20s?,"I’m a 23-year-old Bangladeshi currently studying in Australia and about to finish my undergrad. I’ve been here for around three years, have a stable income, and I’m considering getting married within the next 1 year so my future spouse can join me while I’m still studying.

Since I’ve been single for a long time (last relationship was in 2018–19), I’m trying to understand how realistic arranged marriage is nowadays for people in their early 20s. My parents are open to helping, but they are also unsure how the process works now since society has changed a lot.

Recently I’ve seen many online discussions about modern dating, trust issues, expectations, betrayal, etc., which honestly made me a bit confused about what the normal marriage process looks like for Bangladeshis today especially for someone living abroad.

For those who went through arranged or semi-arranged marriage recently:
	•	How did the process go?
	•	What should someone like me realistically expect? How do I do the genuine background check.
	•	Any advice for someone who wants a stable, respectful, religiously aligned partner?

I’m Muslim and try my best to practice, and I’m hoping to find someone who shares similar values. Would appreciate honest experiences and guidance.
",hackerbong,55,47,https://www.reddit.com/r/Dhaka/comments/1ozy1x1/is_arranged_marriage_still_a_thing_in_bangladesh/,2025-11-18 06:56:01,Dhaka
Can anyone recommend a place to repair headphone near or close to Dhanmondi?,"My cat ripped apart my headphone cable, but besides that everything is fine. Can someone recommend a place to repair it? My headphone is the Razer Kraken X Essential 7.1 Wired Gaming Headset.",DisSapo1ntment,2,2,https://www.reddit.com/r/Dhaka/comments/1ozxvf4/can_anyone_recommend_a_place_to_repair_headphone/,2025-11-18 06:47:48,Dhaka
A level students,"Hello A level students. 

Selling past paper solutions ranging from 2016/15- 2024. 

Drive Link will be provided for the following subjects : 



1)Maths

2)Physics

3)Chemistry

4)Biology

5)Business

6)Economics. 



\#Pdf contains detailed explanations. Majority of the quesitons include explanations , except the ones that are too Obvious. 

For Doubts or Query- sample pdf can be provided. 

Dm to know the rate+ Any doubts.

",Hot-Effective5484,7,4,https://www.reddit.com/r/Dhaka/comments/1ozvonm/a_level_students/,2025-11-18 05:14:35,Dhaka
Kinda unemployed,"It's past 4am and a lot going through my head. Spent up all of my savings and broke rn. 

I got skills but I do not get paid enough for it, so going through a mental breakdown as well. Don't really know what to do in this situation. 

Anxiously hasitated for a few mins if I should post this or not but f it, I got nothing to lose",smolcatfis,12,13,https://www.reddit.com/r/Dhaka/comments/1ozuul3/kinda_unemployed/,2025-11-18 04:41:03,Dhaka
Need One plus 15,"Cant find any official release date of one plus 15.
And dont seem to find any shop selling them also 
how do i get my hands on them 
also how di i get the offical one not the chinese one",MentionAdmirable1902,2,1,https://www.reddit.com/r/Dhaka/comments/1ozurbe/need_one_plus_15/,2025-11-18 04:37:24,Dhaka
Afraid to attend job interview,"After grinding so much and applying to tons of jobs, Finally started getting shortlisted and getting interview calls. But after attending two interviews and having some bad experiences, Afraid to go to interviews now. Started skipping interviews since then. How can I get rid of this fear?",Great-Object1436,3,7,https://www.reddit.com/r/Dhaka/comments/1oztzwc/afraid_to_attend_job_interview/,2025-11-18 04:07:46,Dhaka
Please recommend me a shop/page that can bring thr Fisher Price DJ Table for Kids at lowest price from USA!,"Looking for a shop that can bring this in a price as low as possible, by December 2nd week! Please help!",AnirbanPaca,1,3,https://www.reddit.com/r/Dhaka/comments/1ozry23/please_recommend_me_a_shoppage_that_can_bring_thr/,2025-11-18 02:50:10,Dhaka
I am getting really depressed because of this,"My mom actually studied Law at Dhaka University. She was an excellent student back in her day. But she couldn't pursue her career to take care of my older brother, who has autism.

I finished my admission exam in 25. I actually got a seat at DU B unit, but as it was a low-ranking subject, I decided not to pursue it after studying for a couple of months. I chose to enroll in a Private University to get a good subject.

Ig my mom didn't like that. Now, like in every argument, she tells me ""Kono public e chance peye dekhate paros nai"", ""At least amra nijer ma baba ke khushi korte parsi DU te pore"", and if I correct her sentences or oppose her arguments in any other topic, she just replies with ""Tui toh DU teo tike thakte parli na"" and shii.

Ik that DU is tuff for this country, but Idk, now I don't even wanna study anything anymore. Her arguments are seriously getting under my skin. Today we argued and she said ""Tor toh kono bhalo bondhu o nai, amar bondhu ra at least DU te porse, tui toh gazadi der sathe ghure beras"" like tf???? She doesn't even say sorry, and if I argue too much, she decides to spit in my face and call me ""Kulangar"" and a ""Devil's spawn"".

A couple of days back, I actually went to the private university I wanted to get admission in, just to check out the campus and to know a few details about the subject and the cost. My mom insisted that she come with me. I bought her along with me. I talked to the Apu at the office and got the details. BUT, when we were about to leave, my mom just stood up and told the Apu that ""Janen amar chele er ageh DU te chilo, and amio DU r student"". The girl sitting behind us just looked at me like ""Really, is this fr??"" I felt so embarrassed, I just walked out. So is anyone's mom like tis or am I just losing my mind over nothing?

What type of Institutional pride is this?",Icey-cold,42,35,https://www.reddit.com/r/Dhaka/comments/1ozqqjd/i_am_getting_really_depressed_because_of_this/,2025-11-18 02:05:00,Dhaka
Hair salon/parlor suggestions,Where should I go if I wanna get bangs that won't absolutely ruin my hair?,MacaroonNo3569,3,3,https://www.reddit.com/r/Dhaka/comments/1ozqk4s/hair_salonparlor_suggestions/,2025-11-18 01:58:54,Dhaka
Bangladesh Court Orders Death Penalty for Ex-PM Hasina Over Deadly 2024 Uprising,,shadrack_CK,5,0,https://dailyglitch.com/bangladesh-court-orders-death-penalty-for-ex-pm-hasina-over-deadly-2024-uprising/,2025-11-18 01:56:01,Dhaka
how to gain experience early,"18 year old college student, i'm looking for part time jobs or organizations to work in to build experience. what are some ways i can get recruited for non profit orgs or get hired as a part timer? i'm passionate and have intermediate experience in graphic designing, writing, data analysis, and social media management. i'm confident i have efficient skills.

anyone who knows how i can utilize these please let me know, i'm very passionate about what i do. thank you !!",SwordfishHealthy3565,3,2,https://www.reddit.com/r/Dhaka/comments/1ozojs8/how_to_gain_experience_early/,2025-11-18 00:44:33,Dhaka
