title,body,author,upvotes,comments,url,date,subreddit
Evening Master’s courses at KU,Can anyone suggest if Khulna University offers any evening Master’s programs? I just want to keep myself engaged and productive. ,Puzzleheaded_Mine992,1,0,https://www.reddit.com/r/Dhaka/comments/1p3yogn/evening_masters_courses_at_ku/,2025-11-22 23:18:04,Dhaka
Phone Stolen at Airport Railway Station,"Hi everyone,  
Yesterday, my phone (Google Pixel 7 Pro) was stolen from my pocket while I was getting into the train at Airport Railway Station. I filed a GD at Airport Railway Station Thana, but I’m not sure what else I can do now to try to recover it.

My biggest concern is unauthorized access to my personal data. I’ve already taken the following steps today:

* Reissued my SIM
* Signed out of all Google accounts
* Logged out of apps like WhatsApp and other services
* Locked the device from my Google account

Still, I’m worried if there’s anything more I should do to protect my data or increase the chance of getting the phone back.

If anyone has experience with similar cases or knows the proper steps to take in Dhaka, I would really appreciate your guidance.  
Specifically:

* Any realistic ways to track or recover a stolen phone here?
* Whether contacting the mobile operator or Google support helps in any way
* How to effectively follow up with the thana to improve recovery chances
* Any additional precautions to secure my data

Any help or suggestions would be greatly appreciated. Thanks in advance.

  
I also used GPT to refine this post so that I can clearly explain my situation.\*",Clear-Stop-1087,1,0,https://www.reddit.com/r/Dhaka/comments/1p3yjfj/phone_stolen_at_airport_railway_station/,2025-11-22 23:12:20,Dhaka
Earthquake and fear mongering by News outlets,"After the earthquakes that hit Bangladesh in the last 2 days News outlets have started over exaggerating the threat. They are capitalizing on people's fear. I saw one outlet literally saying there can be magnitude 9 earthquakes in Bangladesh. First of all this is total vogus. Bangladesh does not have the type of subduction zone needed for magnitude 9 earthquakes. So it is highly unlikely to be hit by a mag 9 earthquake. Now about today's earthquake. After any 5-6 magnitude earthquake aftershocks are normal. 2-10 aftershocks in the first 24–72 hours is common. Now it's not that there isn't any risk of earthquake anymore. There's still a chance to be hit by a big earthquake. Research says there can be maximum 7.5-8 mag earthquake in this zone. So now it's not the time to get scared. We need to be prepared for earthquake. We need to make preparation. Mark places you can take shelter during earthquakes(hard tables,beds), keep a bag ready with important papers, keep your shoes/sandles out because there can be debris in worst case scenarios, keep a bag ready with dry food and water and Always keep faith in your god and let's pray for each other's safety. ",sadn_,10,5,https://www.reddit.com/r/Dhaka/comments/1p3yen0/earthquake_and_fear_mongering_by_news_outlets/,2025-11-22 23:07:08,Dhaka
Posture problem - Any good treatment in Dhaka?,"I've had a very bad posture since teenage. Now in adulthood it has gotten so bad that just walking is painful. There's multiple problems like forward head, pelvic tilt, collapsed foot arch etc. Day to day activities have become very difficult to perform and any sort of neck or spine movement makes things worse.

Has anyone gone through this? Is there a reliable place and process to treat it?",LessTell,1,0,https://www.reddit.com/r/Dhaka/comments/1p3yc84/posture_problem_any_good_treatment_in_dhaka/,2025-11-22 23:04:25,Dhaka
Am I experiencing PTSD after the earthquake?,"Last night I couldn’t sleep properly. I was awake the whole time and for a few minutes I fell into very light sleep but suddenly woke up. I don’t think I was dreaming. My eyes were open, and I felt like the ceiling was breaking and about to fall on me, I could also hear my mother and everyone shouting, just like they were during that time. I jumped up from my sleep because it felt so real. Even now, every time I try to sleep or close my eyes, I get flashbacks of last day’s incident.

Are you also experiencing the same thing?",Infinite-Sector-8694,6,9,https://www.reddit.com/r/Dhaka/comments/1p3y10c/am_i_experiencing_ptsd_after_the_earthquake/,2025-11-22 22:52:24,Dhaka
Are these actually foreshocks or aftershocks??,"Well we just experienced 3 earthquakes within 24hrs, though in mild magnitude, yet concerning. I've heard opinions like *Its the aftershock of the main quake*, again there's another group of people saying *its the conserved energy being released gradually and a major quake can happen at any time*. Damn, so which one do yall align with more?



Nevertheless, we should all remain prepared for any sort of possible disasters. Lastly, may fate be with us (considering our weakass infrastructure might go down)",Cold-Mess3019,6,7,https://www.reddit.com/r/Dhaka/comments/1p3xc3q/are_these_actually_foreshocks_or_aftershocks/,2025-11-22 22:24:43,Dhaka
SSC 26 need help,"can someone tell me exactly which board questions to solve to prep for the tests? I need physics, chemistry and both g. m and h. m questions. I already have a few physics ones. but if anyone has all the above marked down can you help me out? ",DrySuspect5165,2,1,https://www.reddit.com/r/Dhaka/comments/1p3wrx2/ssc_26_need_help/,2025-11-22 22:02:06,Dhaka
how are you guys dealing with the paranoia and anxiety about earthquakes,"i couldn't sleep last night until it was fajr and light outside. i keep thinking about how many dreams i have left incomplete and how i could die anytime without having fulfilled any of them, without having lived a life, without ever raising children of my own because i could just get crushed under the buildings if a major earthquake occurs. i used to get these thoughts before as well, but now they're just so real and so close. i managed to sleep about 5 hrs during the day when my mom was home, i don't think i'll get any sleep tonight as well. i'm also an admission candidate and i'm unable to focus on studies at all. what the hell do i do",NextTopWhoever,8,26,https://www.reddit.com/r/Dhaka/comments/1p3wrs8/how_are_you_guys_dealing_with_the_paranoia_and/,2025-11-22 22:01:58,Dhaka
Career dilemma,What's the best choice of  profession to stay in Bangladesh? Like which profession will ensure job safety and standard living? I really hate living here but I love my country at the same time. So how can I make a better living here?,Flimsy_Rope_781,4,8,https://www.reddit.com/r/Dhaka/comments/1p3wofm/career_dilemma/,2025-11-22 21:58:21,Dhaka
road bikes koi thik kore?,where can I fix my road bike in dhaka? ,DrySuspect5165,2,0,https://www.reddit.com/r/Dhaka/comments/1p3we1q/road_bikes_koi_thik_kore/,2025-11-22 21:46:14,Dhaka
Where to find a civil/structural engineer?,"I've got 6-7 cracks in my house
And some are on the beam.
So,where do I find a structural engineer to confirm if our house is any longer safe or not?

I live near Airport",ChocolateAromatic648,3,1,https://www.reddit.com/r/Dhaka/comments/1p3vydc/where_to_find_a_civilstructural_engineer/,2025-11-22 21:27:53,Dhaka
Need Advice...HSC-26,"Rakib Bhai er YouTube Math playlist Kore 
Su ahmed Math Book putata solve korle ki enough hbe?

",Alternative_Lake9445,2,4,https://www.reddit.com/r/Dhaka/comments/1p3vu0h/need_advicehsc26/,2025-11-22 21:22:54,Dhaka
Need advice on how to be financially self-reliant,"I'm 18m who's going to give his HSC next year. I honestly don't know what to do after hsc but I figured that by then I should have a source of income of my own. So I need help and advice. 

I grew up somewhat sheltered and am not exactly the best at teaching so tutoring is out. I know how to use canvas and am adequate at it but lack the experience of freelancing. 

Honestly I don't know what to do forward regarding this matter but I would appreciate if someone could help me, as I see post of people who who earn at least 10k tk doing something. ",Exotic-Chair-6960,2,0,https://www.reddit.com/r/Dhaka/comments/1p3vol3/need_advice_on_how_to_be_financially_selfreliant/,2025-11-22 21:16:36,Dhaka
A question (especially to hsc 25) regarding practicals,"I didn't go to college the whole year, didnt attend any lab classes and have absolutely no clue about practicals and all.   
Actual exam er time e ki egula niye kono pera hobe? Jodi ami lab work gula thik bhabe korte na pari? Also written part ta ki khata dekhe likhte dey? What is the worst mark I can expect?",Mean_Common_5269,0,7,https://www.reddit.com/r/Dhaka/comments/1p3vmcd/a_question_especially_to_hsc_25_regarding/,2025-11-22 21:13:54,Dhaka
Animals during earthquake,Frequent earthquakes since yesterday. Those who have pet animals in their houses how did they act before the earthquake? I’ve always known that somehow before anything happens animals can sense it. the dogs here were crying loudly around 2 am. ,ReplacementEarly5784,5,3,https://www.reddit.com/r/Dhaka/comments/1p3vfp5/animals_during_earthquake/,2025-11-22 21:05:56,Dhaka
How can i move forward respectfully when my family doesn't support my small online business idea?," Assalamulaikum .I'm looking for some advice .

I  just wanted to be self-reliant. I’m 23 years old (female), and that’s why I wanted to start a small art &amp; craft business online. This is the only thing I openly share with my family. As a result, they scold me a lot and create pressure so that I don’t even think about such things again. They also say hurtful things and insult me.
We are a middle-class family. My father covers all my necessary expenses, but he doesn’t like spending any additional money beyond that. I’m even afraid to ask for anything out of interest or hobby. That’s why I wanted to earn something on my own. But now I’m facing obstacles.
What should I do now?",n_artistic,8,9,https://www.reddit.com/r/Dhaka/comments/1p3utwg/how_can_i_move_forward_respectfully_when_my/,2025-11-22 20:39:56,Dhaka
Earthquake!,"The news about earthquake is making me anxious now.
Should we be worried?
Guys in my hostel are saying “ they have predicted a quake tonight and shit”
Should i stay out of the hostel building ?",Bulky_Penalty1027,13,19,https://www.reddit.com/r/Dhaka/comments/1p3uge4/earthquake/,2025-11-22 20:23:21,Dhaka
"Urgent Help: Best Path to Complete HSC in 1 Year as a Private Candidate in Dhaka (4-Year Gap, Night Job 9 PM-6 AM)","Hello everyone,
I need serious advice on the quickest and most flexible way to obtain my Higher Secondary Certificate (HSC). My goal is to finish the entire exam process (all subjects) and pass the board exam within approximately 12 months.
My Background &amp; Constraints:
Goal: Complete HSC in 1 year.
Preferred Group: Science is ideal, but I am prepared to switch to Humanities or Commerce if that group offers a more realistic path for a 1-year completion.
Education Gap: I have a significant 4-year break since passing Class 10 (SSC/equivalent). 2024-2025 batch from a vocational school.
Work Schedule: This is the biggest challenge. I work a fixed night shift from 9:00 PM to 6:00 AM. I am only available for classes/studying during the daytime/morning.
Group Recommendation: Based on my time constraint, would Commerce or Humanities be a more manageable syllabus to complete in 1 year compared to Science?

Also I need some career advice as well I wanted to be a software engineer or at least a computer science background, it's my passion. But I don't think I can do it with commerce or humanities
But anyways thanks",IK_Khan,2,0,https://www.reddit.com/r/Dhaka/comments/1p3u1or/urgent_help_best_path_to_complete_hsc_in_1_year/,2025-11-22 20:05:38,Dhaka
Hi people....,"Amar kache kemon Jani mone hoy Ami akta cage a atke achi... can't do anything....Amar kache kemon Jani sob somoy aimless feel hoy....numb feel hoy...mone hoy ki korchi....discontent feel hoy....Manush birokto lage Amar Manusher sathe Kotha o bolte Mon chay ....Amar Kotha bolle Mon chay keno bollam...overshare Kore fellam...arektu kom bola uchit chilo....
How do I get rid of these things?",No_Tailor2427,7,10,https://www.reddit.com/r/Dhaka/comments/1p3to8v/hi_people/,2025-11-22 19:48:43,Dhaka
3 earthquaks in one day,"My anxiety for a bigger earthquake that might happen in dhaka is increasing. Today there were 3 earthquakes in dhaka division 1 at 10:36AM another 2 right after each other one in badda and one in norshingdi at 6:06-6:08pm. Both being 3.7 and 4.3 in reichterscale respectively. I felt the one that happend in badda. I live quite close to badda and i think if a big earthquake does happen my apartment building might not survive as it is not fully build yet, i am somewhat relieved because yesterdays earthquake didn’t cause any harm or cracks to appear in the building. But everyday the risk gets higher and higher in my opinion. I fr need শান্তনা rn😭🙏",Watch-Recent,17,17,https://www.reddit.com/r/Dhaka/comments/1p3tggv/3_earthquaks_in_one_day/,2025-11-22 19:38:40,Dhaka
Are these recent tremors foreshocks or aftershocks?,"We’ve had a bunch of shakes lately, and if these are foreshocks then. well, we’re in for a bad time. Anyone know how to read this kind of activity?",ruhul0,20,24,https://www.reddit.com/r/Dhaka/comments/1p3sgz0/are_these_recent_tremors_foreshocks_or_aftershocks/,2025-11-22 18:50:37,Dhaka
Earthquake Alert App,আমার আইফোন ১৩ তে কোনো সেটিংস পাচ্ছি না।ভূমিকম্পের পূর্বাভাস পাওয়ার জন্য। কেউ কোনো আ্যপ সাজেস্ট করতে পারবেন?,Mahfuz-shihab,2,20,https://www.reddit.com/r/Dhaka/comments/1p3s9le/earthquake_alert_app/,2025-11-22 18:39:47,Dhaka
Sayedabad Bus Terminal,is there any bus available to mymensingh from sayedabad bus terminal ?,Advanced_Budget7301,1,6,https://www.reddit.com/r/Dhaka/comments/1p3rxlb/sayedabad_bus_terminal/,2025-11-22 18:21:42,Dhaka
Earthquake Again?,Did anyone feel that subtle tremor? 6:07 pm,Due_Fly_6934,63,71,https://www.reddit.com/r/Dhaka/comments/1p3rr78/earthquake_again/,2025-11-22 18:11:58,Dhaka
Quake round 2 &amp; 3,"Round 2 today at Gazipur at magnitude 3.3 10:36 PM BST

Round 3 JUST NOW at 6:05 PM BST. Lasted approx. 0.9s -- One little good shake and done.

Anyone else felt?",humble_akhBD,19,18,https://www.reddit.com/r/Dhaka/comments/1p3rqdj/quake_round_2_3/,2025-11-22 18:10:38,Dhaka
Another small earthquake?,Anyone?,Massive-Bank3059,16,18,https://www.reddit.com/r/Dhaka/comments/1p3rpyh/another_small_earthquake/,2025-11-22 18:10:00,Dhaka
I think there was a aftershock just now,Did anybody else feel it,No_0ne_1m,30,51,https://www.reddit.com/r/Dhaka/comments/1p3rprh/i_think_there_was_a_aftershock_just_now/,2025-11-22 18:09:42,Dhaka
Daraz refund on card,"So i have oddered some products recently from Daraz,  did the payment using my debit card. But had to cancel as i didn't notice i had selected a wrong address.
Now my refund is on pending. 

But question is, there's a lot of bad reviews regarding getting refund on cards.
Like daraz claim that they have done the refund but the card didn’t recieve it.

Does anyone have got refund on their cards after cancellation? 

",def-not-dev,4,1,https://www.reddit.com/r/Dhaka/comments/1p3rhlf/daraz_refund_on_card/,2025-11-22 17:57:11,Dhaka
Politics of BNP after August 5,How do you evaluate BNP politics after August 5,RazzmatazzStrict,2,2,https://www.reddit.com/r/Dhaka/comments/1p3rhk0/politics_of_bnp_after_august_5/,2025-11-22 17:57:07,Dhaka
Best online perfume store,"Where I can I buy old batches of perfumes in online with fair pricing? I’ve been buying from scentzonebd since last 2 years, their price is lower than any of their counterparts.. but nowadays most of the perfumes I look for arent there. Like I’ve been searching for Rayhaan tiger cal cologne edition older batches of Afnan supremacy collectors edition. 

Suggest me some reliable online stores fragheads. cheers ",Josephpainster,3,8,https://www.reddit.com/r/Dhaka/comments/1p3r1da/best_online_perfume_store/,2025-11-22 17:31:21,Dhaka
Suggestions for Gym (Gents Only),"Can anyone suggest gents only Gym in/near Mohammadpur. 
- I need to go to the Gym before 09.00 AM 
- Gents only is a must
- Good trainer and equipment.

If anyone have any better suggestions feel free to add. ",GhostSunless,2,3,https://www.reddit.com/r/Dhaka/comments/1p3qlzw/suggestions_for_gym_gents_only/,2025-11-22 17:05:25,Dhaka
My rideshare biker left me on the road but took the bike with him. I was still sitting… mentally.,"Today I experienced what I can only describe as a “Dhaka uninstall.”

I’m on a rideshare bike, holding on, being a normal functioning adult. We’re going over a road that looks like someone played Whack-A-Mole with actual moles.

Then we hit a pothole.  
A big one.  
The kind of pothole that has its own dialect and local government.

Physics said:  
“Brother, today you walk.”

The bike jumps.  
The biker jumps (spiritually).  
**I jump off the bike without my own permission.**

I literally get ejected like a poorly installed USB drive.

Here’s the part that broke me:

**The man did not stop.**  
**Did not look back.**  
**Did not even slow down.**

He just kept going…  
like I was never part of the subscription plan.  
Like I was a *free trial* that expired mid-pothole.

He left with the bike.  
I was left with…  
**the helmet.**  
Just standing there on the road holding it like a freshly divorced husband holding the blender she didn’t take.

People were staring.  
A rickshaw guy asked, “Bhai, bike koi?”  
I said, “Bhai, amio jani na… amar shathe breakup kore chole gelo.”

Anyway, I walked home with the helmet like a man who lost custody.",Medium_Push8841,90,27,https://www.reddit.com/r/Dhaka/comments/1p3qf4q/my_rideshare_biker_left_me_on_the_road_but_took/,2025-11-22 16:54:03,Dhaka
Need information regarding this,"i have completed my BBA recently and now want to pursue the CFA designation. My knowledge about the program is very limited, and I’m interested in understanding how demanding and valuable it is in the finance sector of Bangladesh. Can someone guide me with complete information about the CFA—its demand, structure, and career opportunities? I also want to know where to start and how to prepare effectively for CFA Level 1.
",Foreign_Hat_3852,2,1,https://www.reddit.com/r/Dhaka/comments/1p3qah0/need_information_regarding_this/,2025-11-22 16:45:57,Dhaka
He didn’t leave on his own,"In ewu. He didn’t leave on his own. This is all I have to say. 

If you know you know.",WasteCrow8280,10,31,https://www.reddit.com/r/Dhaka/comments/1p3q1eg/he_didnt_leave_on_his_own/,2025-11-22 16:29:51,Dhaka
English Medium Schools.,"Hello , I'd like to know english medium schools Near Agargaon for my nephew. He's around 4 years old. I'm aware of well reputed eng mediums school near bashundhara, But I have no idea regarding AGARGAON. Pls drop your suggestions",Grouchy-Put7676,5,4,https://www.reddit.com/r/Dhaka/comments/1p3pwgk/english_medium_schools/,2025-11-22 16:21:14,Dhaka
Dark circles,"I have dark circles for as long as I can remember. I do stay up late at night but I've been trying to change this. 

What should I do to get rid of this?",Ashamed_Elephant8047,2,8,https://www.reddit.com/r/Dhaka/comments/1p3pnns/dark_circles/,2025-11-22 16:05:51,Dhaka
How do I get my HSC certificates and transcript?,I recently gave HSC in 2025 and started applying for university aboard and also scholarships. There one of the required document is HSC certificate and academic transcript. But my results came just a month ago and I went to my college to see if it is possible to collect but they couldn't give proper response. I want to know how can I collect my documents ASAP. Is there someone who went for bachelors abroad?,pandemonium10,1,2,https://www.reddit.com/r/Dhaka/comments/1p3pkh4/how_do_i_get_my_hsc_certificates_and_transcript/,2025-11-22 16:00:34,Dhaka
where can i find niqab with burkha/abaya the cheapest in dhaka?,On the internet its over 1500 the sets. Are they ideally this pricey? I just need one to attend my classes and evryday use. So i dont want anything pretty looking. Just enough to make me uninteresting in public.,Particular_Weird_616,2,8,https://www.reddit.com/r/Dhaka/comments/1p3oywx/where_can_i_find_niqab_with_burkhaabaya_the/,2025-11-22 15:21:33,Dhaka
Dhaka lifestyle অনুযায়ী স্টুডেন্টদের কোন স্কিল শিখলে side-income সবচেয়ে সহজে শুরু হয়?,"যেমন— ২-৪ ঘণ্টা দিয়ে income করা যায় এমন স্কিল।
আপনারা বাস্তবে কোনটা করছেন?",Aaliynah550,10,13,https://www.reddit.com/r/Dhaka/comments/1p3o35d/dhaka_lifestyle_অনযয়_সটডনটদর_কন_সকল_শখল/,2025-11-22 14:23:24,Dhaka
What's the best minoxidil brand ?," What's the best minoxidil brand in Bangladesh or a Minoxidil brand you use and trust? My hair fall issues are only getting worse and my doctor said to get a minoxidil so which one should I try? He did name a brand but I can't find it anywhere in my local pharmacy

*Don't know if this is the right flair but I can't find any flairs for questions*",NoPapercrowns,2,15,https://www.reddit.com/r/Dhaka/comments/1p3ntgf/whats_the_best_minoxidil_brand/,2025-11-22 14:06:00,Dhaka
Found these cracks in my wall after the recent earthquake. Should I be worried?,"Just spotted a rather long crack running down my wall near the sink. Pretty sure it wasn't there before the earthquake.

What should I do now?

",MasaniYasin,183,68,https://www.reddit.com/gallery/1p3n9qh,2025-11-22 13:31:22,Dhaka
Information on liver disease specialists,"I'm currently looking for hematologists in Dhaka specialised in treating Wilson's disease. I've looked online and found that BMU/PG hospital has done quite a bit or research on wilson's disease, but don't know how I can reach them. Does anyone here have experience of seeing or know of, a hepatologist with specialisation on wilson's disease? Please let me know if you do. ",notkafka311,2,2,https://www.reddit.com/r/Dhaka/comments/1p3miqp/information_on_liver_disease_specialists/,2025-11-22 12:44:39,Dhaka
Earthquake again in Gazipur,"Within 24 hours, of 3.3 scale. :) Ekhon asholei bhoy lagtese Dhakay thakte.. Y'all be safe and sound. ",No-unluck-13,24,24,https://www.reddit.com/r/Dhaka/comments/1p3minj/earthquake_again_in_gazipur/,2025-11-22 12:44:29,Dhaka
চট্টগ্রাম লালদিয়া বন্দর বিদেশি কোম্পানির হাতে ব্যাপারে আপনার কি মনে হয়?,আমার ব্যক্তিগত মতামত হচ্ছে এটা অবশ্যই ঠিক আছে। ,Cool_Reflection9165,8,33,https://www.reddit.com/r/Dhaka/comments/1p3m9mo/চটটগরম_ললদয_বনদর_বদশ_কমপনর_হত_বযপর_আপনর_ক_মন_হয়/,2025-11-22 12:29:20,Dhaka
Help please,Does anyone know where i can buy yarn in dhaka? I want to get into crocheting for that i need some yarn. Where can i buy yarn that is not in bulk?,Abrar72,7,4,https://www.reddit.com/r/Dhaka/comments/1p3lqih/help_please/,2025-11-22 11:58:08,Dhaka
Suggest an AdBlock for my Android.,"I've been using this Open source adblocker ad away for couple of months it's free and open source and it was working great, still it's hides most of the ads but recently it's going down a little.

 Can anyone suggest me some open source free alternative for my Android?

 Please leave the link if you have one on you. Thank you.",realfahimislam,6,12,https://www.reddit.com/r/Dhaka/comments/1p3lg0n/suggest_an_adblock_for_my_android/,2025-11-22 11:41:16,Dhaka
any thinkpad users?,i use lenovo thinkpad x230 and from 2024 the battery is dead and i didnt replace it yet because by plugged in i can use it well but from 1-2 months i am thinking to replace the battery and i have went through a lot websites but most of them saying the stock is ended and stuff i even searched in Ryans...so like any suggestion what can i do now?,Outrageous_Big4236,4,4,https://www.reddit.com/r/Dhaka/comments/1p3ld62/any_thinkpad_users/,2025-11-22 11:36:40,Dhaka
Best Tour Place Suggestions for Couples in December,Maybe Sajek? Best Resort?,Captain_Sparrow07,2,7,https://www.reddit.com/r/Dhaka/comments/1p3kvs2/best_tour_place_suggestions_for_couples_in/,2025-11-22 11:09:34,Dhaka
how safe are the Travela private rooms nowadays?,thinking of going to one......to date!,sahab_436,1,2,https://www.reddit.com/r/Dhaka/comments/1p3kpx5/how_safe_are_the_travela_private_rooms_nowadays/,2025-11-22 11:00:52,Dhaka
Where i can sell my used clothes? (Male),"There are many groups for women but I didn’t find any group for male! 
I have many clothes that i used 1/2 times but they are expensive, so want to sell. ",Extension_Gene_5600,7,4,https://www.reddit.com/r/Dhaka/comments/1p3jrdb/where_i_can_sell_my_used_clothes_male/,2025-11-22 10:09:34,Dhaka
Looking for a place to live,"28M, Single, Entrepreneur, looking for a place to live in Bashundhara R/A. 
Range: Around 15k 
Open to share ",Wooden-Ferret-21,2,0,https://www.reddit.com/r/Dhaka/comments/1p3jp3e/looking_for_a_place_to_live/,2025-11-22 10:06:17,Dhaka
