title,author,upvotes,comments,combined_sentiment,combined_polarity,subreddit,date,topics
Getting Euro payments as a Bangladeshi,Alfred_Pithu,3,4,positive,0.0666219008264463,dhaka,2025-11-19 04:56:44,"Career/Jobs, Politics/Government, Technology"
Smartphone without AI features?,Outrageous-Being7136,7,4,positive,0.05454545454545455,dhaka,2025-11-19 01:16:41,"Career/Jobs, Food/Restaurants, Technology"
Suggest a good doctor for treating hairfall,UnicornFromAlaska,3,4,neutral,0.32499999999999996,dhaka,2025-11-19 01:01:40,"Career/Jobs, Relationships, Health/Medical, Shopping/Commerce, Food/Restaurants, Technology, Real Estate"
Visiting Dhaka - looking for recommendations,RealZubidoo,2,2,positive,0.14833333333333334,dhaka,2025-11-19 01:00:32,"Career/Jobs, Travel/Tourism, Shopping/Commerce, Food/Restaurants, Technology, Real Estate, Infrastructure"
Shopping,PostHoliday9789,4,4,positive,0.13,dhaka,2025-11-19 01:00:26,Shopping/Commerce
where to fix roadbikes?,DrySuspect5165,2,2,neutral,0.0,dhaka,2025-11-19 00:58:35,Infrastructure
Life mistakes..,RadoanIslamEthan,10,7,negative,-0.16666666666666663,dhaka,2025-11-19 00:41:11,Real Estate
To the US and Europe Based BD community,Left-Homework-6650,3,4,positive,0.08839285714285713,dhaka,2025-11-19 00:06:45,"Career/Jobs, Relationships, Shopping/Commerce, Food/Restaurants, Technology, Real Estate, Infrastructure"
Dad's Birthday,unfrared,6,3,positive,0.11666666666666665,dhaka,2025-11-19 00:02:43,Food/Restaurants
Dhaka's traffic is getting worse and no one seems to care,StockholmSyndrome_69,23,14,negative,-0.2683333333333333,dhaka,2025-11-18 23:46:19,"Politics/Government, Real Estate, Infrastructure"
Is Ali2BD reliable?,SalaryImpressive7469,13,15,negative,-0.14375000000000002,dhaka,2025-11-18 23:21:16,Shopping/Commerce
How do i pass HSC ICT?,nimbus2346,1,42,negative,-0.16999999999999998,dhaka,2025-11-18 22:55:55,"Education, Health/Medical, Technology"
Suggest stores to buy unofficial iphone,amnesia_luck,3,10,positive,0.35,dhaka,2025-11-18 22:47:02,"Shopping/Commerce, Technology"
are actually reliable birth control pills available in this city?,Proof-Mousse6951,6,9,neutral,0.1,dhaka,2025-11-18 22:21:13,Technology
Bangladesh is severely lacking in Public Libraries and overall access to books.,Honest_Ad_6090,55,38,neutral,0.03525999793856937,dhaka,2025-11-18 21:43:20,"Education, Career/Jobs, Politics/Government, Technology"
Keychains,AffectionateTie8130,4,6,neutral,0.0,dhaka,2025-11-18 21:35:47,"Shopping/Commerce, Technology"
20(F),cat-woman2005,0,11,negative,-0.08333333333333333,dhaka,2025-11-18 21:33:59,Career/Jobs
Is there anything I can bring from Germany and sell at a profit in Bangladesh?,United-Road-7338,2,3,neutral,0.0,dhaka,2025-11-18 21:07:32,"Travel/Tourism, Shopping/Commerce"
How much marks and where my placement should be if I want to get IR (international relation) in BUP FSSS?,Levi_BD,1,0,neutral,0.04487179487179486,dhaka,2025-11-18 20:49:31,"Education, Relationships, Technology, Real Estate"
Bangladeshi women should stop settling for less. We are enabling these losers,QuietSuccessfull,149,336,positive,-0.00779478458049887,dhaka,2025-11-18 20:37:15,"Relationships, Health/Medical, Food/Restaurants, Sports, Technology"
Cloudflare Blocked?,aunnyglitch,20,27,positive,0.25,dhaka,2025-11-18 20:05:29,"Career/Jobs, Technology"
A little support!,jasontoddloverr,2,3,neutral,-0.15437499999999998,dhaka,2025-11-18 20:05:16,Technology
Is this flight connection too risky? Need advice.,meetnyself,1,4,neutral,-0.04866071428571429,dhaka,2025-11-18 19:57:03,"Travel/Tourism, Technology, Real Estate"
How to make greek yogurt from Aarong tok doi? Please help,Resident_Ad9808,5,16,neutral,0.0,dhaka,2025-11-18 19:33:56,Other
Asking for suggestion for male skincare product,_t_gallant_,4,4,positive,0.11874999999999998,dhaka,2025-11-18 19:30:59,"Education, Shopping/Commerce"
Streaming App,Ark_rivia,1,3,negative,-0.0625,dhaka,2025-11-18 19:21:27,"Career/Jobs, Sports, Technology"
New year resolution suggestions,Famous_Meringue1818,6,10,positive,0.19602272727272727,dhaka,2025-11-18 19:15:22,Other
Hasina's death sentence,Ok_Big530,0,6,positive,0.08887987012987011,dhaka,2025-11-18 19:13:19,"Food/Restaurants, Politics/Government"
Dhaka-Chittagong highway speedcam?,Reedditcdi,3,3,neutral,-0.036250000000000004,dhaka,2025-11-18 19:07:11,"Career/Jobs, Real Estate, Infrastructure"
Men beauty,Mobile_Hearing5882,26,98,neutral,0.0,dhaka,2025-11-18 18:27:44,Other
BD domestic flights,zsk471,2,3,neutral,-0.0203125,dhaka,2025-11-18 17:07:13,"Travel/Tourism, Shopping/Commerce, Technology, Real Estate"
Government of the pressure group by the pressure group for the pressure group,RazzmatazzStrict,3,2,neutral,0.013312902375402374,dhaka,2025-11-18 16:45:54,"Career/Jobs, Shopping/Commerce, Food/Restaurants, Politics/Government, Technology, Real Estate, Infrastructure"
All you can eat Buffet,whatevermeme,19,25,positive,0.5,dhaka,2025-11-18 16:44:34,"Food/Restaurants, Real Estate"
Bank loan,Previous-Chocolate99,3,8,neutral,0.05,dhaka,2025-11-18 16:40:47,"Career/Jobs, Technology"
Dinner Set &amp; Womens Jewellery,Careful_Storm_3665,3,6,positive,0.22624999999999998,dhaka,2025-11-18 16:36:12,"Shopping/Commerce, Politics/Government, Technology, Real Estate"
Software engineering,PotatoMoney6765,3,9,positive,0.14285714285714285,dhaka,2025-11-18 15:08:37,"Education, Technology"
do ways of making money online really exist? i need serious help. (please no khalid farhan type of advice),unplugged_________,10,19,neutral,-0.013986592111592106,dhaka,2025-11-18 14:43:46,"Career/Jobs, Shopping/Commerce, Politics/Government, Technology"
Give me your top ragebait,Ok_Temperature1414,23,69,positive,0.4,dhaka,2025-11-18 14:13:12,Technology
Need hotel recommendations in Banani - unmarried couple,ArthurMorgan_47,16,51,neutral,0.0050925925925925965,dhaka,2025-11-18 13:59:43,"Relationships, Food/Restaurants"
I'm curious,Deep_While_3960,2,2,positive,0.075,dhaka,2025-11-18 13:48:18,Shopping/Commerce
জার্নালিং,Aegon_TargaryanII,15,10,neutral,0.0,dhaka,2025-11-18 13:45:20,Other
“৯০-এর দশকের ঢাকা—অতীতের শহরের এক মুহূর্ত 📸”,Embarrassed-Law6338,32,2,neutral,0.0,dhaka,2025-11-18 13:27:31,Other
Best flower shops,dengxiety,7,4,positive,0.6375,dhaka,2025-11-18 13:25:41,"Travel/Tourism, Shopping/Commerce, Real Estate"
Do Bangladeshi University Students Get .edu e-mail addresses?,biggestloserinearth,10,23,positive,0.07916666666666666,dhaka,2025-11-18 13:10:46,"Education, Technology"
C-B unit Bangla,t1tu_ez4ence,2,1,positive,0.06614583333333333,dhaka,2025-11-18 12:37:42,Education
CU vs RU,Abdullah715279,3,15,positive,0.16486013986013986,dhaka,2025-11-18 12:13:43,Other
Books,grey_maverick,1,1,neutral,0.0,dhaka,2025-11-18 11:50:05,Other
Looking for a Part Time/ Full time job.,iamnoman18,3,1,negative,0.11666666666666667,dhaka,2025-11-18 11:00:12,"Education, Career/Jobs, Shopping/Commerce, Sports, Technology, Real Estate, Infrastructure"
Excel Training Centers in Dhanmondi/New Market with Microsoft Certification,hard2resist,3,1,neutral,0.03921911421911421,dhaka,2025-11-18 10:55:59,"Education, Career/Jobs, Shopping/Commerce, Food/Restaurants, Technology, Infrastructure"
Study MBA!,Extension_Gene_5600,3,4,neutral,-0.02777777777777778,dhaka,2025-11-18 10:48:55,"Education, Career/Jobs, Technology, Real Estate, Infrastructure"
Trusted source to donate online?,SpecialistLow1164,5,7,negative,-0.125,dhaka,2025-11-18 10:33:51,Other
Had anyone buy smartphone from aliexpress if did let me know your opinion,Forward_Initial_5138,4,7,neutral,0.0,dhaka,2025-11-18 10:08:19,"Shopping/Commerce, Technology"
Need advice on what to do..for life..career..etc😭,One-Breakfast-3410,5,4,positive,0.07547383172383174,dhaka,2025-11-18 09:55:43,"Education, Career/Jobs, Relationships, Shopping/Commerce, Technology, Real Estate, Infrastructure"
Need Suggestions for Budget-Friendly Book Sites,Jumpy-Selection-7728,5,2,positive,0.1875,dhaka,2025-11-18 09:25:27,Shopping/Commerce
Good camera repair shop in Dhaka + cost?,Additional-Skirt-937,3,0,neutral,0.3725,dhaka,2025-11-18 07:13:38,"Shopping/Commerce, Technology, Real Estate"
Is arranged marriage still a thing in Bangladesh for male in their early 20s?,hackerbong,50,44,positive,0.10790476190476189,dhaka,2025-11-18 06:56:01,"Education, Career/Jobs, Relationships, Technology, Real Estate, Infrastructure"
Can anyone recommend a place to repair headphone near or close to Dhanmondi?,DisSapo1ntment,2,2,positive,0.15416666666666667,dhaka,2025-11-18 06:47:48,Technology
A level students,Hot-Effective5484,7,4,neutral,0.018750000000000003,dhaka,2025-11-18 05:14:35,"Education, Career/Jobs, Shopping/Commerce, Technology, Infrastructure"
Kinda unemployed,smolcatfis,13,12,neutral,-0.049999999999999996,dhaka,2025-11-18 04:41:03,"Health/Medical, Technology"
Need One plus 15,MentionAdmirable1902,2,1,neutral,0.0,dhaka,2025-11-18 04:37:24,Shopping/Commerce
Afraid to attend job interview,Great-Object1436,3,7,negative,-0.4375,dhaka,2025-11-18 04:07:46,"Career/Jobs, Technology"
Please recommend me a shop/page that can bring thr Fisher Price DJ Table for Kids at lowest price from USA!,AnirbanPaca,1,3,neutral,0.0,dhaka,2025-11-18 02:50:10,Shopping/Commerce
I am getting really depressed because of this,Icey-cold,41,32,neutral,0.09148550724637682,dhaka,2025-11-18 02:05:00,"Education, Career/Jobs, Relationships, Food/Restaurants, Politics/Government, Technology, Real Estate"
Hair salon/parlor suggestions,MacaroonNo3569,3,3,positive,0.1,dhaka,2025-11-18 01:58:54,Technology
Bangladesh Court Orders Death Penalty for Ex-PM Hasina Over Deadly 2024 Uprising,shadrack_CK,4,0,neutral,-0.1,dhaka,2025-11-18 01:56:01,"Shopping/Commerce, Food/Restaurants, Politics/Government"
how to gain experience early,SwordfishHealthy3565,3,2,neutral,0.09014756944444445,dhaka,2025-11-18 00:44:33,"Education, Career/Jobs, Technology"
"Where can I find good quality shoes, particularly block heels?",AnirbanPaca,4,6,neutral,0.25666666666666665,dhaka,2025-11-18 00:28:23,"Career/Jobs, Shopping/Commerce, Real Estate, Infrastructure"
Hasina's verdict,AggressiveRange6553,1,1,positive,0.09583333333333333,dhaka,2025-11-18 00:25:59,"Food/Restaurants, Politics/Government, Sports, Technology"
Need help with a 'theory of sets' mathematical problem.,Nipu2,4,5,neutral,0.0014705882352941137,dhaka,2025-11-18 00:01:31,"Education, Career/Jobs, Sports, Technology, Infrastructure"
"আছি, কিন্তু যেন নেই।",Mean-Spinach7355,9,14,positive,0.05562169312169312,dhaka,2025-11-17 23:58:26,"Relationships, Technology"
We need to talk about the border killing issue happening at the Indian border.,kindred_eldtrich,25,10,neutral,-0.02403846153846154,dhaka,2025-11-17 23:42:51,"Career/Jobs, Shopping/Commerce, Technology"
Awami League 🥱,rohanur69,0,8,neutral,0.0,dhaka,2025-11-17 23:27:27,"Politics/Government, Sports"
Looking for terrible but expensive restaurants in Dhaka. For recommending to an old enemy.,AlternativeMetal2017,3,2,neutral,-0.2333333333333333,dhaka,2025-11-17 22:41:35,"Food/Restaurants, Real Estate"
Pantheon?,aunnyglitch,2,6,negative,-0.17500000000000002,dhaka,2025-11-17 22:17:29,Other
do you guys know any wired earphones with good mic quality in dhaka,ghumkhor,5,12,positive,0.5666666666666667,dhaka,2025-11-17 22:15:01,"Technology, Real Estate"
Bhawal resort / Any resort for couple,Glittering-Tear-8017,9,55,neutral,0.007499999999999995,dhaka,2025-11-17 22:12:58,"Relationships, Real Estate"
I need suggestion from senior of mbbs student of any Divisional Medical,PaintingCreepy5444,6,3,neutral,0.0,dhaka,2025-11-17 22:05:06,"Education, Health/Medical"
অনলাইন কোচিং,Street_Event_2631,1,5,neutral,0.0,dhaka,2025-11-17 21:45:12,Other
medical aspirant next year,closetedluvergurl,2,1,neutral,0.0034722222222222203,dhaka,2025-11-17 21:18:34,"Education, Health/Medical, Technology"
Secret garden as a wedding venue?,swan_lake81,3,0,negative,-0.30000000000000004,dhaka,2025-11-17 21:17:18,"Relationships, Food/Restaurants, Technology"
Getting flowers for my gf,Eastern-Look-8143,5,11,positive,0.09814814814814815,dhaka,2025-11-17 20:12:46,"Career/Jobs, Relationships, Food/Restaurants, Technology, Infrastructure"
help me figure out,Frequent_Craft5676,9,33,neutral,0.032244318181818186,dhaka,2025-11-17 20:11:54,Relationships
Chittagong Port Update,RazzmatazzStrict,11,15,neutral,0.0,dhaka,2025-11-17 19:49:14,Other
Is there any place at mirpur other than cafes for hangout?,tasara-panda-09020,5,7,positive,0.005681818181818177,dhaka,2025-11-17 19:01:39,Food/Restaurants
Can someone provide Deshbd dc server invite,yahoo_olivia,1,2,neutral,0.0,dhaka,2025-11-17 18:32:28,Other
how are people affording to study outside,Temporary_Heart1018,62,84,positive,0.09107142857142857,dhaka,2025-11-17 18:20:20,"Education, Politics/Government"
I’m tired of struggling… but I’m still trying. Need some honest advice.,nafisa_q,11,22,neutral,0.0691358024691358,dhaka,2025-11-17 17:41:33,Technology
Shower Gel,Sparrow_tora_999,19,25,positive,0.31666666666666665,dhaka,2025-11-17 17:36:41,Shopping/Commerce
Asking for opinion,PracticalGur7035,16,23,neutral,0.03214285714285714,dhaka,2025-11-17 17:10:38,"Education, Career/Jobs, Relationships"
MTO,Candid-Ad-1951,3,4,neutral,0.0,dhaka,2025-11-17 17:04:15,Career/Jobs
Sheikh Hasina's Judgement,RazzmatazzStrict,2,90,positive,0.19166666666666665,dhaka,2025-11-17 16:52:23,"Politics/Government, Technology"
Hard time,Puzzleheaded_Mine992,6,6,positive,-0.06770833333333334,dhaka,2025-11-17 16:51:50,Other
Failed HSC Twice Can I Still Get Into a Private University in Bangladesh,ResponsibleFudge8955,2,9,neutral,-0.17291666666666666,dhaka,2025-11-17 16:46:56,"Education, Technology"
Ladies: hair parlor?,TurbulentCup5219,7,9,negative,-0.2,dhaka,2025-11-17 16:06:46,"Shopping/Commerce, Technology"
Testaurants like Izakaya,999baseballs,2,9,neutral,0.0,dhaka,2025-11-17 15:59:21,Food/Restaurants
"Dear Shahbagis, you can seek justice and still achieve a death sentence.",ahmad_musaffa,0,49,positive,0.1714285714285714,dhaka,2025-11-17 15:40:02,"Food/Restaurants, Technology"
Is a foldable laptop table actually useful?,Suspicious_Cheek3878,5,5,positive,0.2520833333333333,dhaka,2025-11-17 15:32:01,"Education, Shopping/Commerce, Technology"
Just to know how you guys figure it out.,Abir_Islam,2,18,positive,0.09375,dhaka,2025-11-17 15:24:19,Technology
Ousted Bangladesh PM Sheikh Hasina sentenced to death for crimes against humanity,Power-Equality,79,42,neutral,0.0,dhaka,2025-11-17 14:56:28,"Food/Restaurants, Technology"
Twilight at 60kmph,Equivalent_Doubt_969,19,1,neutral,0.0,dhaka,2025-11-17 14:39:55,Other
Sending sensitive medicine like Insulin to Madaripur (Village),7uckingMadMan,5,2,positive,0.18928571428571428,dhaka,2025-11-17 14:09:15,"Health/Medical, Real Estate"
Bachelors in china,LilNoirito,4,8,positive,0.06666666666666667,dhaka,2025-11-17 13:34:32,Education
Perfume suggestion under 2000 taka,_parrot_king0,13,12,positive,0.35,dhaka,2025-11-17 13:24:04,Other
Hangout place suggetion!,Equal-Love-4701,3,1,positive,0.2737244897959184,dhaka,2025-11-17 13:23:15,"Relationships, Real Estate"
Need simple healthy meals I can cook alone.,Due_Calligrapher2742,9,10,positive,0.1754120879120879,dhaka,2025-11-17 13:01:33,"Education, Relationships, Health/Medical, Food/Restaurants, Real Estate, Infrastructure"
Miss Universe Bangladesh 2025 Hype,FinalGeneration,40,74,neutral,0.0,dhaka,2025-11-17 11:51:29,Other
মেট্রো,Master-Asparagus7789,2,3,neutral,0.0,dhaka,2025-11-17 11:04:35,Other
Visiting Bangladesh after 10 years best food,Noobiepoobie853,3,12,positive,0.575,dhaka,2025-11-17 10:41:56,"Travel/Tourism, Food/Restaurants"
Where can I find this type of half-zip cable knit sweater in Bangladesh?,beingElias,31,25,positive,0.12416666666666668,dhaka,2025-11-17 10:31:56,"Shopping/Commerce, Food/Restaurants, Real Estate"
MBA Options (Is Jagannath the right choice for me?),Mysterious_Many007,2,13,neutral,0.18452380952380953,dhaka,2025-11-17 10:09:46,"Education, Career/Jobs, Technology"
My Android Cellphone got stolen.,Iori3310,5,11,positive,0.10625,dhaka,2025-11-17 08:23:11,Technology
Pakistani Planning to do mbbs from Bangladesh,timespaceweb,27,39,positive,0.09285714285714286,dhaka,2025-11-17 06:19:51,"Education, Health/Medical, Technology, Real Estate"
Bangladesh vs India Football Match,OdysseusWit,3,2,neutral,-0.012499999999999997,dhaka,2025-11-17 05:55:37,"Shopping/Commerce, Sports"
Effective support system,No-Scientist-8273,8,8,positive,0.4571428571428571,dhaka,2025-11-17 03:13:18,Technology
Music Band suggestions??,IMSALTY-Real,1,8,positive,0.190625,dhaka,2025-11-17 02:50:02,Relationships
Do you believe in jinn? I want to hear your real experiences,Last-Engineering-649,47,128,positive,0.18392857142857144,dhaka,2025-11-17 02:36:30,"Relationships, Technology, Real Estate"
How to deal with emotionally and physically abusive father during admission phase,strangerthings8989,3,5,neutral,0.004166666666666666,dhaka,2025-11-17 02:03:25,"Education, Infrastructure"
Can deliverymen see what you have ordered?,Legitimate_Sky5632,3,3,negative,-0.0875,dhaka,2025-11-17 01:54:54,Shopping/Commerce
NID Permanent Address Correction,CaffineIsGood,8,1,positive,0.1,dhaka,2025-11-17 01:45:26,Technology
How do you deal with Anxiety?,SquareProtonWave,5,9,negative,-0.06875,dhaka,2025-11-17 01:32:13,Health/Medical
MAT(25-26),Interesting-Bag-3210,6,9,neutral,0.0,dhaka,2025-11-17 00:58:40,"Education, Health/Medical"
Can you tell me about BRTA?,internet_godfather,6,4,positive,0.13124999999999998,dhaka,2025-11-17 00:58:09,Technology
"Bengali in rome,italy",Beginning-Bar-1138,2,0,positive,0.125,dhaka,2025-11-17 00:38:59,"Education, Relationships"
Asking for Marriage to Wali,GoingHypersonic,10,5,positive,0.13839285714285715,dhaka,2025-11-17 00:38:58,Relationships
When do medical colleges open for the next batch in bangladesh 2026,No-Yogurtcloset9949,2,6,neutral,0.0,dhaka,2025-11-16 23:45:36,"Education, Health/Medical"
ডিবেট শিখার কোনো অর্গানাইজেশন ঢাকায় আছে?,Total_Advertising975,5,11,neutral,0.0,dhaka,2025-11-16 23:10:12,Real Estate
Which BUTEX Textile Engineering Department Should My Younger Brother Choose? Need Honest Advice,Redwanul-Haque2467,6,8,positive,0.20631105006105005,dhaka,2025-11-16 23:00:13,"Education, Career/Jobs, Health/Medical, Technology, Real Estate"
Farmgate to BAF Shaheen Kurmitola,Twha_Khan,2,6,positive,0.1,dhaka,2025-11-16 22:56:58,"Education, Travel/Tourism, Technology"
Laptop Issue,Longjumping-Fly-480,3,2,neutral,-0.002705627705627706,dhaka,2025-11-16 22:28:19,"Career/Jobs, Relationships, Health/Medical, Shopping/Commerce, Technology, Real Estate"
how to be an independent woman in bangladesh,closetedluvergurl,43,26,neutral,-0.048095238095238094,dhaka,2025-11-16 22:14:54,"Education, Real Estate, Infrastructure"
Suggestion on buying mechanical Keebs.,Flat_Age_5777,2,5,positive,0.09214285714285712,dhaka,2025-11-16 21:47:25,"Shopping/Commerce, Real Estate"
Coding Partner,ElegantSwimmer3726,5,24,positive,0.06946969696969697,dhaka,2025-11-16 21:38:14,Technology
Gym Flings!,Almostfamous_02,39,55,negative,-0.09226562499999999,dhaka,2025-11-16 21:10:37,Relationships
Casio buying,Mahmud_Emon,3,3,positive,0.1875,dhaka,2025-11-16 21:07:55,Shopping/Commerce
I WANNA KNOW ABOUT JAGANNATH UNIVERSITY,Competitive-Rate-951,29,49,neutral,0.0,dhaka,2025-11-16 20:59:00,Education
"I’m soft, I’m tired, I’m trying and that’s enough. My heart is loud, even if my presence isn’t.",h_sadia,25,12,neutral,-0.03559027777777778,dhaka,2025-11-16 20:46:28,"Travel/Tourism, Food/Restaurants, Technology, Real Estate"
How to start?,Physical-Fact-7191,6,6,neutral,0.0,dhaka,2025-11-16 20:09:16,Technology
Want to learn to cook,LessTell,10,21,positive,0.39999999999999997,dhaka,2025-11-16 20:06:26,Food/Restaurants
Attempting,WasteCrow8280,0,23,neutral,0.0,dhaka,2025-11-16 19:35:17,Other
is this good for a 11th grader?,Majestic_Search4740,7,6,positive,0.7,dhaka,2025-11-16 19:35:09,Other
how do i make money?,StrangeFile8991,17,34,positive,0.08555672268907563,dhaka,2025-11-16 19:25:39,"Education, Technology"
Medical emergency 🦺,Hot-Tangerine3979,6,6,positive,0.07954545454545454,dhaka,2025-11-16 19:18:37,"Health/Medical, Travel/Tourism, Real Estate"
Tax law firm in Dhaka,Agile-Lifeguard-2063,3,5,positive,-0.024999999999999994,dhaka,2025-11-16 18:32:44,"Food/Restaurants, Politics/Government, Technology, Real Estate"
Earbuds Battery Replacement ( Soundpeats Capsule 3 pro),Advanced_Budget7301,2,4,neutral,0.05,dhaka,2025-11-16 17:58:39,"Shopping/Commerce, Food/Restaurants"
আমি বই পড়তে খুব ভালোবাসি। কিন্তু আমার ইংলিশ স্কুল লাইফ তেমন স্ট্রং ছিল না—তাই কিছু ইংলিশ বই বুঝতে সমস্যা হয়।,zawad_zarirrr,0,24,neutral,0.0,dhaka,2025-11-16 17:41:18,Technology
Gym location,redwizzardalastor,2,1,positive,0.3,dhaka,2025-11-16 16:24:59,"Technology, Infrastructure"
"Where do I buy authentic shampoos, deodorants and lotions?",External_Pen4135,3,2,neutral,0.25,dhaka,2025-11-16 16:14:34,"Shopping/Commerce, Technology"
টাকা বাদে জীবনে কোন একটা জিনিস আপনি সবচেয়ে বেশি চান?,Aaliynah550,40,128,neutral,0.0,dhaka,2025-11-16 15:59:18,Other
I need suggestions on male skincare products?,kindred_eldtrich,2,28,positive,0.1,dhaka,2025-11-16 14:15:41,Shopping/Commerce
Guitar,garlicbread0_0,3,16,neutral,0.0,dhaka,2025-11-16 13:58:06,Shopping/Commerce
NSU RETAKE,Spiritual_Scene634,1,4,neutral,-0.0069444444444444475,dhaka,2025-11-16 13:11:04,"Technology, Infrastructure"
BD🇧🇩 vs India🇮🇳 Match Ticket for Sale!,Opposite_Extension13,1,1,positive,0.10625,dhaka,2025-11-16 13:01:03,"Shopping/Commerce, Sports, Technology"
Perfumes,omerhabib44,4,16,positive,0.35,dhaka,2025-11-16 12:50:35,"Shopping/Commerce, Real Estate"
CBT for intrusive thoughts,aurora_100,7,10,positive,0.11249999999999999,dhaka,2025-11-16 12:49:45,"Career/Jobs, Health/Medical"
When will HSC happen?,Mean_Common_5269,3,8,neutral,0.0,dhaka,2025-11-16 12:31:54,"Education, Technology"
Life of a loser,Mysterious-Fly-9194,30,50,positive,0.05063492063492063,dhaka,2025-11-16 11:40:28,"Education, Food/Restaurants, Technology"
Self enjoyment,ElegantSteak7738,5,79,positive,0.2,dhaka,2025-11-16 11:19:40,Other
Suggestion for higher education,abid0506,0,3,neutral,0.1674107142857143,dhaka,2025-11-16 11:18:11,"Education, Career/Jobs, Infrastructure"
Where can I find cakes that taste amazing and have creative designs?,callmeIFTY,5,10,positive,0.47500000000000003,dhaka,2025-11-16 10:37:09,"Shopping/Commerce, Food/Restaurants, Real Estate"
অনেক বাংলাদেশি অভিবাসীর সবচেয়ে বড় বাধা প্রায়ই তাদের নিজের কমিউনিটিই হয়। একটি সাম্প্রতিক ঘটনা দেখিয়েছে—কীভাবে একজন লোক ব্যক্তিগত বিরোধের কারণে নতুনদের সাহায্য করার জন্য তৈরি একটি সাপোর্ট গ্রুপকে নিজের ইচ্ছামতো গেটকিপিং করছিল। বিষয়টি জানার পরও সিনিয়র সদস্যরা গুরুত্ব দিয়ে দেখেননি,jbttss,4,6,negative,-0.08333333333333333,dhaka,2025-11-16 10:32:02,Other
Lonely,Top-Slide-4095,3,26,neutral,-0.0875,dhaka,2025-11-16 10:31:02,Other
PPT expert needed.,raj_monir15,5,8,neutral,0.0,dhaka,2025-11-16 09:26:29,Food/Restaurants
Is there any local bus route using T.T.Para Underpass?,Treasure_Crusho,1,1,neutral,0.0,dhaka,2025-11-16 08:28:46,Infrastructure
Anybody have a good ayer mach or corsula recipe?,Maximum-Evening3904,2,1,positive,0.6,dhaka,2025-11-16 07:31:30,Food/Restaurants
Winter clothes,itzfaria,5,9,positive,0.32499999999999996,dhaka,2025-11-16 03:30:21,"Shopping/Commerce, Real Estate"
Struggling as an Artist,peedeepeesucks,5,10,neutral,0.039814814814814824,dhaka,2025-11-16 02:56:11,"Career/Jobs, Technology"
Seeking Investment to Scale My Small E-commerce Brand (Bangladesh) — Need Guidance &amp; Partners,ledlips6214,2,1,neutral,-0.09649152930402931,dhaka,2025-11-16 02:53:14,"Career/Jobs, Shopping/Commerce, Food/Restaurants, Technology, Real Estate, Infrastructure"
Any Bangladeshi living in oman here? Needed help,zebrina1,19,8,positive,0.07194444444444445,dhaka,2025-11-16 02:10:43,"Technology, Real Estate"
Where to invest 15k bdt as a student,dest_v18,2,6,neutral,0.0,dhaka,2025-11-16 01:55:49,Education
Do guys find girls with nose piercings attractive?,sabia__,53,132,positive,0.8,dhaka,2025-11-16 01:43:15,Other
Early morning GOOD breakfast spot at JamunaxBashundhara gate.,NeighborhoodCute6742,2,5,positive,0.4375,dhaka,2025-11-16 01:18:08,"Food/Restaurants, Technology"
Does anyone else think that people of this generation is intellectually poor?,Outrageous-Being7136,44,42,neutral,-0.1690018315018315,dhaka,2025-11-16 01:06:59,"Education, Relationships"
Quiet places near Dhaka,NefariousnessOk7185,2,15,positive,0.10833333333333334,dhaka,2025-11-16 00:48:15,"Food/Restaurants, Real Estate"
Random question,Dizzy_Sky_3350,33,147,positive,0.016666666666666663,dhaka,2025-11-16 00:23:46,Other
CA ki khub hard?,light_yagami004,4,7,negative,-0.20416666666666666,dhaka,2025-11-15 23:17:25,Other
Trying to collect foreign currency notes — where can I actually get my first ones in Dhaka?,Inevitable-Koala6828,2,3,neutral,0.06690082282913165,dhaka,2025-11-15 22:58:02,"Education, Travel/Tourism, Shopping/Commerce, Technology, Real Estate"
