title,author,upvotes,comments,combined_sentiment,combined_polarity,subreddit,date,topics
I GOT FIRED FROM MY JOB AT THE FIRST DAY,goinnbackto505,283,205,neutral,0.0955357142857143,dhaka,2025-11-15 21:49:52,"Career/Jobs, Health/Medical, Shopping/Commerce, Food/Restaurants, Politics/Government, Technology, Real Estate"
Web series,Responsible_Ad8408,2,6,positive,0.2,dhaka,2025-11-15 21:38:17,Other
Need advise,Shorkarjak,0,6,neutral,0.0,dhaka,2025-11-15 21:31:01,Other
Opinions on Rajshahi Uiversity?,noorbeer,1,1,neutral,0.025,dhaka,2025-11-15 21:13:34,"Education, Career/Jobs, Technology, Infrastructure"
Remote Video Editor Wanted,Arman_hossainalif,5,1,positive,0.1125,dhaka,2025-11-15 20:59:54,"Career/Jobs, Food/Restaurants, Technology"
Financial Suggestions,RespectFull4922,2,7,positive,0.2333333333333333,dhaka,2025-11-15 20:34:10,Other
Du IBA,999baseballs,0,6,neutral,0.0,dhaka,2025-11-15 20:33:28,"Education, Career/Jobs, Shopping/Commerce"
App that shows live Bangladesh Railway train positions - Find My Train: Bangladesh,jgainbd,86,21,positive,0.13451704545454546,dhaka,2025-11-15 20:13:56,"Career/Jobs, Travel/Tourism, Shopping/Commerce, Technology, Infrastructure"
Any good lighter er dokan?,ivodidalha,1,3,neutral,0.35,dhaka,2025-11-15 19:53:07,"Shopping/Commerce, Technology"
Suggest me a trusted service center for desktop motherboard in Multiplan/IDB,gigamind_sajid,3,1,neutral,-0.08750000000000001,dhaka,2025-11-15 19:22:52,Technology
"A Salafi Bangladeshi scholar is actively calling for jihad, destabilising three countries—Bangladesh, India, and Myanmar. As you can see in the video, the leadership of Jamaat-e-Islami and the BNP are enjoying this speech.",New_Edge360,6,2,neutral,0.09166666666666667,dhaka,2025-11-15 19:16:02,"Politics/Government, Sports"
The truth about Delwar Hossain Sayeedi,_syhumm_,0,12,neutral,0.0,dhaka,2025-11-15 18:41:02,Technology
Weekend activities in city like Dhaka?,PatientHistorian7459,8,37,positive,0.0875,dhaka,2025-11-15 18:39:33,"Education, Real Estate, Infrastructure"
Volunteering,Trick_Copy_5402,4,10,neutral,-0.0048611111111111095,dhaka,2025-11-15 18:18:17,"Education, Career/Jobs, Technology, Real Estate"
Can I use a phone-taken photo (edited for formality) for university applications?,Extension_Force7563,3,5,positive,0.15,dhaka,2025-11-15 18:03:12,"Education, Technology"
গীজার (geyser) কিনতে চাচ্ছি,Select-Day-873,8,23,negative,-0.375,dhaka,2025-11-15 17:46:00,"Shopping/Commerce, Food/Restaurants"
Does Milestone College charge extra fees for taking a TC?,Minimum-Afternoon323,3,1,neutral,-0.0009672619047619048,dhaka,2025-11-15 17:38:32,"Education, Technology"
when being deulu is the only solution,Odd_Science208,4,1,neutral,0.0,dhaka,2025-11-15 17:33:40,Other
how to get thailand visa by december,mehehuuuuh,4,1,neutral,0.0,dhaka,2025-11-15 17:19:51,"Technology, Real Estate"
প্রথমবার থাইল্যান্ড,Single-Cat8043,8,10,neutral,0.0,dhaka,2025-11-15 17:18:52,Other
should i change schools and take commerce?,vernoniestacos,4,3,neutral,-0.005364583333333332,dhaka,2025-11-15 17:11:09,"Education, Career/Jobs, Food/Restaurants, Technology, Real Estate"
indoor plants,Ruthmila,5,5,neutral,0.0,dhaka,2025-11-15 16:13:48,Other
F1,IllustriousArmy7201,23,34,neutral,0.0,dhaka,2025-11-15 16:07:37,Real Estate
2026 Referendum (গণভোট),Ark_rivia,13,13,neutral,0.029166666666666674,dhaka,2025-11-15 15:59:06,Politics/Government
I have 2 lakhs to invest | need suggestions to generate 30k–50k/month within 2–3 months (Bangladesh),Aggravating-Jury9096,0,27,positive,0.06836297760210805,dhaka,2025-11-15 15:57:33,"Career/Jobs, Shopping/Commerce, Technology, Real Estate, Infrastructure"
Ideology,IllustriousArmy7201,2,15,negative,-0.125,dhaka,2025-11-15 14:58:58,Other
"My grandfather (Nana) told my mom when she was a child that laughing too loudly would make her sinful and made her recite an Arabic verse whenever she laughed. Even normal laughter made her stop midway and quickly recite the verse, believing she had sinned.",the-machine-m4n,69,37,positive,0.24678030303030302,dhaka,2025-11-15 14:40:15,Technology
