title,author,upvotes,comments,combined_sentiment,combined_polarity,subreddit,date,topics
বাংলাদেশের ফুটবল স্টেডিয়ামের চারদিকে এতো বিশাল খালি জায়গা থাকে কেন? যেখানে আধুনিক বিশ্বের কোনো স্টেডিয়ামে এমনটা দেখা যায় না।,Massivehit,6,12,neutral,0.0,bangladesh,2025-11-19 15:54:57,"Technology, Real Estate"
HISTORIC VICTORY FOR THE COUNTRY!!!,Plastic_Repeat_995,66,9,positive,0.10744047619047618,bangladesh,2025-11-18 22:50:10,"Travel/Tourism, Sports, Technology, Real Estate"
Bangladesh wins,HinduShibir,218,12,positive,0.2916666666666667,bangladesh,2025-11-18 22:49:47,Real Estate
"Looking to Donate Books in Dhaka , Any Suggestions?",panic_structure,5,1,positive,0.0625,bangladesh,2025-11-18 22:24:55,"Education, Technology, Real Estate"
Bd domestic flights,zsk471,3,1,neutral,-0.0203125,bangladesh,2025-11-18 17:06:01,"Travel/Tourism, Shopping/Commerce, Technology, Real Estate"
Wake up Bangladeshis,Hot-Point-4090,2,1,positive,0.06443230490849537,bangladesh,2025-11-18 13:39:20,"Education, Travel/Tourism, Shopping/Commerce, Food/Restaurants, Politics/Government, Sports, Technology, Real Estate"
Passport Correction and Renewal in BD,Sensitive_Win_9094,5,3,positive,0.0625,bangladesh,2025-11-18 13:01:38,"Politics/Government, Technology, Real Estate"
"Protibastob from Dhaka Comics - An anthology of comics from various underrated artists, I love these artists so much, they're deserve so much more recognition, and I love the way Bangla comics is going, maybe one day it will become a world famous genre like manga",yasserius,6,0,neutral,0.18333333333333335,bangladesh,2025-11-18 12:54:50,"Relationships, Real Estate"
Looking for a Job.,iamnoman18,5,0,negative,-0.05833333333333332,bangladesh,2025-11-18 11:01:00,"Education, Career/Jobs, Shopping/Commerce, Sports, Technology, Real Estate, Infrastructure"
Your Top 5 Trusted Phone Shops in Dhaka,Electrical_Example28,8,4,positive,0.321875,bangladesh,2025-11-18 07:05:16,"Shopping/Commerce, Technology, Real Estate"
VoA for Dhaka Inbound from Different Country,Infinitoid,2,1,neutral,0.0,bangladesh,2025-11-18 02:23:06,Real Estate
Best place to live in Bangladesh?,Scared_of_Jobs,3,7,positive,0.37667871900826444,bangladesh,2025-11-17 15:30:51,"Career/Jobs, Health/Medical, Travel/Tourism, Food/Restaurants, Technology, Real Estate"
Visa on arrival questions,CompetitiveCat8220,2,2,neutral,0.01875,bangladesh,2025-11-16 09:12:32,"Travel/Tourism, Real Estate"
Gulshan Is Not Dhaka,Atel_mamu,5,0,neutral,0.0,bangladesh,2025-11-16 08:27:55,Real Estate
Trying to collect foreign currency notes — where can I actually get my first ones in Dhaka?,Inevitable-Koala6828,5,1,neutral,0.053684807256235825,bangladesh,2025-11-15 22:52:37,"Education, Career/Jobs, Travel/Tourism, Shopping/Commerce, Technology, Real Estate"
Which restaurant would it be in Dhaka?,Saif10ali,112,36,neutral,0.0,bangladesh,2025-11-15 20:39:13,"Food/Restaurants, Real Estate"
How Yunus Deceived BNP at the Last Minute,Alone-Attention-2139,35,35,neutral,0.025694444444444447,bangladesh,2025-11-15 18:31:25,"Politics/Government, Technology"
Places to get the best Mishti around Dhaka?,clarkeanator,7,8,positive,0.6302083333333334,bangladesh,2025-11-15 12:53:03,"Travel/Tourism, Technology, Real Estate"
Buying a 2nd hand flat in banani Dhaka.,Miserable-Bed3514,2,1,neutral,-0.01125,bangladesh,2025-11-14 03:11:50,"Shopping/Commerce, Politics/Government, Real Estate"
"Dhaka today.... No, more like everyday.",biscute2077,8,0,neutral,-0.075,bangladesh,2025-11-13 21:24:47,"Relationships, Real Estate"
Property inheritance to our child who is not a Bangladeshi citizen.,Hawk_KL01,18,15,neutral,0.003571428571428574,bangladesh,2025-11-12 17:12:51,"Relationships, Travel/Tourism, Politics/Government, Technology, Real Estate"
Its abt outfit,rrrihaaa,7,4,neutral,0.03546699512608604,bangladesh,2025-11-12 01:12:08,"Education, Shopping/Commerce, Technology, Real Estate"
A Bangladeshi couple who died in the 9/11 attacks.,Maverick_00x,557,54,positive,0.15000000000000002,bangladesh,2025-11-11 15:31:13,"Career/Jobs, Relationships, Technology, Real Estate"
What if Bangladesh actually had high-speed trains(250-350km/hour)?,SheehabMuhammad,16,35,positive,0.07062461348175633,bangladesh,2025-11-11 01:06:11,"Career/Jobs, Travel/Tourism, Technology, Real Estate, Infrastructure"
"If you had 6 months rent-free in a prime Gulshan/Banani duplex, how would you use it to build a business?",Anushirvan,6,7,positive,0.10104166666666667,bangladesh,2025-11-11 00:28:17,"Career/Jobs, Shopping/Commerce, Real Estate, Infrastructure"
Buffet suggestions in Dhaka,Few-Pumpkin3842,5,0,neutral,0.0,bangladesh,2025-11-10 21:26:24,"Education, Food/Restaurants, Real Estate"
Peace agreement before GTA VI,Sweaty_Topic8036,13,1,neutral,0.0,bangladesh,2025-11-10 21:13:17,"Education, Real Estate"
Trusted Gaming Laptop store in Dhaka,Expert-Access7844,3,5,positive,0.2333333333333333,bangladesh,2025-11-10 18:43:46,"Shopping/Commerce, Technology, Real Estate"
"Over a hundred primary school teachers were injured as police used batons, sound grenades, tear gas, and water cannons",Plastic_Repeat_995,15,3,neutral,0.25,bangladesh,2025-11-10 16:44:44,"Education, Career/Jobs, Politics/Government, Real Estate"
Where else to sell my smartphones?,Select-Day-873,2,0,positive,0.1046875,bangladesh,2025-11-10 16:34:42,"Shopping/Commerce, Technology, Real Estate"
Crude bombs exploded at four separate locations in Dhaka this morning (10 November),Plastic_Repeat_995,13,8,neutral,-0.38249999999999995,bangladesh,2025-11-10 16:06:55,"Career/Jobs, Health/Medical, Politics/Government, Technology, Real Estate, Infrastructure"
‼️Crude bombs exploded at 4 locations in Dhaka,AtikulIslam4142,80,25,neutral,-0.03214285714285713,bangladesh,2025-11-10 15:37:37,"Career/Jobs, Health/Medical, Politics/Government, Sports, Technology, Real Estate, Infrastructure"
⚠️ Top-listed criminal shot dead in broad daylight,AtikulIslam4142,185,44,negative,-0.1549768518518519,bangladesh,2025-11-10 14:55:29,"Education, Relationships, Health/Medical, Food/Restaurants, Politics/Government, Technology, Real Estate, Infrastructure"
Any querier service to send iPad outside Dhaka.,muaz_moss,7,3,negative,-0.08333333333333333,bangladesh,2025-11-10 07:03:44,"Technology, Real Estate"
Sending a 20 kg parcel from Dhaka to Budapest — any affordable and reliable courier options?,PrimaryInspection969,6,1,neutral,0.048214285714285716,bangladesh,2025-11-09 23:27:17,"Technology, Real Estate"
Animal rescue/shelter in Dhaka?,Tall_Monster,7,2,neutral,-0.046875,bangladesh,2025-11-09 21:13:06,Real Estate
"Will contest election from Dhaka, resignation depends on govt's decision: Asif Mahmud",PrintRealistic6750,22,12,neutral,0.0,bangladesh,2025-11-09 19:32:34,"Politics/Government, Real Estate"
"A peanut seller counts his loss as his Tk3,000....",Plastic_Repeat_995,124,6,positive,0.1847222222222222,bangladesh,2025-11-09 15:56:35,"Education, Shopping/Commerce, Politics/Government, Real Estate"
"Students of Ideal, Dhaka colleges reach peace agreement; City College missing from truce effort",Necessary-Hunt6104,82,24,neutral,0.175,bangladesh,2025-11-09 15:53:45,"Education, Real Estate"
My 28 months baby still not talking :(,Fancy-Day3847,32,17,positive,-0.29670068027210883,bangladesh,2025-11-09 14:43:02,"Health/Medical, Sports, Technology, Real Estate"
Need suggestions for Resort near Dhaka (for Honeymoon),Maybe_some,5,5,positive,0.13611111111111113,bangladesh,2025-11-09 10:55:24,"Relationships, Real Estate"
Pari Bibi's mausoleum at Lalbagh fort. Dhaka (1967) #viral #OldDhaka #Ol...,Sea-Test1273,3,1,neutral,0.0,bangladesh,2025-11-09 08:42:45,Real Estate
Anyone using Finasteride or Minoxidil? Need advice and good doctor recommendations,pulokjk,7,9,positive,0.42701863354037267,bangladesh,2025-11-08 23:36:09,"Health/Medical, Travel/Tourism, Food/Restaurants, Technology, Real Estate"
Need advice,Fragrant_Drop7397,6,3,positive,0.125,bangladesh,2025-11-08 22:31:26,"Shopping/Commerce, Technology, Real Estate"
Best place for cataract surgery in Dhaka?,Available-Ad-1014,5,1,positive,0.85,bangladesh,2025-11-07 21:14:11,"Health/Medical, Real Estate"
My Story,Budget_Platform_3736,47,37,neutral,0.007340274667860874,bangladesh,2025-11-07 13:35:35,"Education, Career/Jobs, Relationships, Health/Medical, Travel/Tourism, Food/Restaurants, Technology, Real Estate, Infrastructure"
Anyone studying criminology at university of dhaka?,faceittiger1142,3,0,neutral,0.0,bangladesh,2025-11-07 02:39:13,"Education, Real Estate"
Massacre in Dhaka!,Gold1Smith,24,25,neutral,0.049999999999999996,bangladesh,2025-11-06 17:12:20,"Food/Restaurants, Real Estate"
Looking for information about old/public libraries in Dhaka for a Wikimedia GLAM project,Yahya_b,3,0,positive,0.08839285714285715,bangladesh,2025-11-06 02:41:55,"Education, Career/Jobs, Technology, Real Estate"
Easy entry to Europe as a masters student.,canttellumyname,4,1,positive,0.3126165501165501,bangladesh,2025-11-06 00:32:58,"Education, Career/Jobs, Relationships, Politics/Government, Real Estate, Infrastructure"
Easy entry to Europe as a masters student.,canttellumyname,3,2,positive,0.3126165501165501,bangladesh,2025-11-06 00:32:53,"Education, Career/Jobs, Relationships, Politics/Government, Real Estate, Infrastructure"
Perfume Decants are a scam,azim-_-,4,7,negative,-0.05500000000000001,bangladesh,2025-11-06 00:18:20,"Shopping/Commerce, Real Estate"
Want a home rent in dhaka,Upset-Pay3295,2,2,neutral,0.0,bangladesh,2025-11-06 00:12:30,Real Estate
"wanna go to sylhet for tour with friends from dhaka, need suggestions and advices",Top-Pen-9698,3,3,neutral,0.0375,bangladesh,2025-11-05 16:47:18,"Travel/Tourism, Technology, Real Estate"
Probe blames pilot error for Milestone crash; all Air Force training to shift outside Dhaka,PrintRealistic6750,55,25,neutral,0.0,bangladesh,2025-11-05 16:36:41,"Technology, Real Estate, Infrastructure"
Why doesn’t Bangladesh have a soft power strategy?,Lampedusan,24,29,positive,0.14895833333333333,bangladesh,2025-11-05 11:02:18,"Relationships, Shopping/Commerce, Food/Restaurants, Sports, Technology, Real Estate, Infrastructure"
Bangladesh travel for uk female and Nepali boy in January ?,Soft-Dance-8601,5,5,positive,0.11937500000000001,bangladesh,2025-11-05 03:55:50,"Career/Jobs, Relationships, Travel/Tourism, Technology, Real Estate"
Delivery Service For My Home Bakery,DirectTone1689,3,5,neutral,0.0,bangladesh,2025-11-04 23:36:50,"Shopping/Commerce, Food/Restaurants, Real Estate"
"ফ্যাক্টরি পুড়ে, বিমানবন্দর পুড়ে, নির্বাচন দিয়ে বাঁচান: বিটিএমএ সভাপতি | BTMA | Dhaka | Somoy TV",maifee,7,1,neutral,0.0,bangladesh,2025-11-04 19:40:09,Real Estate
"BAF Shaheen College, Dhaka",Plastic_Repeat_995,18,2,neutral,0.0,bangladesh,2025-11-04 15:22:45,"Education, Real Estate"
Chittagong University W or L?,Soul_Sniper_26,1,17,neutral,0.007142857142857141,bangladesh,2025-11-04 01:07:16,"Education, Career/Jobs, Shopping/Commerce, Technology, Real Estate"
BNP candidates for JS polls: Who’s in the race for which seat in Dhaka?,PrintRealistic6750,5,2,neutral,0.0,bangladesh,2025-11-03 23:44:16,"Food/Restaurants, Politics/Government, Real Estate"
"Anybody got the ""Dhaka Racing 2003"" game?",VapeyMoron,7,3,positive,-0.14750000000000002,bangladesh,2025-11-03 23:28:32,"Sports, Technology, Real Estate"
BNP's Shafiqul Islam likely to face Jamaat chief Shafiqur in Dhaka-15,PrintRealistic6750,21,7,neutral,0.0,bangladesh,2025-11-03 19:56:45,"Politics/Government, Real Estate"
Need advice on future plans for studying Physics.,the_wave_equation,4,0,neutral,0.024406565656565658,bangladesh,2025-11-02 21:08:34,"Education, Career/Jobs, Food/Restaurants, Technology, Real Estate, Infrastructure"
The Daily Star Caught Red-Handed using AI-written Article,AtikulIslam4142,63,19,neutral,0.0,bangladesh,2025-11-02 18:19:22,"Shopping/Commerce, Technology, Real Estate"
আমি Windows &amp; Android user.,seowithriazul,5,2,positive,0.1835016835016835,bangladesh,2025-11-01 08:39:38,"Shopping/Commerce, Technology, Real Estate"
Any advice on getting a new passport quickly considering my restrictions?,Oryuuu,3,0,neutral,0.15536130536130535,bangladesh,2025-10-31 22:45:39,"Education, Real Estate"
‘No one stood up for her’: Bus helper arrested for hitting woman,fogrampercot,53,13,neutral,0.012202380952380952,bangladesh,2025-10-31 16:35:59,"Technology, Real Estate, Infrastructure"
Where can I find 99% Isopropyl alcohol in Dhaka?,Expert_Point_7816,6,4,neutral,0.0,bangladesh,2025-10-31 01:53:43,"Technology, Real Estate"
Dhaka University's admission notice mentions Hijras as disabled,AntiAgent006,23,16,neutral,-0.1,bangladesh,2025-10-30 21:55:31,"Education, Real Estate"
‘৫ আগস্টে আমরা পুলিশ মেরে ঝুলিয়ে রেখেছি’,AtikulIslam4142,27,2,neutral,-0.027777777777777776,bangladesh,2025-10-30 18:16:37,"Food/Restaurants, Politics/Government, Technology, Real Estate, Infrastructure"
Best thrifting place in Dhaka??,DebtLess2374,5,1,positive,0.95,bangladesh,2025-10-30 16:45:34,"Food/Restaurants, Real Estate"
Suggestions needed,FarhanAyan_,2,0,neutral,0.0,bangladesh,2025-10-29 23:48:26,"Shopping/Commerce, Real Estate"
Suggestions needed,FarhanAyan_,2,0,neutral,0.0,bangladesh,2025-10-29 23:38:51,"Shopping/Commerce, Real Estate"
visited Bangladesh,loserinlifee,18,3,positive,0.19583333333333333,bangladesh,2025-10-29 20:54:50,"Travel/Tourism, Food/Restaurants, Real Estate"
Challenges in Policing (part 2): Those who provide security live without dignity,AtikulIslam4142,19,4,neutral,0.06042846042846042,bangladesh,2025-10-29 19:02:01,"Career/Jobs, Travel/Tourism, Food/Restaurants, Politics/Government, Technology, Real Estate, Infrastructure"
পোশাক নিয়ে কটুক্তিকারীকে জুতাপেটা করলেন তরুণী,AtikulIslam4142,207,93,positive,0.05625,bangladesh,2025-10-29 16:50:00,"Food/Restaurants, Sports, Technology, Real Estate, Infrastructure"
Challenges in Policing (part 1): Inside the broken funding of BD police,AtikulIslam4142,10,2,neutral,-0.15324404761904764,bangladesh,2025-10-28 20:06:52,"Career/Jobs, Travel/Tourism, Food/Restaurants, Politics/Government, Technology, Real Estate, Infrastructure"
Need participants for a study,notkafka311,2,0,positive,0.05678571428571429,bangladesh,2025-10-28 01:09:51,"Education, Career/Jobs, Health/Medical, Technology, Real Estate"
Abduction or staged drama?,AtikulIslam4142,29,31,neutral,0.007678571428571429,bangladesh,2025-10-28 01:05:53,"Relationships, Health/Medical, Travel/Tourism, Shopping/Commerce, Food/Restaurants, Politics/Government, Technology, Real Estate"
What are the best options for inter district travel?,Nayuist,1,5,positive,0.65,bangladesh,2025-10-27 20:35:08,"Travel/Tourism, Technology, Real Estate, Infrastructure"
Is your family’s income halal?,United-Life7473,19,50,positive,0.06111111111111111,bangladesh,2025-10-27 19:55:45,"Education, Career/Jobs, Politics/Government, Technology, Real Estate, Infrastructure"
WHAT IS YOUR THOUGHT ABOUT FARMGATE METRO RAIL INCIDENT,Flat_South_8384,6,1,neutral,-0.005468750000000008,bangladesh,2025-10-27 11:25:20,"Career/Jobs, Relationships, Travel/Tourism, Food/Restaurants, Technology, Real Estate, Infrastructure"
"Why is the Comilla, Noakhali and Chandpur regions so densely populated, outside of Dhaka region? I thought the whole Barisal and Khulna divisions were more dense",maproomzibz,20,9,neutral,0.11666666666666665,bangladesh,2025-10-27 10:32:55,Real Estate
Halloween events in dhaka,No_idea_duh,2,0,neutral,0.0,bangladesh,2025-10-27 04:55:49,Real Estate
"Does anyone know where can I apply for learning boxing/ Muay thai near Mirpur,Dhaka?",Baked_Pan798,2,1,positive,0.1625,bangladesh,2025-10-27 02:26:57,"Technology, Real Estate"
Need recommendation of some trustworthy construction/ development companies in Dhaka?,jobie1267,3,1,positive,0.1841477272727273,bangladesh,2025-10-26 18:05:15,"Career/Jobs, Food/Restaurants, Technology, Real Estate, Infrastructure"
Dhaka Metro costs 5 times India's: Jica review sought to cut millions,Necessary-Hunt6104,69,23,neutral,0.0,bangladesh,2025-10-26 11:35:12,"Real Estate, Infrastructure"
Wanna start a paintball business,SiaM_AhameD21,30,6,positive,0.21339285714285716,bangladesh,2025-10-25 21:54:04,"Career/Jobs, Shopping/Commerce, Politics/Government, Technology, Real Estate, Infrastructure"
Indian Transit Visa for Bangladeshi,lonelykidfrom2006,6,1,neutral,0.008779761904761903,bangladesh,2025-10-25 13:50:48,"Travel/Tourism, Shopping/Commerce, Technology, Real Estate"
"As a Hindu Bangladeshi, it's so hard to have conversations with people about Bangladesh",LeadingSea6037,107,28,neutral,-0.17474966111329748,bangladesh,2025-10-25 11:54:42,"Relationships, Travel/Tourism, Food/Restaurants, Politics/Government, Technology, Real Estate, Infrastructure"
What are your honest thoughts on marriage in Bangladesh today?,BirdApprehensive9273,16,22,positive,0.3983333333333333,bangladesh,2025-10-25 05:15:55,"Career/Jobs, Relationships, Real Estate"
Anyone here who can help me visit a church in Dhaka?,Worldly_Yellow_6115,3,10,positive,0.20833333333333334,bangladesh,2025-10-25 00:27:48,"Relationships, Travel/Tourism, Real Estate"
Need Suggestions for Men’s Salons in Dhaka,NoPerception9519,4,1,positive,0.425,bangladesh,2025-10-24 16:07:01,"Technology, Real Estate"
Why is Bangladesh so shitty?,Vigilante-225,50,49,neutral,0.030555555555555544,bangladesh,2025-10-23 09:24:56,"Technology, Real Estate"
Try plastickothay,Any-Interaction-3192,4,1,positive,0.07936507936507936,bangladesh,2025-10-23 02:49:18,"Education, Shopping/Commerce, Food/Restaurants, Real Estate"
Buying an apartment in dhaka,Superzues09,6,10,positive,0.10696022727272726,bangladesh,2025-10-22 13:02:05,"Shopping/Commerce, Food/Restaurants, Real Estate, Infrastructure"
Seeking Suggestions for places to Settle-Down,eddieJK1630,4,4,positive,0.06826058201058201,bangladesh,2025-10-22 12:48:25,"Education, Career/Jobs, Food/Restaurants, Technology, Real Estate, Infrastructure"
Looking Suggestion for extra large size men clothes in Dhaka.,ais_21,6,12,positive,0.15954545454545455,bangladesh,2025-10-22 09:05:36,"Shopping/Commerce, Technology, Real Estate"
Why the r/Dhaka is almost twice as big as r/Bangladesh?,Plastic_Repeat_995,11,38,neutral,-0.05,bangladesh,2025-10-22 08:30:32,Real Estate
"Rajuk College, Dhaka admission exam 2025",Silly-Bed2231,5,3,neutral,0.008333333333333335,bangladesh,2025-10-20 22:55:50,"Education, Food/Restaurants, Technology, Real Estate, Infrastructure"
Electronics recycling,Maleficent_Silver560,3,0,positive,0.15,bangladesh,2025-10-20 19:26:55,"Technology, Real Estate"
Is RETINA a Jamaati organization?,NoSpeaker324,39,24,positive,0.08568376068376068,bangladesh,2025-10-20 17:56:03,"Education, Health/Medical, Shopping/Commerce, Politics/Government, Technology, Real Estate"
Awful Experience,snythxox,10,0,positive,-0.39375,bangladesh,2025-10-20 16:46:24,"Education, Health/Medical, Food/Restaurants, Technology, Real Estate"
"🪔 Kali Puja Vibes — Looking for a Travel Partner (Dhaka, Oct 20)",dhumketu69,0,8,positive,0.1409469696969697,bangladesh,2025-10-20 05:51:26,"Career/Jobs, Travel/Tourism, Food/Restaurants, Real Estate"
Imagine if Dhaka still looked like this...,maproomzibz,117,32,neutral,0.0,bangladesh,2025-10-20 01:47:40,Real Estate
Jagannath University student found dead in Old Dhaka building,Necessary-Hunt6104,23,2,neutral,-0.025,bangladesh,2025-10-19 20:27:04,"Education, Real Estate"
Dhaka grants full tax break on Rooppur debt repayment to Russia’s Rosatom subsidiary,Necessary-Hunt6104,4,2,neutral,0.175,bangladesh,2025-10-19 15:51:10,Real Estate
Looking for open minded affordable psychiatrists who specialize in adhd and autism in Dhaka.,Andromeda-K-,6,3,positive,0.0675,bangladesh,2025-10-18 23:15:29,Real Estate
"Dhaka airport fire: Businesses fear over $1 billion impact on imports, exports",Necessary-Hunt6104,33,3,neutral,0.0,bangladesh,2025-10-18 22:51:45,"Career/Jobs, Travel/Tourism, Technology, Real Estate, Infrastructure"
Looking for like minded people!,Sam_Monsterclaw,37,47,positive,0.15285087719298246,bangladesh,2025-10-18 21:24:14,"Career/Jobs, Relationships, Health/Medical, Travel/Tourism, Shopping/Commerce, Food/Restaurants, Technology, Real Estate, Infrastructure"
"Anyone worked at Truck Lagbe (Dhaka Head Office, Mohakhali)? Need honest feedback before my interview",Equal_Perspective230,3,2,positive,0.37968749999999996,bangladesh,2025-10-18 20:43:55,"Career/Jobs, Sports, Technology, Real Estate"
More flights diverted to Ctg as Dhaka airport shuts down after cargo zone fire,maifee,5,1,neutral,0.08611111111111111,bangladesh,2025-10-18 17:47:22,"Travel/Tourism, Technology, Real Estate"
Fire at Dhaka airport's cargo section; Connecting the dots; Why does this whole thing feel so orchestrated?,Status_Revolution_25,7,3,neutral,0.10795454545454546,bangladesh,2025-10-18 17:24:53,"Travel/Tourism, Shopping/Commerce, Food/Restaurants, Sports, Technology, Real Estate"
Seeking doctor recommendation for PCOS,nasia_musarat,5,1,positive,0.07065826330532214,bangladesh,2025-10-18 16:04:37,"Health/Medical, Shopping/Commerce, Technology, Real Estate, Infrastructure"
Is the internet in Dhaka fast and stable for video calls?,78523985210,4,5,negative,-0.0875,bangladesh,2025-10-18 13:46:52,"Travel/Tourism, Technology, Real Estate"
Struggles as an English medium student,Recent_Carry810,3,0,neutral,0.02874999999999999,bangladesh,2025-10-18 10:22:53,"Education, Travel/Tourism, Food/Restaurants, Technology, Real Estate"
Made a simple news aggregator for staying updated about Bangladesh 🇧🇩,namkhalinai,9,6,positive,0.12124368686868688,bangladesh,2025-10-18 07:15:30,"Career/Jobs, Relationships, Travel/Tourism, Technology, Real Estate"
Jobless for 10 months now.. Anyone else going through a similar struggle?,Condizero,15,8,neutral,0.026268443095366172,bangladesh,2025-10-18 00:59:14,"Career/Jobs, Health/Medical, Travel/Tourism, Shopping/Commerce, Food/Restaurants, Sports, Technology, Real Estate, Infrastructure"
HSC 2025 Dhaka Board Ranking,Consistent-Rule-3720,2,0,negative,-0.05625000000000001,bangladesh,2025-10-17 17:33:00,"Education, Technology, Real Estate"
"Between typical private universities in dhaka and public universities in chittagong, which are the best?",tdoteditz_exe,3,3,positive,0.23416666666666663,bangladesh,2025-10-17 17:08:35,"Sports, Technology, Real Estate"
"Got GPA 4.92 (Physics 180, Chemistry 185, Math 151, English A-) — Should I continue Engineering or move to University A Unit?",Fantastic-Permit-383,3,4,neutral,-0.027083333333333334,bangladesh,2025-10-17 16:18:08,"Education, Technology, Real Estate"
BCB DHAKA DIVISION CRICKET LEAGUE TOURNAMENTS,dhonbolsen,3,0,neutral,0.009788359788359785,bangladesh,2025-10-16 23:35:23,"Travel/Tourism, Sports, Technology, Real Estate"
Reality of the Hsc Result,anonimosus12,11,10,positive,0.06369047619047619,bangladesh,2025-10-16 21:39:19,"Education, Shopping/Commerce, Food/Restaurants, Technology, Real Estate"
Trusted Smartphone Shop in Dhaka?,Left_Application293,3,2,neutral,0.0375,bangladesh,2025-10-16 21:08:49,"Shopping/Commerce, Technology, Real Estate"
Anyone ever received mail/letters from overseas thru post office?,lonelykidfrom2006,2,1,positive,0.1142857142857143,bangladesh,2025-10-16 21:01:32,"Career/Jobs, Politics/Government, Technology, Real Estate"
From Nimtoli 2010 to Mirpur 2025 – how many more fires will it take for Dhaka to wake up?,Redwanul-Haque2467,10,1,neutral,0.24166666666666667,bangladesh,2025-10-16 09:32:48,"Technology, Real Estate"
Whats the deal with Stalls in Rabindra Sharabar in Dhanmondi,Ajwad6969,5,0,neutral,-0.0125,bangladesh,2025-10-15 23:49:39,"Technology, Real Estate"
Best place for hair transplant?,Odd-Machine189,3,1,positive,0.75,bangladesh,2025-10-15 19:19:33,"Health/Medical, Technology, Real Estate"
who is up for hangouts in dhaka,No_idea_duh,5,24,neutral,0.044480519480519475,bangladesh,2025-10-15 16:11:12,"Travel/Tourism, Real Estate"
Relationship advice,Famous_Divide6434,10,29,positive,0.05972537878787878,bangladesh,2025-10-15 11:29:13,"Education, Career/Jobs, Relationships, Travel/Tourism, Food/Restaurants, Technology, Real Estate, Infrastructure"
Please suggest a good private hospital in Dhaka for treating Heart related illness,da-chooozen-one,4,2,positive,0.31666666666666665,bangladesh,2025-10-14 14:31:56,"Health/Medical, Food/Restaurants, Real Estate"
I wanna study bachelor in abroad help me 🙏🏻,ilovemybmwx5,1,7,positive,0.12123015873015874,bangladesh,2025-10-13 23:35:33,"Education, Career/Jobs, Health/Medical, Technology, Real Estate, Infrastructure"
Wtf is happening in Bangladesh?,General-Dog4722,62,55,positive,-0.14222943722943723,bangladesh,2025-10-11 19:45:52,"Education, Food/Restaurants, Politics/Government, Technology, Real Estate"
"Energy adviser blames section of politicians, businessmen for crisis in gas sector",Shot-Addendum-809,4,2,positive,0.07083333333333333,bangladesh,2025-10-11 16:30:35,"Career/Jobs, Technology, Real Estate, Infrastructure"
"Need a Part-Time Personal Assistant (Dhaka-Based, Remote)",ovosmans89,10,17,positive,0.08625,bangladesh,2025-10-11 11:54:05,"Career/Jobs, Travel/Tourism, Food/Restaurants, Technology, Real Estate"
[AskMeAnything] Hello CS undergrads and recent grads!,Consistent_Deer5403,8,27,neutral,0.007512626262626262,bangladesh,2025-10-10 18:41:20,"Education, Career/Jobs, Sports, Technology, Real Estate, Infrastructure"
