title,author,upvotes,comments,combined_sentiment,combined_polarity,subreddit,date,topics
ভূমধ্যসাগরের নিচে ঘুমিয়ে আছে বাংলাদেশ - The Route of No Return | Voice of Dhaka,Asleep-Jellyfish007,1,0,neutral,0.0,bangladesh,2025-10-10 18:24:20,Real Estate
Places to go for a nightout drive in dhaka,Showmik27,8,5,positive,0.18333333333333335,bangladesh,2025-10-10 05:15:19,"Food/Restaurants, Real Estate"
Shia in puran dhaka,Better_tqas,1,0,negative,-0.05416666666666666,bangladesh,2025-10-10 04:56:21,Real Estate
"Help Me Pick a 43"" TV Under 50K Taka (Dhaka Buyers — Need Your Real Advice!)",drkaly,3,6,positive,0.22671227581941866,bangladesh,2025-10-09 22:57:19,"Relationships, Shopping/Commerce, Technology, Real Estate"
Bangladeshi cuisine,No-Plate-113,11,10,positive,0.0989996693121693,bangladesh,2025-10-09 14:52:16,"Education, Career/Jobs, Relationships, Health/Medical, Travel/Tourism, Shopping/Commerce, Food/Restaurants, Technology, Real Estate"
Seeking tour guidance,Certain-Chemical470,6,3,positive,0.08298319327731093,bangladesh,2025-10-08 05:22:02,"Career/Jobs, Relationships, Travel/Tourism, Technology, Real Estate"
“Have 5 mins? Help a fellow student finish his thesis on AI in education 😅”,Cautious-Ad8495,4,0,positive,0.08285714285714287,bangladesh,2025-10-08 04:56:19,"Education, Career/Jobs, Travel/Tourism, Food/Restaurants, Technology, Real Estate, Infrastructure"
Safe areas to rent for a few days in Dhaka,HappyBlackbirdLOL,2,1,positive,0.15000000000000002,bangladesh,2025-10-07 21:26:58,"Technology, Real Estate, Infrastructure"
Horrible experience at Dhaka to Dubai flight with emirates,Former-Type1623,63,35,negative,-0.5701388888888889,bangladesh,2025-10-07 17:09:50,"Travel/Tourism, Technology, Real Estate, Infrastructure"
How does the stock market work in Bangladesh? (Beginner here),EngineWinter9286,4,0,positive,0.1464646464646465,bangladesh,2025-10-07 02:28:20,"Career/Jobs, Shopping/Commerce, Technology, Real Estate"
Booze: DHK or COX,YourFavNemesis,2,1,neutral,0.05,bangladesh,2025-10-06 16:55:22,"Shopping/Commerce, Real Estate"
"I'm looking for the absolute best ISP for online gaming in Shewrapara, Mirpur Dhaka. Don't suggest Dot , absolute Garbage.",GunsAndRozer,2,0,positive,0.3052083333333333,bangladesh,2025-10-06 13:29:39,"Sports, Technology, Real Estate"
Lovely people with tats! Show off!,Sea_Conversation123,4,27,positive,0.565625,bangladesh,2025-10-06 08:55:08,"Relationships, Technology, Real Estate"
I (26M) was invited to Bangladesh by someone I met while traveling,Fantastic_Dust_5926,44,21,positive,0.11171536796536796,bangladesh,2025-10-06 07:18:15,"Relationships, Travel/Tourism, Sports, Technology, Real Estate"
I think I finally understand why Indians get so much hate and why many Bangladeshis dislike them,forgotten-daoist,313,139,neutral,-0.06362179487179488,bangladesh,2025-10-05 23:09:24,"Technology, Real Estate"
Looking for a Bengali &amp; Turkish-speaking local guide in Dhaka 🇧🇩🇹🇷,Erenymk1017,4,2,positive,0.06666666666666667,bangladesh,2025-10-05 21:56:34,"Travel/Tourism, Shopping/Commerce, Real Estate"
Looking for info about British Council Bangladesh IELTS courses and teacher training,imtiaz_12,2,3,neutral,0.03725490196078431,bangladesh,2025-10-05 19:41:32,"Education, Career/Jobs, Shopping/Commerce, Technology, Real Estate, Infrastructure"
Can I take my vape,NefariousnessThat317,0,13,positive,0.09444444444444444,bangladesh,2025-10-04 13:23:06,"Career/Jobs, Travel/Tourism, Technology, Real Estate"
Safe places for Bangladeshi girl expats to live in Dhaka for a month?,motiontosleep,6,14,positive,0.23409090909090907,bangladesh,2025-10-03 18:08:57,"Travel/Tourism, Real Estate"
Is it high time we should detach ourselves from this cursed country?,Due_Butterfly_2114,24,12,positive,0.16416666666666668,bangladesh,2025-10-03 13:29:44,"Career/Jobs, Technology, Real Estate, Infrastructure"
Any Duolingo users here in Dhaka?,Far-Following3742,7,11,positive,0.0625,bangladesh,2025-10-02 01:17:53,"Relationships, Real Estate"
Can you suggest me the best ISP (Internet Service Provider) in Dhaka,Mindless_Rest_9284,2,2,neutral,0.5,bangladesh,2025-10-01 16:10:59,"Technology, Real Estate"
HOW TO GET INDIAN MEDICAL VISA AT PRESENT,joysutradhar_,5,9,neutral,0.022670068027210888,bangladesh,2025-10-01 11:14:41,"Health/Medical, Travel/Tourism, Food/Restaurants, Politics/Government, Technology, Real Estate"
Help Needed: Retailer Not Returning IPS Battery Under Warranty,d33pblu7,2,1,positive,0.08125,bangladesh,2025-09-30 22:51:09,"Career/Jobs, Travel/Tourism, Shopping/Commerce, Technology, Real Estate, Infrastructure"
What are some of the best places for Street Photography in Dhaka? (Excluding Sadarghat),new-grizzly,3,2,positive,0.6125,bangladesh,2025-09-29 18:43:07,"Food/Restaurants, Technology, Real Estate"
HOW TO GET INDIAN MEDICAL VISA AT PRESENT [ Im frustrated😫 ],joysutradhar_,6,3,neutral,0.022670068027210888,bangladesh,2025-09-28 11:52:33,"Health/Medical, Travel/Tourism, Food/Restaurants, Politics/Government, Technology, Real Estate"
Suggest a authentic Notary agency,dark_98_rider,5,0,neutral,0.25,bangladesh,2025-09-28 11:10:48,"Politics/Government, Real Estate"
"No friends, loosing sanity",iam_tourist,8,5,negative,-0.09046527777777777,bangladesh,2025-09-27 22:38:54,"Career/Jobs, Relationships, Travel/Tourism, Sports, Technology, Real Estate"
Good knee specialist in Dhaka?,DeltaOmega88,4,5,positive,0.7,bangladesh,2025-09-27 11:05:38,"Health/Medical, Politics/Government, Technology, Real Estate, Infrastructure"
"Indian Visiting Dhaka, suggestions?",integer_tostring,2,12,positive,0.08373015873015872,bangladesh,2025-09-27 05:50:22,"Career/Jobs, Relationships, Travel/Tourism, Food/Restaurants, Real Estate"
Bachelors And Dhaka!,SuspectSuspecious_,3,2,positive,0.11319444444444444,bangladesh,2025-09-27 05:48:42,"Food/Restaurants, Real Estate"
BSF Push In: How an Assamese woman ended up in a slum in Dhaka,yasserius,7,2,neutral,0.0,bangladesh,2025-09-26 13:02:58,Real Estate
One of my relative's liver is failing and doctor has suggested liver transplantation. Any suggestions???,MushfiqurRF,5,3,neutral,0.020803571428571428,bangladesh,2025-09-26 02:11:35,"Health/Medical, Travel/Tourism, Technology, Real Estate"
Travel during elections,EstablishmentBrief90,5,3,positive,0.09375,bangladesh,2025-09-24 22:29:20,"Travel/Tourism, Politics/Government, Real Estate"
How to stay safe in Dhaka while doing UG,Worth-Gene,23,17,neutral,0.25606060606060604,bangladesh,2025-09-24 16:31:11,"Education, Travel/Tourism, Real Estate"
Where to buy ladies western clothing in Dhaka? Wide pants and shirts.,ElNinoMaravilla,7,14,positive,0.20833333333333331,bangladesh,2025-09-23 20:22:47,"Shopping/Commerce, Real Estate"
Seeking advice to get rid of excessive sweating,ais_21,8,14,neutral,-0.10064102564102564,bangladesh,2025-09-23 11:53:52,"Relationships, Health/Medical, Food/Restaurants, Technology, Real Estate"
Need suggestions for trusted shipping agents from China to Bangladesh,Drawing-Live,8,10,positive,0.08750000000000002,bangladesh,2025-09-22 16:40:41,"Shopping/Commerce, Technology, Real Estate"
Scene of Dhaka in 1958.,TasinMAHDI,9,4,neutral,0.0,bangladesh,2025-09-22 14:36:33,Real Estate
Travel video ideas?,clarkeanator,2,3,positive,0.07651515151515152,bangladesh,2025-09-22 03:34:27,"Travel/Tourism, Technology, Real Estate"
Where to buy airguns in Dhaka?,Initial-Read4305,3,0,neutral,0.0,bangladesh,2025-09-21 23:58:39,"Shopping/Commerce, Technology, Real Estate"
"Dear Bangladeshi brothers, please take care not to harm us",SquarePromise2707,67,36,positive,0.06465617715617716,bangladesh,2025-09-21 16:28:52,"Education, Career/Jobs, Technology, Real Estate, Infrastructure"
"How is the situation in Dhaka right now for moderate, agnostic/atheist women? Coming from a Bangladeshi immigrant woman who left in 2012 and hasn’t been back for an extended period of time since",nymeria_the_direwolf,25,17,neutral,0.054464285714285715,bangladesh,2025-09-21 08:01:11,"Technology, Real Estate"
How do you manage your budget in Dhaka with Family and mid level pay?,UnlikelySecret2629,9,2,neutral,0.0,bangladesh,2025-09-20 15:01:45,"Career/Jobs, Real Estate"
Is my college worth it?,cocodew77,2,3,positive,0.28035714285714286,bangladesh,2025-09-20 12:18:11,"Education, Politics/Government, Technology, Real Estate"
IELTS exam center,Ok_Masterpiece_2336,2,2,neutral,-0.010000000000000009,bangladesh,2025-09-20 00:09:54,"Education, Real Estate"
Where I can find hot wheels in dhaka?,carefree_victory,3,0,positive,0.2875,bangladesh,2025-09-19 00:18:16,"Shopping/Commerce, Real Estate"
Kitten Rescue Urgent!!!!,mahin1374,6,2,positive,0.0834710743801653,bangladesh,2025-09-18 12:12:03,"Food/Restaurants, Real Estate, Infrastructure"
E bike questions,Own-Cranberry-324,3,4,positive,0.06959728867623605,bangladesh,2025-09-17 23:06:45,"Travel/Tourism, Shopping/Commerce, Technology, Real Estate"
Name Correction Affidavit Process for SSC and HSC Certificates - Need Some Guidance,Select-Day-873,4,0,neutral,0.0,bangladesh,2025-09-17 18:20:16,"Education, Career/Jobs, Politics/Government, Technology, Real Estate"
Dhaka Birdwatching ঢাকায় বার্ডওয়াচিং,Macula-Densa,8,3,positive,0.0875,bangladesh,2025-09-17 06:28:36,"Travel/Tourism, Technology, Real Estate"
On arrival visa @Dhaka Airport,bangalimahbub,2,4,neutral,0.05,bangladesh,2025-09-17 02:32:52,"Travel/Tourism, Technology, Real Estate"
New at Narayanganj City &amp; Help me Survive,No_Firefighter_4964,2,10,positive,0.15166546416546417,bangladesh,2025-09-15 14:13:20,"Career/Jobs, Relationships, Food/Restaurants, Real Estate"
Need help finding Platform/Elevator shoes,rejuk70kg,3,2,neutral,-0.049999999999999996,bangladesh,2025-09-14 11:05:09,"Shopping/Commerce, Real Estate"
About freetime,Sungodnika04,12,23,positive,0.13749999999999998,bangladesh,2025-09-14 00:24:20,"Education, Technology, Real Estate, Infrastructure"
Gift Suggestion,Midnight-Syntax_007,4,5,positive,0.21750000000000003,bangladesh,2025-09-13 21:02:44,"Relationships, Shopping/Commerce, Real Estate"
Gift Suggestion,Midnight-Syntax_007,0,1,positive,0.21750000000000003,bangladesh,2025-09-13 01:29:48,"Relationships, Shopping/Commerce, Real Estate"
Kinda proud of this pic I took a couple of days ago,ComfyNeo,81,7,negative,0.2388888888888889,bangladesh,2025-09-12 20:30:31,"Relationships, Technology, Real Estate, Infrastructure"
"Bangla gamers, any advice for a ps5 player?",ComfyNeo,3,5,positive,0.05833333333333333,bangladesh,2025-09-12 19:47:24,"Sports, Technology, Real Estate"
"Affordable, quiet and green: Electric shuttle buses set a model for Dhaka’s residential areas",Alone-Attention-2139,9,2,neutral,-0.05,bangladesh,2025-09-12 19:17:18,"Real Estate, Infrastructure"
DUCSU 2025 - Analysis Of Shibir's Landslide Victory And Aftermath,fogrampercot,12,13,positive,0.06007982249010952,bangladesh,2025-09-12 03:40:24,"Education, Career/Jobs, Relationships, Health/Medical, Shopping/Commerce, Food/Restaurants, Politics/Government, Sports, Technology, Real Estate, Infrastructure"
Best place to get highest quality BD cricket jerseys?,DeltaOmega88,4,4,positive,0.5899891774891775,bangladesh,2025-09-11 21:20:28,"Sports, Technology, Real Estate"
Khuni ekhono tar laash ke bhalobashe,KopaShamsur,3,10,negative,-0.1875,bangladesh,2025-09-11 20:25:07,"Education, Politics/Government, Real Estate"
Dhaka Foreign customs held my product,Fun-Middle-1660,2,1,neutral,-0.0625,bangladesh,2025-09-11 08:35:48,"Shopping/Commerce, Real Estate"
If you seek fund for your school/college/university education you may knock me,RunAffectionate1997,9,3,positive,0.09333333333333332,bangladesh,2025-09-11 02:36:50,"Education, Career/Jobs, Shopping/Commerce, Technology, Real Estate, Infrastructure"
Can I study BSc in Computer Science in Australia with a 4-year Diploma in Engineering (Computer Science &amp; Technology)?,ArthurXP002,5,2,neutral,0.025684261974584552,bangladesh,2025-09-11 02:13:35,"Education, Food/Restaurants, Politics/Government, Technology, Real Estate"
Why Shibir-backed candidates won the Ducsu polls,Alone-Attention-2139,8,1,neutral,-0.013333333333333334,bangladesh,2025-09-10 23:04:53,"Education, Career/Jobs, Politics/Government, Technology, Real Estate"
"""baap ka beta, sipahi ka ghora""",KopaShamsur,47,6,positive,0.11904761904761905,bangladesh,2025-09-10 19:42:06,"Education, Politics/Government, Real Estate"
Dhaka Elevated Expressway Friday Afternoon Drive,Strict-Relief515,2,1,positive,0.13333333333333333,bangladesh,2025-09-10 18:49:09,Real Estate
Best psychologist in Dhaka under budget,Puzzleheaded-Hat6548,2,0,neutral,0.5,bangladesh,2025-09-10 15:37:08,Real Estate
Seeking,Budget-Row9313,2,2,negative,-0.055519480519480524,bangladesh,2025-09-10 14:32:14,"Education, Relationships, Real Estate"
suggest gray/moody aesthetic restaurant in dhaka,No_idea_duh,3,0,positive,0.23333333333333334,bangladesh,2025-09-09 19:03:54,"Food/Restaurants, Real Estate"
Attempt BCS or Try to move abroad ?,weirdcomponent,10,12,neutral,0.024839743589743588,bangladesh,2025-09-09 12:58:37,"Education, Career/Jobs, Technology, Real Estate, Infrastructure"
How do you consistently help yourself to be good all alone?,dhonbolsen,9,5,neutral,0.2439112103174603,bangladesh,2025-09-08 20:49:06,"Career/Jobs, Technology, Real Estate, Infrastructure"
Dhaka na Kolkata,RazzmatazzStrict,2,0,neutral,0.0,bangladesh,2025-09-08 19:25:17,Real Estate
Why do our national subreddits have such low member counts?,the-machine-m4n,53,85,positive,0.08333333333333333,bangladesh,2025-09-08 19:21:39,"Technology, Real Estate"
What if Sam Hargrave's Extraction had a Bangladeshi cast,Puzzled-Horse279,2,0,neutral,0.049326880284824196,bangladesh,2025-09-08 18:40:12,"Career/Jobs, Relationships, Shopping/Commerce, Food/Restaurants, Politics/Government, Sports, Technology, Real Estate"
Advice on purchasing domestic air ticket?,theuptownpunk,2,3,positive,0.16499999999999998,bangladesh,2025-09-08 14:42:17,"Travel/Tourism, Shopping/Commerce, Technology, Real Estate"
Backpacking Bangladesh,BriefVeterinarian106,6,6,positive,0.14812091503267974,bangladesh,2025-09-08 13:56:13,"Relationships, Travel/Tourism, Real Estate"
ডাকসু এবং অন্যান্য নির্বাচনে ছাত্র শিবিরকে ভোট দিবেন যে কারণে,fogrampercot,83,41,neutral,0.0,bangladesh,2025-09-07 20:15:02,"Education, Politics/Government, Real Estate"
"Bangladesh, India to hold talks in Delhi on Ganges water-sharing treaty on Tuesday",Alone-Attention-2139,5,0,negative,-0.09583333333333333,bangladesh,2025-09-07 19:30:07,"Food/Restaurants, Technology, Real Estate"
Therapists in Dhaka that offer services in English,bagpurchaser,3,1,neutral,0.0,bangladesh,2025-09-07 16:06:10,Real Estate
Need advice: finding it hard to deal with my mindset about women,OrneryExpression6918,11,65,neutral,-0.11141581632653062,bangladesh,2025-09-07 11:48:28,"Education, Relationships, Health/Medical, Food/Restaurants, Technology, Real Estate"
Dhaka Awaits Opening Of Century-Old Diamond Vault | Asia One News,maifee,2,0,neutral,0.0,bangladesh,2025-09-06 11:51:52,"Technology, Real Estate"
seeking advice about taking a decision in life,ArachnidMotor1538,4,5,positive,0.11125,bangladesh,2025-09-06 02:38:21,"Education, Career/Jobs, Food/Restaurants, Technology, Real Estate"
Decent Bars in Dhaka,mid20sman,13,7,positive,0.23958333333333331,bangladesh,2025-09-05 14:24:33,"Career/Jobs, Food/Restaurants, Real Estate"
Why is Dhaka so trafficy?,Viv3lafranc3,2,1,neutral,0.0,bangladesh,2025-09-05 09:06:21,"Health/Medical, Politics/Government, Real Estate, Infrastructure"
Need advice on English spoken proficiency,Saitama2042,3,3,neutral,0.027604166666666666,bangladesh,2025-09-05 00:15:35,"Education, Career/Jobs, Sports, Technology, Real Estate, Infrastructure"
Advice please,aabrarwho,3,0,neutral,0.0,bangladesh,2025-09-04 13:13:04,"Education, Politics/Government, Real Estate, Infrastructure"
Which steak house is the best in Dhaka...,Cryptographer47051,5,2,positive,0.75,bangladesh,2025-09-03 20:00:53,Real Estate
What if Dhaka was abandoned and nature took it back? 🌿 A mysterious AI short film I made,Competitive-Essay798,0,16,positive,0.07883522727272727,bangladesh,2025-09-03 18:18:57,"Relationships, Food/Restaurants, Politics/Government, Technology, Real Estate, Infrastructure"
Need to rush the process of name changing in SSC &amp; HSC certificates !!!,Key_Astronaut_7893,2,1,positive,0.05568181818181817,bangladesh,2025-09-03 00:44:10,"Education, Relationships, Food/Restaurants, Politics/Government, Technology, Real Estate, Infrastructure"
How to check if my unofficial phone is new or not?,PilotHere,3,2,neutral,0.06818181818181818,bangladesh,2025-09-02 17:19:37,"Shopping/Commerce, Technology, Real Estate"
Are there any restaurants in Puran Dhaka that serve good bengali pork dishes?,DoodhBhaat,2,9,neutral,0.35,bangladesh,2025-09-01 20:54:59,"Food/Restaurants, Real Estate"
Best perfumes to wear in Dhaka,Rapid47,2,1,neutral,0.5,bangladesh,2025-08-31 16:13:30,Real Estate
Upgrading my iPhone 12 Pro – advice on shops &amp; price in Dhaka,Intelligent-Delay-95,2,0,positive,0.08750000000000001,bangladesh,2025-08-31 11:37:33,"Health/Medical, Shopping/Commerce, Technology, Real Estate"
"Unseen photographs of people struggling for liberation in 1971, which resulted in the creation of a sovereign Bangladesh.",TasinMAHDI,24,5,neutral,0.005882352941176466,bangladesh,2025-08-29 16:56:51,"Education, Health/Medical, Shopping/Commerce, Food/Restaurants, Sports, Technology, Real Estate, Infrastructure"
Safe to visit Bangladesh as a Pakistani?,Fondant_Decent,32,40,positive,0.375,bangladesh,2025-08-29 16:02:21,"Relationships, Travel/Tourism, Real Estate"
Is it possible to go to Dhaka by boat from Chittagong?,siam19,2,2,neutral,0.025,bangladesh,2025-08-29 09:14:33,Real Estate
"Looking for sources of high quality chains, hoops &amp; metals for jewellery making",nanjeba_borno,2,0,positive,0.21574074074074073,bangladesh,2025-08-28 13:51:24,"Shopping/Commerce, Technology, Real Estate"
Want to enjoy Dhaka,Mysterious_Natural55,4,4,positive,0.33745265151515147,bangladesh,2025-08-28 06:03:38,"Relationships, Travel/Tourism, Food/Restaurants, Technology, Real Estate, Infrastructure"
"I'm not sure if it is only me, but the sky-summit level of MRT line 6 sort of made Dhaka look more modern.",Comfortable-Table-57,1,0,positive,0.18225,bangladesh,2025-08-28 03:33:46,"Career/Jobs, Technology, Real Estate"
"Today's editorials in Pakistan's Dawn (""Ties That Bind"") and Tribune (""Reset with Dhaka"") on the FM’s BD visit expose their mindset. Both dismiss 1971 as a mere ""tragedy,"" avoiding true apology for genocide. Not shockingly, their tone mirrors their own collaborators’ stance!",TasinMAHDI,106,32,neutral,0.1375,bangladesh,2025-08-27 09:07:55,"Travel/Tourism, Real Estate"
"Where to shop in Dhaka for skirts, tops &amp; three-pieces?",Winter-Fig-4104,2,1,positive,0.23750000000000002,bangladesh,2025-08-27 00:44:50,"Shopping/Commerce, Real Estate"
"Dhaka &amp; Chittagong Airports are major hub for drugs,Gold trafficking in south east Asia! We are seeing tip of the iceberg in regards of seizing Drugs &amp; Gold!",Asleep-Jellyfish007,6,2,neutral,0.048828125,bangladesh,2025-08-26 21:14:34,"Travel/Tourism, Technology, Real Estate, Infrastructure"
"Dhaka, Bangladesh",VapeyMoron,53,9,neutral,0.0,bangladesh,2025-08-25 23:30:45,Real Estate
BRAC University’s Architecture requirements feel kinda unusual,CapsLockChaos,1,4,negative,0.04107142857142858,dhaka,2025-11-19 22:28:22,"Education, Technology, Real Estate"
Explain this Bangladeshi Economy and Market related question to a less educated person.,Forgotten_Seriously,1,0,neutral,-0.033796296296296297,dhaka,2025-11-19 22:22:43,"Shopping/Commerce, Technology"
Where can I download my SSC &amp; HSC marksheets online?,Acceptable-One-7793,1,1,neutral,0.0,dhaka,2025-11-19 21:46:36,"Education, Technology"
Best Soup in town?,Almostfamous_02,3,3,positive,0.7294642857142857,dhaka,2025-11-19 21:14:31,"Food/Restaurants, Real Estate"
Let's talk about new year resolutions,theboyisdivine,1,9,positive,0.17909090909090908,dhaka,2025-11-19 21:06:28,Other
"Favourite Restaurants in Dhanmondi, Panthapath, Elephant Road.",999baseballs,2,5,neutral,0.0,dhaka,2025-11-19 20:41:37,"Food/Restaurants, Technology, Infrastructure"
Book recommendation on music theory,Rough_Insurance6722,4,1,neutral,0.0,dhaka,2025-11-19 20:32:49,Other
Need Someone,cxcuser,0,14,neutral,0.0,dhaka,2025-11-19 20:16:26,"Health/Medical, Technology"
Need someone,Unusual-Bit-6296,8,39,neutral,0.0,dhaka,2025-11-19 19:32:54,Other
I Just hate how most Bangladeshi people just cannot think rationally,Crowned_XD,21,6,neutral,-0.07715579710144928,dhaka,2025-11-19 19:18:07,"Education, Career/Jobs, Shopping/Commerce, Food/Restaurants, Technology, Real Estate"
Where in Dhaka can I get these Chunky Penny Loafers and Men's long wallet in best price?,Mikoyane,3,5,neutral,0.2375,dhaka,2025-11-19 19:09:52,"Shopping/Commerce, Real Estate"
Fb page posting pics of women without consent,jasontoddloverr,23,11,negative,-0.36666666666666664,dhaka,2025-11-19 18:36:52,Other
Best dermatologist in DHAKA for Fungal infection (Tinia Cruris),OpenBelt8195,3,2,neutral,0.55,dhaka,2025-11-19 18:28:22,"Health/Medical, Food/Restaurants, Real Estate"
Best online physics course for HSC students in Bangladesh?,No_Arrival_9355,2,4,positive,0.706060606060606,dhaka,2025-11-19 18:14:45,"Education, Technology"
TRAVEL CLUBS,Mundane-Apartment-10,4,3,neutral,0.04296875,dhaka,2025-11-19 17:46:38,"Relationships, Travel/Tourism, Food/Restaurants"
Have anyone face this issue with uber?,readit_bd,3,2,neutral,0.012500000000000002,dhaka,2025-11-19 17:38:29,"Health/Medical, Travel/Tourism, Sports, Technology, Real Estate"
Have you used the ALLJOBS service by Teletalk? This is such a buggy website / app. I can't login to my account for the past 1 hour,the-machine-m4n,1,0,neutral,-0.0625,dhaka,2025-11-19 17:37:08,"Career/Jobs, Technology"
Where to sell perfume?,ElectronicValue8056,3,8,positive,0.09285714285714286,dhaka,2025-11-19 17:29:07,"Travel/Tourism, Shopping/Commerce"
Need suggestions,diviaterun,2,5,neutral,-0.022222222222222216,dhaka,2025-11-19 16:50:52,Technology
Please Help Me Regarding Sunglasses!!,SpinachDesigner3346,0,3,neutral,0.03409090909090909,dhaka,2025-11-19 16:37:38,"Shopping/Commerce, Food/Restaurants, Real Estate"
Any BUTEXIAN ?,Funny-Ad-2513,0,2,neutral,0.0,dhaka,2025-11-19 16:14:49,Other
Let's talk and do something,Top-Slide-4095,6,34,neutral,0.0,dhaka,2025-11-19 16:02:01,Other
Advice,DriveHeavy5045,7,9,neutral,-0.041666666666666664,dhaka,2025-11-19 15:55:58,Relationships
Syllabus Completion Problem,rion__2036,3,4,positive,0.11076388888888893,dhaka,2025-11-19 15:55:44,"Education, Food/Restaurants, Infrastructure"
Need Relationship advice,TacoChair07,11,16,positive,0.16805555555555557,dhaka,2025-11-19 15:44:32,"Relationships, Food/Restaurants, Technology"
Does this look like a Hindu goddess?,Infinite-Sector-8694,151,200,positive,0.05714285714285715,dhaka,2025-11-19 15:22:51,Technology
Need information about ordering something,Astral_Modulator709,3,4,neutral,0.0,dhaka,2025-11-19 15:18:35,"Shopping/Commerce, Technology"
gift for cousins from australia (and restaurant recs),sleepislife25,6,26,positive,0.08214285714285714,dhaka,2025-11-19 15:18:26,"Travel/Tourism, Food/Restaurants, Technology"
Entrepreneurship &amp; Sales  Book Suggestions !,anderslio9,2,3,positive,0.11499999999999999,dhaka,2025-11-19 14:53:02,"Relationships, Shopping/Commerce"
এই টাইপ প্যান্ট কোথায় পাবো?,Puzzleheaded-Hat6548,13,15,neutral,0.0,dhaka,2025-11-19 14:32:12,Other
Need help from BBA students,Outside_Raspberry587,2,1,neutral,0.0,dhaka,2025-11-19 13:48:30,Education
Taking A levels as a private candidate,Upper-Berry213,7,13,positive,0.125,dhaka,2025-11-19 13:30:13,"Education, Career/Jobs, Relationships, Health/Medical, Politics/Government, Technology"
anxious about future,frustratedcigs,5,10,neutral,-0.0625,dhaka,2025-11-19 12:49:23,Other
need study partner,Diligent_Hunt7245,3,0,neutral,0.0,dhaka,2025-11-19 12:41:47,Education
🎯 Join Our Freelance Transcription Team at Quantigo AI!,Academic_Flamingo250,0,0,positive,0.10739583333333336,dhaka,2025-11-19 12:30:47,"Education, Career/Jobs, Food/Restaurants, Sports, Technology, Real Estate"
National bank,No_Tailor2427,3,1,negative,-0.25,dhaka,2025-11-19 11:38:06,Technology
Male waxing,BreakfastAutomatic52,12,25,positive,0.0875,dhaka,2025-11-19 11:33:44,Real Estate
any pharmacy owners here?,Plastic_Comedian_615,1,9,neutral,0.0,dhaka,2025-11-19 11:06:36,Other
Recommend a watch for men,Ok_Temperature1414,7,23,positive,0.125,dhaka,2025-11-19 10:16:02,Other
Dhanmondi Lake this morning — who else loves morning walks here,Embarrassed-Law6338,16,3,neutral,0.0,dhaka,2025-11-19 10:00:33,Relationships
Denim jeans,CalligrapherWest4585,3,8,neutral,0.03504709576138147,dhaka,2025-11-19 09:20:42,Shopping/Commerce
Online platforms where I can buy used smartphones,superkafooo,4,4,positive,0.16111111111111112,dhaka,2025-11-19 08:57:06,"Shopping/Commerce, Technology"
Radiohead hoodie,Individual-Ad-9678,3,1,neutral,0.0,dhaka,2025-11-19 07:53:30,"Shopping/Commerce, Real Estate"
A level CAIE,Hot-Effective5484,3,2,neutral,0.018750000000000003,dhaka,2025-11-19 07:29:04,"Education, Career/Jobs, Shopping/Commerce, Technology, Infrastructure"
Is mbbs from Bangladesh worth it??,timespaceweb,18,34,neutral,0.19642857142857142,dhaka,2025-11-19 07:24:51,"Education, Health/Medical"
BNP er good side ashole ki?,hackerbong,4,43,neutral,0.35,dhaka,2025-11-19 06:55:58,Politics/Government
Attempting to Resell My Ticket,meetnyself,1,0,neutral,0.036111111111111115,dhaka,2025-11-19 05:20:07,"Travel/Tourism, Shopping/Commerce, Real Estate"
