title,author,upvotes,comments,date,url
How does the stock market work in Bangladesh? (Beginner here),EngineWinter9286,4,0,2025-10-07 02:28:20,https://www.reddit.com/r/bangladesh/comments/1nzue31/how_does_the_stock_market_work_in_bangladesh/
“Have 5 mins? Help a fellow student finish his thesis on AI in education 😅”,Cautious-Ad8495,4,0,2025-10-08 04:56:19,https://www.reddit.com/r/bangladesh/comments/1o0u1ki/have_5_mins_help_a_fellow_student_finish_his/
Is the internet in Dhaka fast and stable for video calls?,78523985210,4,5,2025-10-18 13:46:52,https://www.reddit.com/r/bangladesh/comments/1o9pr6h/is_the_internet_in_dhaka_fast_and_stable_for/
Please suggest a good private hospital in Dhaka for treating Heart related illness,da-chooozen-one,4,2,2025-10-14 14:31:56,https://www.reddit.com/r/bangladesh/comments/1o69xr3/please_suggest_a_good_private_hospital_in_dhaka/
Seeking Suggestions for places to Settle-Down,eddieJK1630,4,4,2025-10-22 12:48:25,https://www.reddit.com/r/bangladesh/comments/1od13o9/seeking_suggestions_for_places_to_settledown/
Try plastickothay,Any-Interaction-3192,4,1,2025-10-23 02:49:18,https://www.reddit.com/r/bangladesh/comments/1odk3yw/try_plastickothay/
Need Suggestions for Men’s Salons in Dhaka,NoPerception9519,4,1,2025-10-24 16:07:01,https://www.reddit.com/r/bangladesh/comments/1oetrlw/need_suggestions_for_mens_salons_in_dhaka/
Dhaka grants full tax break on Rooppur debt repayment to Russia’s Rosatom subsidiary,Necessary-Hunt6104,4,2,2025-10-19 15:51:10,https://i.redd.it/r2f2riw0j1wf1.png
Need advice on future plans for studying Physics.,the_wave_equation,4,0,2025-11-02 21:08:34,https://www.reddit.com/r/bangladesh/comments/1omjooy/need_advice_on_future_plans_for_studying_physics/
Easy entry to Europe as a masters student.,canttellumyname,4,1,2025-11-06 00:32:58,https://www.reddit.com/r/bangladesh/comments/1opb16r/easy_entry_to_europe_as_a_masters_student/
Perfume Decants are a scam,azim-_-,4,7,2025-11-06 00:18:20,https://www.reddit.com/r/bangladesh/comments/1opam78/perfume_decants_are_a_scam/
Want to enjoy Dhaka,Mysterious_Natural55,4,4,2025-08-28 06:03:38,https://www.reddit.com/r/bangladesh/comments/1n1xfau/want_to_enjoy_dhaka/
Best place to get highest quality BD cricket jerseys?,DeltaOmega88,4,4,2025-09-11 21:20:28,https://www.reddit.com/r/bangladesh/comments/1nebmks/best_place_to_get_highest_quality_bd_cricket/
Name Correction Affidavit Process for SSC and HSC Certificates - Need Some Guidance,Select-Day-873,4,0,2025-09-17 18:20:16,https://www.reddit.com/r/bangladesh/comments/1njbl2b/name_correction_affidavit_process_for_ssc_and_hsc/
Gift Suggestion,Midnight-Syntax_007,4,5,2025-09-13 21:02:44,https://www.reddit.com/r/bangladesh/comments/1nfzq23/gift_suggestion/
Good knee specialist in Dhaka?,DeltaOmega88,4,5,2025-09-27 11:05:38,https://www.reddit.com/r/bangladesh/comments/1nrmpkq/good_knee_specialist_in_dhaka/
Lovely people with tats! Show off!,Sea_Conversation123,4,27,2025-10-06 08:55:08,https://www.reddit.com/r/bangladesh/comments/1nz7tqd/lovely_people_with_tats_show_off/
"Energy adviser blames section of politicians, businessmen for crisis in gas sector",Shot-Addendum-809,4,2,2025-10-11 16:30:35,https://www.thedailystar.net/news/bangladesh/news/energy-adviser-blames-section-politicians-businessmen-crisis-gas-sector-4007121
Looking for a Bengali &amp; Turkish-speaking local guide in Dhaka 🇧🇩🇹🇷,Erenymk1017,4,2,2025-10-05 21:56:34,https://www.reddit.com/r/bangladesh/comments/1nyrxsi/looking_for_a_bengali_turkishspeaking_local_guide/
Where I can find hot wheels in dhaka?,carefree_victory,3,0,2025-09-19 00:18:16,https://www.reddit.com/r/bangladesh/comments/1nkfz0x/where_i_can_find_hot_wheels_in_dhaka/
How to check if my unofficial phone is new or not?,PilotHere,3,2,2025-09-02 17:19:37,https://www.reddit.com/r/bangladesh/comments/1n6grjt/how_to_check_if_my_unofficial_phone_is_new_or_not/
Therapists in Dhaka that offer services in English,bagpurchaser,3,1,2025-09-07 16:06:10,https://www.reddit.com/r/bangladesh/comments/1napfnc/therapists_in_dhaka_that_offer_services_in_english/
E bike questions,Own-Cranberry-324,3,4,2025-09-17 23:06:45,https://www.reddit.com/r/bangladesh/comments/1njiy1b/e_bike_questions/
Need advice on English spoken proficiency,Saitama2042,3,3,2025-09-05 00:15:35,https://www.reddit.com/r/bangladesh/comments/1n8hrua/need_advice_on_english_spoken_proficiency/
Looking for information about old/public libraries in Dhaka for a Wikimedia GLAM project,Yahya_b,3,0,2025-11-06 02:41:55,https://www.reddit.com/r/bangladesh/comments/1opek7x/looking_for_information_about_oldpublic_libraries/
Anyone studying criminology at university of dhaka?,faceittiger1142,3,0,2025-11-07 02:39:13,https://www.reddit.com/r/bangladesh/comments/1oqa8mf/anyone_studying_criminology_at_university_of_dhaka/
Easy entry to Europe as a masters student.,canttellumyname,3,2,2025-11-06 00:32:53,https://www.reddit.com/r/bangladesh/comments/1opb147/easy_entry_to_europe_as_a_masters_student/
"Anyone worked at Truck Lagbe (Dhaka Head Office, Mohakhali)? Need honest feedback before my interview",Equal_Perspective230,3,2,2025-10-18 20:43:55,https://www.reddit.com/r/bangladesh/comments/1o9xo5r/anyone_worked_at_truck_lagbe_dhaka_head_office/
Best place to live in Bangladesh?,Scared_of_Jobs,3,7,2025-11-17 15:30:51,https://www.reddit.com/r/bangladesh/comments/1ozbxxm/best_place_to_live_in_bangladesh/
Bd domestic flights,zsk471,3,1,2025-11-18 17:06:01,https://www.reddit.com/r/bangladesh/comments/1p09464/bd_domestic_flights/
Pari Bibi's mausoleum at Lalbagh fort. Dhaka (1967) #viral #OldDhaka #Ol...,Sea-Test1273,3,1,2025-11-09 08:42:45,https://youtube.com/watch?v=9gclvfKI7BA&amp;si=IOY6Qeijd40Hxto2
Trusted Gaming Laptop store in Dhaka,Expert-Access7844,3,5,2025-11-10 18:43:46,https://www.reddit.com/r/bangladesh/comments/1otcr6b/trusted_gaming_laptop_store_in_dhaka/
Need recommendation of some trustworthy construction/ development companies in Dhaka?,jobie1267,3,1,2025-10-26 18:05:15,https://www.reddit.com/r/bangladesh/comments/1ogiy0u/need_recommendation_of_some_trustworthy/
Anyone here who can help me visit a church in Dhaka?,Worldly_Yellow_6115,3,10,2025-10-25 00:27:48,https://www.reddit.com/r/bangladesh/comments/1of5gwj/anyone_here_who_can_help_me_visit_a_church_in/
Electronics recycling,Maleficent_Silver560,3,0,2025-10-20 19:26:55,https://www.reddit.com/r/bangladesh/comments/1obiyi9/electronics_recycling/
"wanna go to sylhet for tour with friends from dhaka, need suggestions and advices",Top-Pen-9698,3,3,2025-11-05 16:47:18,https://www.reddit.com/r/bangladesh/comments/1oozmtc/wanna_go_to_sylhet_for_tour_with_friends_from/
Khuni ekhono tar laash ke bhalobashe,KopaShamsur,3,10,2025-09-11 20:25:07,https://i.redd.it/xavb5mm1pjof1.png
"Bangla gamers, any advice for a ps5 player?",ComfyNeo,3,5,2025-09-12 19:47:24,https://www.reddit.com/r/bangladesh/comments/1nf3prl/bangla_gamers_any_advice_for_a_ps5_player/
Delivery Service For My Home Bakery,DirectTone1689,3,5,2025-11-04 23:36:50,https://www.reddit.com/r/bangladesh/comments/1oodndz/delivery_service_for_my_home_bakery/
Any advice on getting a new passport quickly considering my restrictions?,Oryuuu,3,0,2025-10-31 22:45:39,https://www.reddit.com/r/bangladesh/comments/1okzoew/any_advice_on_getting_a_new_passport_quickly/
Trusted Smartphone Shop in Dhaka?,Left_Application293,3,2,2025-10-16 21:08:49,https://www.reddit.com/r/bangladesh/comments/1o88pef/trusted_smartphone_shop_in_dhaka/
"Help Me Pick a 43"" TV Under 50K Taka (Dhaka Buyers — Need Your Real Advice!)",drkaly,3,6,2025-10-09 22:57:19,https://www.reddit.com/r/bangladesh/comments/1o2bdbz/help_me_pick_a_43_tv_under_50k_taka_dhaka_buyers/
Where to buy airguns in Dhaka?,Initial-Read4305,3,0,2025-09-21 23:58:39,/r/Dhaka/comments/1nmys6n/where_to_buy_airguns_in_dhaka/
Best place for hair transplant?,Odd-Machine189,3,1,2025-10-15 19:19:33,https://www.reddit.com/r/bangladesh/comments/1o7assq/best_place_for_hair_transplant/
"Between typical private universities in dhaka and public universities in chittagong, which are the best?",tdoteditz_exe,3,3,2025-10-17 17:08:35,https://www.reddit.com/r/bangladesh/comments/1o8ydnb/between_typical_private_universities_in_dhaka_and/
"Got GPA 4.92 (Physics 180, Chemistry 185, Math 151, English A-) — Should I continue Engineering or move to University A Unit?",Fantastic-Permit-383,3,4,2025-10-17 16:18:08,https://www.reddit.com/r/bangladesh/comments/1o8xihy/got_gpa_492_physics_180_chemistry_185_math_151/
BCB DHAKA DIVISION CRICKET LEAGUE TOURNAMENTS,dhonbolsen,3,0,2025-10-16 23:35:23,https://www.reddit.com/r/bangladesh/comments/1o8coph/bcb_dhaka_division_cricket_league_tournaments/
Struggles as an English medium student,Recent_Carry810,3,0,2025-10-18 10:22:53,https://www.reddit.com/r/bangladesh/comments/1o9md9e/struggles_as_an_english_medium_student/
Need help finding Platform/Elevator shoes,rejuk70kg,3,2,2025-09-14 11:05:09,https://www.reddit.com/r/bangladesh/comments/1ngihc3/need_help_finding_platformelevator_shoes/
suggest gray/moody aesthetic restaurant in dhaka,No_idea_duh,3,0,2025-09-09 19:03:54,https://www.reddit.com/r/bangladesh/comments/1ncicqn/suggest_graymoody_aesthetic_restaurant_in_dhaka/
Bachelors And Dhaka!,SuspectSuspecious_,3,2,2025-09-27 05:48:42,https://www.reddit.com/r/bangladesh/comments/1nrgnyy/bachelors_and_dhaka/
What are some of the best places for Street Photography in Dhaka? (Excluding Sadarghat),new-grizzly,3,2,2025-09-29 18:43:07,https://www.reddit.com/r/bangladesh/comments/1ntgzr2/what_are_some_of_the_best_places_for_street/
Advice please,aabrarwho,3,0,2025-09-04 13:13:04,https://www.reddit.com/r/bangladesh/comments/1n83f0w/advice_please/
Where else to sell my smartphones?,Select-Day-873,2,0,2025-11-10 16:34:42,https://www.reddit.com/r/bangladesh/comments/1otafe9/where_else_to_sell_my_smartphones/
Buying a 2nd hand flat in banani Dhaka.,Miserable-Bed3514,2,1,2025-11-14 03:11:50,https://www.reddit.com/r/bangladesh/comments/1owd538/buying_a_2nd_hand_flat_in_banani_dhaka/
VoA for Dhaka Inbound from Different Country,Infinitoid,2,1,2025-11-18 02:23:06,/r/visas/comments/1ozr4ex/voa_for_dhaka_inbound_from_different_country/
Is it possible to go to Dhaka by boat from Chittagong?,siam19,2,2,2025-08-29 09:14:33,https://www.reddit.com/r/bangladesh/comments/1n2wive/is_it_possible_to_go_to_dhaka_by_boat_from/
Seeking,Budget-Row9313,2,2,2025-09-10 14:32:14,https://www.reddit.com/r/bangladesh/comments/1nd8nz9/seeking/
Why is Dhaka so trafficy?,Viv3lafranc3,2,1,2025-09-05 09:06:21,https://www.reddit.com/r/bangladesh/comments/1n8u8a4/why_is_dhaka_so_trafficy/
"Does anyone know where can I apply for learning boxing/ Muay thai near Mirpur,Dhaka?",Baked_Pan798,2,1,2025-10-27 02:26:57,https://www.reddit.com/r/bangladesh/comments/1ogv09g/does_anyone_know_where_can_i_apply_for_learning/
Need participants for a study,notkafka311,2,0,2025-10-28 01:09:51,https://www.reddit.com/r/bangladesh/comments/1ohnh2j/need_participants_for_a_study/
Suggestions needed,FarhanAyan_,2,0,2025-10-29 23:48:26,https://www.reddit.com/r/bangladesh/comments/1ojbdpz/suggestions_needed/
Halloween events in dhaka,No_idea_duh,2,0,2025-10-27 04:55:49,/r/Dhaka/comments/1ogyiqp/halloween_events_in_dhaka/
Want a home rent in dhaka,Upset-Pay3295,2,2,2025-11-06 00:12:30,https://www.reddit.com/r/bangladesh/comments/1opag77/want_a_home_rent_in_dhaka/
Suggestions needed,FarhanAyan_,2,0,2025-10-29 23:38:51,https://www.reddit.com/r/bangladesh/comments/1ojb41k/suggestions_needed/
Visa on arrival questions,CompetitiveCat8220,2,2,2025-11-16 09:12:32,https://www.reddit.com/r/bangladesh/comments/1oyaxcr/visa_on_arrival_questions/
Wake up Bangladeshis,Hot-Point-4090,2,1,2025-11-18 13:39:20,https://www.reddit.com/r/bangladesh/comments/1p05vor/wake_up_bangladeshis/
Looking for info about British Council Bangladesh IELTS courses and teacher training,imtiaz_12,2,3,2025-10-05 19:41:32,https://www.reddit.com/r/bangladesh/comments/1nyoj4b/looking_for_info_about_british_council_bangladesh/
Help Needed: Retailer Not Returning IPS Battery Under Warranty,d33pblu7,2,1,2025-09-30 22:51:09,https://www.reddit.com/r/bangladesh/comments/1nuignz/help_needed_retailer_not_returning_ips_battery/
Booze: DHK or COX,YourFavNemesis,2,1,2025-10-06 16:55:22,https://www.reddit.com/r/bangladesh/comments/1nzft5k/booze_dhk_or_cox/
Anyone ever received mail/letters from overseas thru post office?,lonelykidfrom2006,2,1,2025-10-16 21:01:32,https://www.reddit.com/r/bangladesh/comments/1o88ih6/anyone_ever_received_mailletters_from_overseas/
HSC 2025 Dhaka Board Ranking,Consistent-Rule-3720,2,0,2025-10-17 17:33:00,https://www.reddit.com/r/bangladesh/comments/1o8ytxu/hsc_2025_dhaka_board_ranking/
"Where to shop in Dhaka for skirts, tops &amp; three-pieces?",Winter-Fig-4104,2,1,2025-08-27 00:44:50,https://www.reddit.com/gallery/1n0u7fr
Best perfumes to wear in Dhaka,Rapid47,2,1,2025-08-31 16:13:30,/r/Dhaka/comments/1n4q320/best_perfumes_to_wear_in_dhaka/
Are there any restaurants in Puran Dhaka that serve good bengali pork dishes?,DoodhBhaat,2,9,2025-09-01 20:54:59,https://www.reddit.com/r/bangladesh/comments/1n5qvgq/are_there_any_restaurants_in_puran_dhaka_that/
What if Sam Hargrave's Extraction had a Bangladeshi cast,Puzzled-Horse279,2,0,2025-09-08 18:40:12,https://www.reddit.com/gallery/1nbmn0p
Can you suggest me the best ISP (Internet Service Provider) in Dhaka,Mindless_Rest_9284,2,2,2025-10-01 16:10:59,/r/Dhaka/comments/1nv450h/can_you_suggest_me_the_best_isp_internet_service/
Travel video ideas?,clarkeanator,2,3,2025-09-22 03:34:27,https://www.reddit.com/r/bangladesh/comments/1nn4dmj/travel_video_ideas/
"I'm looking for the absolute best ISP for online gaming in Shewrapara, Mirpur Dhaka. Don't suggest Dot , absolute Garbage.",GunsAndRozer,2,0,2025-10-06 13:29:39,https://www.reddit.com/r/bangladesh/comments/1nzclxm/im_looking_for_the_absolute_best_isp_for_online/
"Indian Visiting Dhaka, suggestions?",integer_tostring,2,12,2025-09-27 05:50:22,https://www.reddit.com/r/bangladesh/comments/1nrgp7p/indian_visiting_dhaka_suggestions/
Safe areas to rent for a few days in Dhaka,HappyBlackbirdLOL,2,1,2025-10-07 21:26:58,https://www.reddit.com/r/bangladesh/comments/1o0hx48/safe_areas_to_rent_for_a_few_days_in_dhaka/
IELTS exam center,Ok_Masterpiece_2336,2,2,2025-09-20 00:09:54,https://www.reddit.com/r/bangladesh/comments/1nlaymx/ielts_exam_center/
Dhaka Elevated Expressway Friday Afternoon Drive,Strict-Relief515,2,1,2025-09-10 18:49:09,https://youtu.be/kWHDa0CbisM?si=r8Qyj8wTYGnjUm9C
Best psychologist in Dhaka under budget,Puzzleheaded-Hat6548,2,0,2025-09-10 15:37:08,/r/Dhaka/comments/1nd9lbs/best_psychologist_in_dhaka_under_budget/
Is my college worth it?,cocodew77,2,3,2025-09-20 12:18:11,https://www.reddit.com/r/bangladesh/comments/1nlqo6w/is_my_college_worth_it/
On arrival visa @Dhaka Airport,bangalimahbub,2,4,2025-09-17 02:32:52,https://www.reddit.com/r/bangladesh/comments/1nisxm2/on_arrival_visa_dhaka_airport/
New at Narayanganj City &amp; Help me Survive,No_Firefighter_4964,2,10,2025-09-15 14:13:20,https://www.reddit.com/r/bangladesh/comments/1nhg1mv/new_at_narayanganj_city_help_me_survive/
Dhaka Foreign customs held my product,Fun-Middle-1660,2,1,2025-09-11 08:35:48,https://www.reddit.com/r/bangladesh/comments/1ndxf9p/dhaka_foreign_customs_held_my_product/
"Looking for sources of high quality chains, hoops &amp; metals for jewellery making",nanjeba_borno,2,0,2025-08-28 13:51:24,https://www.reddit.com/r/bangladesh/comments/1n264es/looking_for_sources_of_high_quality_chains_hoops/
Dhaka Awaits Opening Of Century-Old Diamond Vault | Asia One News,maifee,2,0,2025-09-06 11:51:52,https://youtu.be/pfcsNL7AKa4?si=BfXo_wQMhRLZdMeV
Dhaka na Kolkata,RazzmatazzStrict,2,0,2025-09-08 19:25:17,https://www.facebook.com/share/p/1Diw9p6XA6/
Upgrading my iPhone 12 Pro – advice on shops &amp; price in Dhaka,Intelligent-Delay-95,2,0,2025-08-31 11:37:33,https://www.reddit.com/r/bangladesh/comments/1n4mq68/upgrading_my_iphone_12_pro_advice_on_shops_price/
Advice on purchasing domestic air ticket?,theuptownpunk,2,3,2025-09-08 14:42:17,https://www.reddit.com/r/bangladesh/comments/1nbiei2/advice_on_purchasing_domestic_air_ticket/
Need to rush the process of name changing in SSC &amp; HSC certificates !!!,Key_Astronaut_7893,2,1,2025-09-03 00:44:10,https://www.reddit.com/r/bangladesh/comments/1n6ruzr/need_to_rush_the_process_of_name_changing_in_ssc/
Chittagong University W or L?,Soul_Sniper_26,1,17,2025-11-04 01:07:16,https://www.reddit.com/r/bangladesh/comments/1onksuc/chittagong_university_w_or_l/
What are the best options for inter district travel?,Nayuist,1,5,2025-10-27 20:35:08,https://www.reddit.com/r/bangladesh/comments/1ohg25v/what_are_the_best_options_for_inter_district/
"I'm not sure if it is only me, but the sky-summit level of MRT line 6 sort of made Dhaka look more modern.",Comfortable-Table-57,1,0,2025-08-28 03:33:46,https://www.reddit.com/r/bangladesh/comments/1n1tv72/im_not_sure_if_it_is_only_me_but_the_skysummit/
I wanna study bachelor in abroad help me 🙏🏻,ilovemybmwx5,1,7,2025-10-13 23:35:33,https://www.reddit.com/r/bangladesh/comments/1o5qey6/i_wanna_study_bachelor_in_abroad_help_me/
ভূমধ্যসাগরের নিচে ঘুমিয়ে আছে বাংলাদেশ - The Route of No Return | Voice of Dhaka,Asleep-Jellyfish007,1,0,2025-10-10 18:24:20,https://youtu.be/8bAEafC0TLg?si=rer4-Fy4Ru43IP6O
Shia in puran dhaka,Better_tqas,1,0,2025-10-10 04:56:21,https://www.reddit.com/r/bangladesh/comments/1o2kkc0/shia_in_puran_dhaka/
"🪔 Kali Puja Vibes — Looking for a Travel Partner (Dhaka, Oct 20)",dhumketu69,0,8,2025-10-20 05:51:26,https://www.reddit.com/r/bangladesh/comments/1ob4zeg/kali_puja_vibes_looking_for_a_travel_partner/
Can I take my vape,NefariousnessThat317,0,13,2025-10-04 13:23:06,https://www.reddit.com/r/bangladesh/comments/1nxni87/can_i_take_my_vape/
Gift Suggestion,Midnight-Syntax_007,0,1,2025-09-13 01:29:48,https://www.reddit.com/r/bangladesh/comments/1nfcftx/gift_suggestion/
What if Dhaka was abandoned and nature took it back? 🌿 A mysterious AI short film I made,Competitive-Essay798,0,16,2025-09-03 18:18:57,https://youtu.be/N2-b-XXWxfA?si=0Nbyz6Ez2WWLG66g
