title,author,upvotes,comments,date,url
A Bangladeshi couple who died in the 9/11 attacks.,Maverick_00x,557,54,2025-11-11 15:31:13,https://i.redd.it/nht3sj3gkl0g1.jpeg
I think I finally understand why Indians get so much hate and why many Bangladeshis dislike them,forgotten-daoist,313,139,2025-10-05 23:09:24,https://www.reddit.com/r/bangladesh/comments/1nytum0/i_think_i_finally_understand_why_indians_get_so/
Bangladesh wins,HinduShibir,218,12,2025-11-18 22:49:47,https://i.redd.it/taw42xk2p12g1.jpeg
পোশাক নিয়ে কটুক্তিকারীকে জুতাপেটা করলেন তরুণী,AtikulIslam4142,207,93,2025-10-29 16:50:00,https://www.reddit.com/r/bangladesh/comments/1oj1995/পশক_নয়_কটকতকরক_জতপট_করলন_তরণ/
⚠️ Top-listed criminal shot dead in broad daylight,AtikulIslam4142,185,44,2025-11-10 14:55:29,https://v.redd.it/iolsj0w49e0g1
"A peanut seller counts his loss as his Tk3,000....",Plastic_Repeat_995,124,6,2025-11-09 15:56:35,https://i.redd.it/cktvhqjve70g1.png
Imagine if Dhaka still looked like this...,maproomzibz,117,32,2025-10-20 01:47:40,https://i.redd.it/shw7y3ieh4wf1.png
Which restaurant would it be in Dhaka?,Saif10ali,112,36,2025-11-15 20:39:13,https://i.redd.it/b9pbuoyy891g1.jpeg
"As a Hindu Bangladeshi, it's so hard to have conversations with people about Bangladesh",LeadingSea6037,107,28,2025-10-25 11:54:42,https://www.reddit.com/r/bangladesh/comments/1ofjxl6/as_a_hindu_bangladeshi_its_so_hard_to_have/
"Today's editorials in Pakistan's Dawn (""Ties That Bind"") and Tribune (""Reset with Dhaka"") on the FM’s BD visit expose their mindset. Both dismiss 1971 as a mere ""tragedy,"" avoiding true apology for genocide. Not shockingly, their tone mirrors their own collaborators’ stance!",TasinMAHDI,106,32,2025-08-27 09:07:55,https://www.reddit.com/gallery/1n1629s
ডাকসু এবং অন্যান্য নির্বাচনে ছাত্র শিবিরকে ভোট দিবেন যে কারণে,fogrampercot,83,41,2025-09-07 20:15:02,https://www.reddit.com/r/bangladesh/comments/1nauanz/ডকস_এব_অনযনয_নরবচন_ছতর_শবরক_ভট_দবন_য_করণ/
"Students of Ideal, Dhaka colleges reach peace agreement; City College missing from truce effort",Necessary-Hunt6104,82,24,2025-11-09 15:53:45,https://i.redd.it/srzvgb2le70g1.png
Kinda proud of this pic I took a couple of days ago,ComfyNeo,81,7,2025-09-12 20:30:31,https://i.redd.it/zcl2ba65vqof1.jpeg
‼️Crude bombs exploded at 4 locations in Dhaka,AtikulIslam4142,80,25,2025-11-10 15:37:37,https://i.redd.it/j7we8xhoge0g1.jpeg
Dhaka Metro costs 5 times India's: Jica review sought to cut millions,Necessary-Hunt6104,69,23,2025-10-26 11:35:12,https://i.redd.it/u7tqzoxq7exf1.jpeg
"Dear Bangladeshi brothers, please take care not to harm us",SquarePromise2707,67,36,2025-09-21 16:28:52,https://www.reddit.com/r/bangladesh/comments/1nmoi8c/dear_bangladeshi_brothers_please_take_care_not_to/
HISTORIC VICTORY FOR THE COUNTRY!!!,Plastic_Repeat_995,66,9,2025-11-18 22:50:10,https://www.reddit.com/r/bangladesh/comments/1p0h1s7/historic_victory_for_the_country/
The Daily Star Caught Red-Handed using AI-written Article,AtikulIslam4142,63,19,2025-11-02 18:19:22,https://www.reddit.com/r/bangladesh/comments/1omftpq/the_daily_star_caught_redhanded_using_aiwritten/
Horrible experience at Dhaka to Dubai flight with emirates,Former-Type1623,63,35,2025-10-07 17:09:50,https://www.reddit.com/r/bangladesh/comments/1o0bqov/horrible_experience_at_dhaka_to_dubai_flight_with/
Wtf is happening in Bangladesh?,General-Dog4722,62,55,2025-10-11 19:45:52,https://www.reddit.com/r/bangladesh/comments/1o3w1pj/wtf_is_happening_in_bangladesh/
Probe blames pilot error for Milestone crash; all Air Force training to shift outside Dhaka,PrintRealistic6750,55,25,2025-11-05 16:36:41,https://i.redd.it/50k19bjm2fzf1.png
"Dhaka, Bangladesh",VapeyMoron,53,9,2025-08-25 23:30:45,https://i.redd.it/hdovi0i3x5lf1.jpeg
‘No one stood up for her’: Bus helper arrested for hitting woman,fogrampercot,53,13,2025-10-31 16:35:59,https://www.thedailystar.net/news/bangladesh/news/no-one-stood-her-bus-helper-arrested-hitting-woman-4023751
Why do our national subreddits have such low member counts?,the-machine-m4n,53,85,2025-09-08 19:21:39,https://www.reddit.com/r/bangladesh/comments/1nbnlbk/why_do_our_national_subreddits_have_such_low/
Why is Bangladesh so shitty?,Vigilante-225,50,49,2025-10-23 09:24:56,https://www.reddit.com/r/bangladesh/comments/1odsu0i/why_is_bangladesh_so_shitty/
My Story,Budget_Platform_3736,47,37,2025-11-07 13:35:35,https://www.reddit.com/r/bangladesh/comments/1oqo6u5/my_story/
"""baap ka beta, sipahi ka ghora""",KopaShamsur,47,6,2025-09-10 19:42:06,https://i.redd.it/jlmr15shccof1.png
I (26M) was invited to Bangladesh by someone I met while traveling,Fantastic_Dust_5926,44,21,2025-10-06 07:18:15,https://www.reddit.com/r/bangladesh/comments/1nz5tp4/i_26m_was_invited_to_bangladesh_by_someone_i_met/
Is RETINA a Jamaati organization?,NoSpeaker324,39,24,2025-10-20 17:56:03,https://www.reddit.com/r/bangladesh/comments/1obh1sl/is_retina_a_jamaati_organization/
Looking for like minded people!,Sam_Monsterclaw,37,47,2025-10-18 21:24:14,https://www.reddit.com/r/bangladesh/comments/1o9yoha/looking_for_like_minded_people/
How Yunus Deceived BNP at the Last Minute,Alone-Attention-2139,35,35,2025-11-15 18:31:25,https://www.reddit.com/r/bangladesh/comments/1oxqjxw/how_yunus_deceived_bnp_at_the_last_minute/
"Dhaka airport fire: Businesses fear over $1 billion impact on imports, exports",Necessary-Hunt6104,33,3,2025-10-18 22:51:45,https://i.redd.it/q1kryyb5hwvf1.jpeg
Safe to visit Bangladesh as a Pakistani?,Fondant_Decent,32,40,2025-08-29 16:02:21,https://www.reddit.com/r/bangladesh/comments/1n33alt/safe_to_visit_bangladesh_as_a_pakistani/
My 28 months baby still not talking :(,Fancy-Day3847,32,17,2025-11-09 14:43:02,https://www.reddit.com/r/bangladesh/comments/1osedtk/my_28_months_baby_still_not_talking/
Wanna start a paintball business,SiaM_AhameD21,30,6,2025-10-25 21:54:04,https://i.redd.it/b0dkgm545axf1.jpeg
Abduction or staged drama?,AtikulIslam4142,29,31,2025-10-28 01:05:53,https://www.reddit.com/r/bangladesh/comments/1ohnd6w/abduction_or_staged_drama/
‘৫ আগস্টে আমরা পুলিশ মেরে ঝুলিয়ে রেখেছি’,AtikulIslam4142,27,2,2025-10-30 18:16:37,https://www.reddit.com/r/bangladesh/comments/1ojy2iv/৫_আগসট_আমর_পলশ_মর_ঝলয়_রখছ/
"How is the situation in Dhaka right now for moderate, agnostic/atheist women? Coming from a Bangladeshi immigrant woman who left in 2012 and hasn’t been back for an extended period of time since",nymeria_the_direwolf,25,17,2025-09-21 08:01:11,https://www.reddit.com/r/bangladesh/comments/1nmfw45/how_is_the_situation_in_dhaka_right_now_for/
Is it high time we should detach ourselves from this cursed country?,Due_Butterfly_2114,24,12,2025-10-03 13:29:44,https://www.reddit.com/r/bangladesh/comments/1nwsky2/is_it_high_time_we_should_detach_ourselves_from/
"Unseen photographs of people struggling for liberation in 1971, which resulted in the creation of a sovereign Bangladesh.",TasinMAHDI,24,5,2025-08-29 16:56:51,https://www.reddit.com/r/bangladesh/comments/1n348p4/unseen_photographs_of_people_struggling_for/
Massacre in Dhaka!,Gold1Smith,24,25,2025-11-06 17:12:20,https://i.redd.it/x1zd0mjxdmzf1.jpeg
Why doesn’t Bangladesh have a soft power strategy?,Lampedusan,24,29,2025-11-05 11:02:18,https://www.reddit.com/r/bangladesh/comments/1oou4fh/why_doesnt_bangladesh_have_a_soft_power_strategy/
How to stay safe in Dhaka while doing UG,Worth-Gene,23,17,2025-09-24 16:31:11,https://www.reddit.com/r/bangladesh/comments/1np8lmq/how_to_stay_safe_in_dhaka_while_doing_ug/
Dhaka University's admission notice mentions Hijras as disabled,AntiAgent006,23,16,2025-10-30 21:55:31,https://i.redd.it/44ixesn2u9yf1.jpeg
Jagannath University student found dead in Old Dhaka building,Necessary-Hunt6104,23,2,2025-10-19 20:27:04,https://i.redd.it/4bg1ia39w2wf1.jpeg
"Will contest election from Dhaka, resignation depends on govt's decision: Asif Mahmud",PrintRealistic6750,22,12,2025-11-09 19:32:34,https://i.redd.it/qa0omg5oh80g1.jpeg
BNP's Shafiqul Islam likely to face Jamaat chief Shafiqur in Dhaka-15,PrintRealistic6750,21,7,2025-11-03 19:56:45,https://i.redd.it/7dmgyq5is1zf1.png
"Why is the Comilla, Noakhali and Chandpur regions so densely populated, outside of Dhaka region? I thought the whole Barisal and Khulna divisions were more dense",maproomzibz,20,9,2025-10-27 10:32:55,https://i.redd.it/q2kyw9ud1lxf1.png
Is your family’s income halal?,United-Life7473,19,50,2025-10-27 19:55:45,https://www.reddit.com/r/bangladesh/comments/1ohf2mo/is_your_familys_income_halal/
Challenges in Policing (part 2): Those who provide security live without dignity,AtikulIslam4142,19,4,2025-10-29 19:02:01,https://www.reddit.com/r/bangladesh/comments/1oj3wxl/challenges_in_policing_part_2_those_who_provide/
visited Bangladesh,loserinlifee,18,3,2025-10-29 20:54:50,https://www.reddit.com/r/bangladesh/comments/1oj6ph0/visited_bangladesh/
"BAF Shaheen College, Dhaka",Plastic_Repeat_995,18,2,2025-11-04 15:22:45,https://www.reddit.com/gallery/1oo2xj2
Property inheritance to our child who is not a Bangladeshi citizen.,Hawk_KL01,18,15,2025-11-12 17:12:51,https://www.reddit.com/r/bangladesh/comments/1ov2e8w/property_inheritance_to_our_child_who_is_not_a/
What are your honest thoughts on marriage in Bangladesh today?,BirdApprehensive9273,16,22,2025-10-25 05:15:55,https://www.reddit.com/r/bangladesh/comments/1ofcejn/what_are_your_honest_thoughts_on_marriage_in/
What if Bangladesh actually had high-speed trains(250-350km/hour)?,SheehabMuhammad,16,35,2025-11-11 01:06:11,https://www.reddit.com/r/bangladesh/comments/1otmrhf/what_if_bangladesh_actually_had_highspeed/
"Over a hundred primary school teachers were injured as police used batons, sound grenades, tear gas, and water cannons",Plastic_Repeat_995,15,3,2025-11-10 16:44:44,https://www.reddit.com/r/bangladesh/comments/1otal21/over_a_hundred_primary_school_teachers_were/
Jobless for 10 months now.. Anyone else going through a similar struggle?,Condizero,15,8,2025-10-18 00:59:14,https://www.reddit.com/r/bangladesh/comments/1o99yz9/jobless_for_10_months_now_anyone_else_going/
Peace agreement before GTA VI,Sweaty_Topic8036,13,1,2025-11-10 21:13:17,https://i.redd.it/9zqr0tak4g0g1.jpeg
Decent Bars in Dhaka,mid20sman,13,7,2025-09-05 14:24:33,https://www.reddit.com/r/bangladesh/comments/1n8zlmr/decent_bars_in_dhaka/
Crude bombs exploded at four separate locations in Dhaka this morning (10 November),Plastic_Repeat_995,13,8,2025-11-10 16:06:55,https://www.reddit.com/r/bangladesh/comments/1ot9zry/crude_bombs_exploded_at_four_separate_locations/
DUCSU 2025 - Analysis Of Shibir's Landslide Victory And Aftermath,fogrampercot,12,13,2025-09-12 03:40:24,https://www.reddit.com/r/bangladesh/comments/1nelg0n/ducsu_2025_analysis_of_shibirs_landslide_victory/
About freetime,Sungodnika04,12,23,2025-09-14 00:24:20,https://www.reddit.com/r/bangladesh/comments/1ng4ulr/about_freetime/
Reality of the Hsc Result,anonimosus12,11,10,2025-10-16 21:39:19,https://www.reddit.com/r/bangladesh/comments/1o89ilv/reality_of_the_hsc_result/
Bangladeshi cuisine,No-Plate-113,11,10,2025-10-09 14:52:16,https://www.reddit.com/r/bangladesh/comments/1o20u7m/bangladeshi_cuisine/
Why the r/Dhaka is almost twice as big as r/Bangladesh?,Plastic_Repeat_995,11,38,2025-10-22 08:30:32,https://www.reddit.com/r/bangladesh/comments/1ocwfdr/why_the_rdhaka_is_almost_twice_as_big_as/
Need advice: finding it hard to deal with my mindset about women,OrneryExpression6918,11,65,2025-09-07 11:48:28,https://www.reddit.com/r/bangladesh/comments/1nalc8n/need_advice_finding_it_hard_to_deal_with_my/
Attempt BCS or Try to move abroad ?,weirdcomponent,10,12,2025-09-09 12:58:37,https://www.reddit.com/r/bangladesh/comments/1ncc0jy/attempt_bcs_or_try_to_move_abroad/
Relationship advice,Famous_Divide6434,10,29,2025-10-15 11:29:13,https://www.reddit.com/r/bangladesh/comments/1o72m5n/relationship_advice/
Awful Experience,snythxox,10,0,2025-10-20 16:46:24,https://www.reddit.com/r/bangladesh/comments/1obfvsy/awful_experience/
From Nimtoli 2010 to Mirpur 2025 – how many more fires will it take for Dhaka to wake up?,Redwanul-Haque2467,10,1,2025-10-16 09:32:48,https://www.reddit.com/r/bangladesh/comments/1o7vuj7/from_nimtoli_2010_to_mirpur_2025_how_many_more/
"Need a Part-Time Personal Assistant (Dhaka-Based, Remote)",ovosmans89,10,17,2025-10-11 11:54:05,https://www.reddit.com/r/bangladesh/comments/1o3ntho/need_a_parttime_personal_assistant_dhakabased/
Challenges in Policing (part 1): Inside the broken funding of BD police,AtikulIslam4142,10,2,2025-10-28 20:06:52,https://www.reddit.com/r/bangladesh/comments/1oiabnu/challenges_in_policing_part_1_inside_the_broken/
"Affordable, quiet and green: Electric shuttle buses set a model for Dhaka’s residential areas",Alone-Attention-2139,9,2,2025-09-12 19:17:18,https://www.tbsnews.net/features/panorama/affordable-quiet-and-green-electric-shuttle-buses-set-model-dhakas-residential
Scene of Dhaka in 1958.,TasinMAHDI,9,4,2025-09-22 14:36:33,https://www.reddit.com/r/bangladesh/comments/1nnh1cp/scene_of_dhaka_in_1958/
Made a simple news aggregator for staying updated about Bangladesh 🇧🇩,namkhalinai,9,6,2025-10-18 07:15:30,https://bangladesh-news.pages.dev/
How do you manage your budget in Dhaka with Family and mid level pay?,UnlikelySecret2629,9,2,2025-09-20 15:01:45,https://www.reddit.com/r/bangladesh/comments/1nlta27/how_do_you_manage_your_budget_in_dhaka_with/
How do you consistently help yourself to be good all alone?,dhonbolsen,9,5,2025-09-08 20:49:06,https://www.reddit.com/r/bangladesh/comments/1nbprfi/how_do_you_consistently_help_yourself_to_be_good/
If you seek fund for your school/college/university education you may knock me,RunAffectionate1997,9,3,2025-09-11 02:36:50,https://www.reddit.com/r/bangladesh/comments/1ndpkvx/if_you_seek_fund_for_your_schoolcollegeuniversity/
Dhaka Birdwatching ঢাকায় বার্ডওয়াচিং,Macula-Densa,8,3,2025-09-17 06:28:36,https://www.reddit.com/r/bangladesh/comments/1niymh0/dhaka_birdwatching_ঢকয_বরডওযচ/
Places to go for a nightout drive in dhaka,Showmik27,8,5,2025-10-10 05:15:19,https://www.reddit.com/r/bangladesh/comments/1o2kznd/places_to_go_for_a_nightout_drive_in_dhaka/
Need suggestions for trusted shipping agents from China to Bangladesh,Drawing-Live,8,10,2025-09-22 16:40:41,https://www.reddit.com/r/bangladesh/comments/1nnj0yc/need_suggestions_for_trusted_shipping_agents_from/
Seeking advice to get rid of excessive sweating,ais_21,8,14,2025-09-23 11:53:52,https://www.reddit.com/r/bangladesh/comments/1no9i0q/seeking_advice_to_get_rid_of_excessive_sweating/
"No friends, loosing sanity",iam_tourist,8,5,2025-09-27 22:38:54,https://www.reddit.com/r/bangladesh/comments/1nrzsqv/no_friends_loosing_sanity/
Why Shibir-backed candidates won the Ducsu polls,Alone-Attention-2139,8,1,2025-09-10 23:04:53,https://www.thedailystar.net/news/bangladesh/politics/student-union-election/news/why-shibir-backed-candidates-won-the-ducsu-polls-3982851
[AskMeAnything] Hello CS undergrads and recent grads!,Consistent_Deer5403,8,27,2025-10-10 18:41:20,https://www.reddit.com/r/bangladesh/comments/1o2zt2c/askmeanything_hello_cs_undergrads_and_recent_grads/
Your Top 5 Trusted Phone Shops in Dhaka,Electrical_Example28,8,4,2025-11-18 07:05:16,https://www.reddit.com/r/bangladesh/comments/1ozy9e3/your_top_5_trusted_phone_shops_in_dhaka/
"Dhaka today.... No, more like everyday.",biscute2077,8,0,2025-11-13 21:24:47,https://i.redd.it/biczw6icl11g1.jpeg
Anyone using Finasteride or Minoxidil? Need advice and good doctor recommendations,pulokjk,7,9,2025-11-08 23:36:09,https://www.reddit.com/r/bangladesh/comments/1orvd4f/anyone_using_finasteride_or_minoxidil_need_advice/
Places to get the best Mishti around Dhaka?,clarkeanator,7,8,2025-11-15 12:53:03,https://www.reddit.com/r/bangladesh/comments/1oxkzei/places_to_get_the_best_mishti_around_dhaka/
Where to buy ladies western clothing in Dhaka? Wide pants and shirts.,ElNinoMaravilla,7,14,2025-09-23 20:22:47,https://www.reddit.com/r/bangladesh/comments/1noir8i/where_to_buy_ladies_western_clothing_in_dhaka/
BSF Push In: How an Assamese woman ended up in a slum in Dhaka,yasserius,7,2,2025-09-26 13:02:58,https://www.youtube.com/watch?v=ZgEDl_lpr5I
Any Duolingo users here in Dhaka?,Far-Following3742,7,11,2025-10-02 01:17:53,https://www.reddit.com/r/bangladesh/comments/1nvhnut/any_duolingo_users_here_in_dhaka/
"ফ্যাক্টরি পুড়ে, বিমানবন্দর পুড়ে, নির্বাচন দিয়ে বাঁচান: বিটিএমএ সভাপতি | BTMA | Dhaka | Somoy TV",maifee,7,1,2025-11-04 19:40:09,https://youtu.be/vIWal0m-Wx8?si=SA8-gcWLyQuiIXZK
"Anybody got the ""Dhaka Racing 2003"" game?",VapeyMoron,7,3,2025-11-03 23:28:32,https://www.reddit.com/r/bangladesh/comments/1oni0r8/anybody_got_the_dhaka_racing_2003_game/
Fire at Dhaka airport's cargo section; Connecting the dots; Why does this whole thing feel so orchestrated?,Status_Revolution_25,7,3,2025-10-18 17:24:53,https://www.thedailystar.net/news/bangladesh/accidents-fires/news/fire-breaks-out-near-cargo-complex-dhaka-airport-4013021
Any querier service to send iPad outside Dhaka.,muaz_moss,7,3,2025-11-10 07:03:44,https://www.reddit.com/r/bangladesh/comments/1ot0cii/any_querier_service_to_send_ipad_outside_dhaka/
Animal rescue/shelter in Dhaka?,Tall_Monster,7,2,2025-11-09 21:13:06,https://www.reddit.com/r/bangladesh/comments/1oslsdl/animal_rescueshelter_in_dhaka/
Its abt outfit,rrrihaaa,7,4,2025-11-12 01:12:08,https://www.reddit.com/r/bangladesh/comments/1ouihfn/its_abt_outfit/
Looking for open minded affordable psychiatrists who specialize in adhd and autism in Dhaka.,Andromeda-K-,6,3,2025-10-18 23:15:29,https://www.reddit.com/r/bangladesh/comments/1oa1g4u/looking_for_open_minded_affordable_psychiatrists/
Indian Transit Visa for Bangladeshi,lonelykidfrom2006,6,1,2025-10-25 13:50:48,https://www.reddit.com/r/bangladesh/comments/1oflrmh/indian_transit_visa_for_bangladeshi/
HOW TO GET INDIAN MEDICAL VISA AT PRESENT [ Im frustrated😫 ],joysutradhar_,6,3,2025-09-28 11:52:33,https://www.reddit.com/r/bangladesh/comments/1nsgmxw/how_to_get_indian_medical_visa_at_present_im/
Backpacking Bangladesh,BriefVeterinarian106,6,6,2025-09-08 13:56:13,https://www.reddit.com/r/bangladesh/comments/1nbhpmm/backpacking_bangladesh/
"Dhaka &amp; Chittagong Airports are major hub for drugs,Gold trafficking in south east Asia! We are seeing tip of the iceberg in regards of seizing Drugs &amp; Gold!",Asleep-Jellyfish007,6,2,2025-08-26 21:14:34,https://i.redd.it/7vxycqg4rdlf1.jpeg
Safe places for Bangladeshi girl expats to live in Dhaka for a month?,motiontosleep,6,14,2025-10-03 18:08:57,https://www.reddit.com/r/bangladesh/comments/1nwxc3i/safe_places_for_bangladeshi_girl_expats_to_live/
Kitten Rescue Urgent!!!!,mahin1374,6,2,2025-09-18 12:12:03,https://www.reddit.com/gallery/1nk0lok
Buying an apartment in dhaka,Superzues09,6,10,2025-10-22 13:02:05,https://www.reddit.com/r/bangladesh/comments/1od1bmc/buying_an_apartment_in_dhaka/
"Protibastob from Dhaka Comics - An anthology of comics from various underrated artists, I love these artists so much, they're deserve so much more recognition, and I love the way Bangla comics is going, maybe one day it will become a world famous genre like manga",yasserius,6,0,2025-11-18 12:54:50,https://v.redd.it/2rcejh3kqy1g1
বাংলাদেশের ফুটবল স্টেডিয়ামের চারদিকে এতো বিশাল খালি জায়গা থাকে কেন? যেখানে আধুনিক বিশ্বের কোনো স্টেডিয়ামে এমনটা দেখা যায় না।,Massivehit,6,12,2025-11-19 15:54:57,https://www.reddit.com/gallery/1p13ij3
Sending a 20 kg parcel from Dhaka to Budapest — any affordable and reliable courier options?,PrimaryInspection969,6,1,2025-11-09 23:27:17,https://www.reddit.com/r/bangladesh/comments/1osp5us/sending_a_20_kg_parcel_from_dhaka_to_budapest_any/
"If you had 6 months rent-free in a prime Gulshan/Banani duplex, how would you use it to build a business?",Anushirvan,6,7,2025-11-11 00:28:17,https://www.reddit.com/r/bangladesh/comments/1otloqw/if_you_had_6_months_rentfree_in_a_prime/
Need advice,Fragrant_Drop7397,6,3,2025-11-08 22:31:26,https://www.reddit.com/r/bangladesh/comments/1ortrhs/need_advice/
Looking Suggestion for extra large size men clothes in Dhaka.,ais_21,6,12,2025-10-22 09:05:36,https://www.reddit.com/r/bangladesh/comments/1ocx53y/looking_suggestion_for_extra_large_size_men/
Where can I find 99% Isopropyl alcohol in Dhaka?,Expert_Point_7816,6,4,2025-10-31 01:53:43,https://www.reddit.com/r/bangladesh/comments/1ok9ux0/where_can_i_find_99_isopropyl_alcohol_in_dhaka/
WHAT IS YOUR THOUGHT ABOUT FARMGATE METRO RAIL INCIDENT,Flat_South_8384,6,1,2025-10-27 11:25:20,https://www.reddit.com/r/bangladesh/comments/1oh6954/what_is_your_thought_about_farmgate_metro_rail/
Seeking tour guidance,Certain-Chemical470,6,3,2025-10-08 05:22:02,https://www.reddit.com/r/bangladesh/comments/1o0un7z/seeking_tour_guidance/
More flights diverted to Ctg as Dhaka airport shuts down after cargo zone fire,maifee,5,1,2025-10-18 17:47:22,https://www.tbsnews.net/bangladesh/four-flights-diverted-ctg-after-fire-dhaka-airport-cargo-zone-1263531?amp
Bangladesh travel for uk female and Nepali boy in January ?,Soft-Dance-8601,5,5,2025-11-05 03:55:50,https://www.reddit.com/r/bangladesh/comments/1ooklaw/bangladesh_travel_for_uk_female_and_nepali_boy_in/
"Bangladesh, India to hold talks in Delhi on Ganges water-sharing treaty on Tuesday",Alone-Attention-2139,5,0,2025-09-07 19:30:07,https://www.tbsnews.net/bangladesh/bangladesh-india-hold-talks-delhi-ganges-water-sharing-treaty-1230596
Suggest a authentic Notary agency,dark_98_rider,5,0,2025-09-28 11:10:48,https://www.reddit.com/r/bangladesh/comments/1nsfydt/suggest_a_authentic_notary_agency/
Need suggestions for Resort near Dhaka (for Honeymoon),Maybe_some,5,5,2025-11-09 10:55:24,https://www.reddit.com/r/bangladesh/comments/1osai6z/need_suggestions_for_resort_near_dhaka_for/
Buffet suggestions in Dhaka,Few-Pumpkin3842,5,0,2025-11-10 21:26:24,https://www.reddit.com/r/bangladesh/comments/1otgoow/buffet_suggestions_in_dhaka/
আমি Windows &amp; Android user.,seowithriazul,5,2,2025-11-01 08:39:38,https://i.redd.it/r523t19t5kyf1.png
BNP candidates for JS polls: Who’s in the race for which seat in Dhaka?,PrintRealistic6750,5,2,2025-11-03 23:44:16,https://i.redd.it/vxqvezo3x2zf1.png
Best thrifting place in Dhaka??,DebtLess2374,5,1,2025-10-30 16:45:34,https://www.reddit.com/r/bangladesh/comments/1ojwbts/best_thrifting_place_in_dhaka/
Seeking doctor recommendation for PCOS,nasia_musarat,5,1,2025-10-18 16:04:37,https://www.reddit.com/r/bangladesh/comments/1o9rwcs/seeking_doctor_recommendation_for_pcos/
"Rajuk College, Dhaka admission exam 2025",Silly-Bed2231,5,3,2025-10-20 22:55:50,https://www.reddit.com/r/bangladesh/comments/1obnk32/rajuk_college_dhaka_admission_exam_2025/
"Looking to Donate Books in Dhaka , Any Suggestions?",panic_structure,5,1,2025-11-18 22:24:55,https://www.reddit.com/r/bangladesh/comments/1p0gdf8/looking_to_donate_books_in_dhaka_any_suggestions/
Looking for a Job.,iamnoman18,5,0,2025-11-18 11:01:00,https://www.reddit.com/r/bangladesh/comments/1p036wb/looking_for_a_job/
Passport Correction and Renewal in BD,Sensitive_Win_9094,5,3,2025-11-18 13:01:38,https://www.reddit.com/r/bangladesh/comments/1p05anv/passport_correction_and_renewal_in_bd/
Best place for cataract surgery in Dhaka?,Available-Ad-1014,5,1,2025-11-07 21:14:11,https://www.reddit.com/r/bangladesh/comments/1oqx0m5/best_place_for_cataract_surgery_in_dhaka/
Trying to collect foreign currency notes — where can I actually get my first ones in Dhaka?,Inevitable-Koala6828,5,1,2025-11-15 22:52:37,https://www.reddit.com/r/bangladesh/comments/1oxwmc6/trying_to_collect_foreign_currency_notes_where/
Gulshan Is Not Dhaka,Atel_mamu,5,0,2025-11-16 08:27:55,https://counterpointbd.com/Gulshan-Is-Not-Dhaka
One of my relative's liver is failing and doctor has suggested liver transplantation. Any suggestions???,MushfiqurRF,5,3,2025-09-26 02:11:35,https://www.reddit.com/r/bangladesh/comments/1nqh8p7/one_of_my_relatives_liver_is_failing_and_doctor/
Travel during elections,EstablishmentBrief90,5,3,2025-09-24 22:29:20,https://www.reddit.com/r/bangladesh/comments/1npgu2y/travel_during_elections/
Can I study BSc in Computer Science in Australia with a 4-year Diploma in Engineering (Computer Science &amp; Technology)?,ArthurXP002,5,2,2025-09-11 02:13:35,https://www.reddit.com/r/bangladesh/comments/1ndp06h/can_i_study_bsc_in_computer_science_in_australia/
HOW TO GET INDIAN MEDICAL VISA AT PRESENT,joysutradhar_,5,9,2025-10-01 11:14:41,https://www.reddit.com/r/bangladesh/comments/1nuznqu/how_to_get_indian_medical_visa_at_present/
who is up for hangouts in dhaka,No_idea_duh,5,24,2025-10-15 16:11:12,https://www.reddit.com/r/bangladesh/comments/1o7719m/who_is_up_for_hangouts_in_dhaka/
Whats the deal with Stalls in Rabindra Sharabar in Dhanmondi,Ajwad6969,5,0,2025-10-15 23:49:39,https://www.reddit.com/r/bangladesh/comments/1o7hz1r/whats_the_deal_with_stalls_in_rabindra_sharabar/
Which steak house is the best in Dhaka...,Cryptographer47051,5,2,2025-09-03 20:00:53,https://www.reddit.com/r/bangladesh/comments/1n7fmjx/which_steak_house_is_the_best_in_dhaka/
seeking advice about taking a decision in life,ArachnidMotor1538,4,5,2025-09-06 02:38:21,https://www.reddit.com/r/bangladesh/comments/1n9gcii/seeking_advice_about_taking_a_decision_in_life/
